,Title,Alias,Link,Seller,Price,Rating,Review Count,Availability,Features,Image Data,Image Extension
0,"CyberpowerPC Tracer IV R Xtreme 17.3"" Gaming Notebook, AMD Ryzen 7 4800H 2.9GHz, GeForce RTX 2060 6GB, 16GB DDR4, 500GB PCI-E NVMe SSD, WiFi, Bluetooth & Win 10 Home (GTX99815)",Cyberpower,https://www.amazon.com/gp/slredirect/picassoRedirect.html/ref=pa_sp_atf_aps_sr_pg1_1?ie=UTF8&adId=A10015981F08HDHFBLCA2&url=%2FCyberpowerPC-Notebook-GeForce-Bluetooth-GTX99815%2Fdp%2FB089WLKNDH%2Fref%3Dsr_1_1_sspa%3Fdchild%3D1%26keywords%3Dgaming%2Bpc%26qid%3D1614637140%26sr%3D8-1-spons%26psc%3D1&qualifier=1614637140&id=4780704931965550&widgetName=sp_atf,CyberpowerPC,"$1,349.99",4.7,9,Only 2 left in stock - order soon.,"['System: AMD Ryzen 7 4800H 2.9GHz 8-Core | AMD Renoir H Chipset | 16GB DDR4 | 500GB PCI-E NVMe SSD | Genuine Windows 10 Home 64-bit', 'Graphics: NVIDIA GeForce RTX 2060 6GB Video Card | FHD IPS Anti-Glare 17.3"" LED Display | Audio: Stereo Speakers', 'Connectivity: 2x USB 3.1 Gen1 | 1x USB 2.0 | 1x USB Type C | 1x HDMI | 2x mini DP | 1x RJ-45 Ethernet 10/100/1000 | Wi-Fi 6 | Bluetooth 5', 'Special Feature: RGB Keyboard | 1920x1080 FHD 144Hz Narrow Border IPS Anti-Glare LED Display | 720P HD Webcam', '1 Year Limited Warranty & Lifetime Toll Free tech support Services']",https://images-na.ssl-images-amazon.com/images/I/71uRsMfshTL.__AC_SX300_SY300_QL70_ML2_,jpg
1,"Webcam with Microphone, Wide View Angle 30 FPS Full HD Webcam for Streaming Online Gaming Class Conference Recording Skype Zoom FaceTime(Bonsaii WE8001)",Webcamwit,https://www.amazon.com/gp/slredirect/picassoRedirect.html/ref=pa_sp_atf_aps_sr_pg1_1?ie=UTF8&adId=A0783398VR7GZSMLMC7Q&url=%2FMicrophone-Privacy-Conference-Teaching-Bonsaii%2Fdp%2FB08FDNXXTS%2Fref%3Dsr_1_2_sspa%3Fdchild%3D1%26keywords%3Dgaming%2Bpc%26qid%3D1614637140%26sr%3D8-2-spons%26psc%3D1&qualifier=1614637140&id=4780704931965550&widgetName=sp_atf,bonsaii,$59.99,4.6,8,In Stock.,"['【1080P 30fps Full HD Webcam】High dynamic technology can consistently provide high-definition picture and built-in autofocus technology can make your images stay clear. Face cam Especially great for premium quality business meeting, online teaching and home learning, or social gaming video call.', '【2 in 1：Webcam with Microphone】This design satisfies your basic facetime need. It is great for conveying the information on video call. Web camera can capture your voice from background noise. Make your voice could be heard clearly.', '【Anti-peeping Privacy Cover Design】Unlike other web camera, bonsai’s has its own privacy cover to make you have a safe internet using experience. You can cover the camera when the webcam is not in use. Protect your privacy perfectly from any spying.', '【Driver-Free: Plug and Use】 Just plug your USB interface into to your device with no additional driver needed. Laptop camera compatible with most operation systems: Windows, Mac OS, Android and more. Streaming webcam Supports a works with Zoom/Skype/Yahoo/Messenger, etc.', '【Reliable After-sale Customer Service】We offer this laptop camera 1 year of protection. If you have any questions about this webcam, please feel free to contact us. We will provide you with a satisfying solution.']",https://images-na.ssl-images-amazon.com/images/I/71K5AIt22UL.__AC_SX300_SY300_QL70_ML2_,jpg
2,"iBUYPOWER Gaming PC Computer Desktop Trace 4 9310 (AMD Ryzen 5 3600 3.6GHz, AMD Radeon RX 5500 XT 4GB, 8GB DDR4 RAM, 240GB SSD, Wi-Fi Ready, Windows 10 Home)",iBUYPOWER,https://www.amazon.com/iBUYPOWER-Computer-Desktop-Trace-9310/dp/B08FPL6S4Y/ref=sr_1_3?dchild=1&keywords=gaming+pc&qid=1614637140&sr=8-3,iBUYPOWER,$699.99,4.5,"1,352",In Stock.,"['System: AMD Ryzen 5 3600 3.6GHz (4.2GHz Max Turbo); 8GB DDR4 RAM; 240GB SSD; Genuine Windows 10 Home 64-bit', 'Graphics: AMD Radeon RX 5500 XT 4GB dedicated graphics card; VR ready; Display connectors: HDMI, DisplayPort', 'Connectivity: 4 x USB 3.0; 2 x USB 2.0; 1x RJ-45 Network Ethernet 10/100/1000; Audio: 7.1 Channel', 'Special Add-Ons: Tempered Glass RGB Gaming Case; 802.11AC Wi-Fi Included; 16 Color RGB lighting case; generic keyboard & mouse no bloatware', 'Warranty: 1 year parts & labor + free lifetime US tech support; Assembled in the U.S.A']",https://images-na.ssl-images-amazon.com/images/I/71CyfrhCZ1L.__AC_SX300_SY300_QL70_ML2_,jpg
3,"SkyTech Blaze II Gaming Computer PC Desktop – Ryzen 5 2600 6-Core 3.4 GHz, NVIDIA GeForce GTX 1660 TI 6G, 500G SSD, 8GB DDR4, RGB, AC WiFi, Windows 10 Home 64-bit",SkyTechBl,https://www.amazon.com/SkyTech-Blaze-Gaming-Computer-Desktop/dp/B07RL4K6CN/ref=sxin_9?ascsubtag=amzn1.osa.39cecfc2-e6e3-4ede-a252-5a29f45419c6.ATVPDKIKX0DER.en_US&creativeASIN=B07RL4K6CN&cv_ct_cx=gaming+pc&cv_ct_id=amzn1.osa.39cecfc2-e6e3-4ede-a252-5a29f45419c6.ATVPDKIKX0DER.en_US&cv_ct_pg=search&cv_ct_we=asin&cv_ct_wn=osp-single-source-earns-comm&dchild=1&keywords=gaming+pcs&linkCode=oas&pd_rd_i=B07RL4K6CN&pd_rd_r=f82d4488-ec9d-424b-8809-259fcb2aafc6&pd_rd_w=yCRCx&pd_rd_wg=KvZzb&pf_rd_p=35b32c02-1b41-4e49-9b89-0297af2446e1&pf_rd_r=JVYEJ10PS00ZVNSHVA3V&qid=1614637140&sr=1-1-64f3a41a-73ca-403a-923c-8152c45485fe&tag=geekcontent-20,Skytech Gaming,$999.99,4.5,987,In Stock.,"['Ryzen 5 2600 6-Core 3.4GHz (3.9 GHz Max Boost) CPU Processor | 500G SSD – Up to 30x Faster Than Traditional HDD | A320M Motherboard', 'NVIDIA GeForce GTX 1660 TI 6GB GDDR6 Video Card | 8 GB Gaming Memory DDR4 3000 with Heat Spreader | Windows 10 Home 64-bit', 'PCIe AC Wi-Fi with Antenna | No bloatware | 1 x HDMI, 1 x D-Sub, 1 x DVD-D | 4 x USB 3.1 Gen1 Ports, 2 x USB 2.0 | HD Audio and Mic | Free RGB Keyboard & Mouse', '3 x RGB RING Fans for Maximum Air Flow | Powered by 80 Plus Certified 500 Watt Power Supply | Skytech mATX Mid-Tower Tempered Glass Case', '1 Year Warranty on Parts and Labor | Lifetime Free Technical Support | Assemble in the USA | This Powerful Gaming PC Capable to Run Any of Your Favorite Game at 1080P High to Ultra Resolution with 60+ FPS Such As Apex Legends, Fortnite, Player Unknown Battleground (PUBG), Overwatch, CS:GO, Battlefield V, Anthem, The Division 2, and More']","/9j/4AAQSkZJRgABAQAAAQABAAD/2wCEAAwMDQsNCxAODBANEA4QExYRDRASGR8dFhsVHhgYEx4YFRsVFBwYGyAZHhsjKyQpIyA6LCYxGSYoRC5FOUsyLkIBCA4NDhITDhERExMREhYTJxsSES4cHR8TKQsfERYeFhcfEBYZHBAXIRcpDCMRCy8gKBwUJxYSERQeFg4bHTAeIP/AABEIASwA+QMBIgACEQEDEQH/xACqAAABBQEBAQAAAAAAAAAAAAAFAAEDBAYCBwgQAAIBAwEDBwgHBgcAAwEAAAECAwAEERIFITEGEyJBUXFyMjM0YYGRsbIUQlJzocHRByMkQ2KCFTVTdJKzwhZj4fABAQEAAwEBAAAAAAAAAAAAAAABAgMEBQYRAAIBAgMFBgQGAQUAAAAAAAABAgMREiFBBDFhcfAiUYGhsdETMkKRI1JicsHhMwUUQ4Ky/9oADAMBAAIRAxEAPwD1WlSpUAqVKlQCpUqVAKlSpUAqVKlQCpUqRIAySABxJoBUqEbR5W8nNnZWW7SaUfyoOm3vToisLf8A7Rrl8rsuzROyW5/JEoD1CqO0eUuwNmg/SryEv/pRdN/cleIPtzau0p0/xe7uprZ2w8MT82oHDIVAFJFDprOyBk+jTlimohXHEA9vrFUHom0f2jcV2TZn725/JEppuV+1500QCKDRlJCo/Eaq8r6q00X83xn4CqDR2e0tp3F2Wnup3JQ4y1HotsbXt9yTCUfYlGfceNZPZnpX9poy5q2Ka2w5TxTTCC+i5h23JIpyhbs7RR2HauzZnMazosgODHJ0W9zV5a4Vxh/Y3XUxQXqrFKQLpBiCb/UXqRj9odVYkPTaevKYbzaVmSIJ7iIqcMmTj2qd1GrflZtSLdcpBOO7S34bqgN5SoDbcrtlybrlZoD3al960dtr/Z92M21xBJ6lYavavlUA9KlSoBUqVKgFSpUqAVKlSoBUqVKgFSpUpZYYULzPHGg4s5AHvNAKlWa2jy55OWWVile8l+xbj4u2ErD3/wC0HbNxlbCCC0T7b9N6qTe4HrruiKXdlVV3szHAHeTQHaPLPk3YZX6T9JlH1LYa/wAdyV4TfbR2nfvm/u7m47A7koPCvkiqOAKWB6Xf/tF2jLldmWsNsvVJMdb1h77a22Npen3lxMPsFsJ7FXC0Mp99ALAFKu0jkd9Cjpcd+741LHADraU4RN2V35PqwCKoI0lEanK6iPJ//ahRjk1ae3IQaclzk6OvFVQMUB0a00R3SeP/AMiszWjj4P4h8q0AX2Yf4k+E0YbjQTZh/iv7TRtqyKRGoySKkJqI1SE9zcQzxKZSEnXc8h4Mva2OsdtDmt3fpRsrg8ChyKFbbPo69rtn3ULV5IzmN3XuNa2DRPHIu4g9xqA6l+0COuqMe076PcXEg7Hq2m1oG3TQafWlQBS221tm0xzF1KR9h+kPc1aK15a3qELeWsUva0ZKNWSWfZk3kShGPU4qT6OOMZV/Cc0B6ZacrdiXJVXaWBz1Sr+Yo1BfWNzkW88MhG5lVhqHevEV4o0A+uK5MfO4GopcLuilzjV2Kx+BoD26lWO5EbUuZTc7OvpJXmixLBzpJbRwZa2NAKlQ3lJt+Dk/ZJcSwvO0r6Io0ON+C29q8mv+XXKK8yLcxWUfZFvf2u9Ae1XFza2sZkupoYYxxeVgo97EVlNo8vdgWmVtjLev/wDUMJ/zevD7ie5upTJdzTTyfakYsfxNQ4FUG9v+X+3rrK2SwWKdqjXJ73rF3V3fXrmS9uJ537ZGJqvg10qMxwKFscDApySanEDaNZ3DOB6zUwijVwBvCjVJ1j8qzT0u0iFQIzcKkEJKF+peOd1WQ2lSyKqtKdKeoU+U69RiiG89r/hTIhEYANA1Ydt5UcAO81LphVjKqYjj3IftN7cimyeGQJJd7HrVPbSyo6QBKIcQjtbhncRWJTvLcMgyyb5CPqr2ccfhT5XAYAiGPdH/AFN8KjwclCwDN0p29XYM0+TkOEOeECf+jQHe8kjVmV98jD6i9m46fwqCWONkMijQijCHrc+6ui8eTGzgdczcST2DIrgvrV2KPwKx9She3OR8KAp1pI+Dd4+VazdaOPgf7fkWgCezPSx4TRx+NAtmn+LHhNG341kCM1Ga6NRmqDO7aP8AEWy+M/AVQNXNsn+Oth2IfjVWtbBHTV3XJqA4Ip1aRDlHZe409c0Bdj2lfR8XDjsYVaXa0bDE8A8SUHpqoNnsna1pHtS0nRykqOELN1xncVevYMjtFfNaeej8Qr6IoDG/tP8A8tsP9y3yV4/XsP7T/wDLLD/cn5K8eqA4bjXOTTsMmmxWQGJPWTTb8GnwaQ4GgEruCCpII4YqTn5cEE5DHL56+88aipUBaF0wYtpUHGlcdXvzTieHoghgq7z627TVOmoAisiMNzgNJvkPDC9g1YphIpYlFY6BiLqXvJBofSycYzuoC3zp5vQWCb8vjeSfhUbyhnDHU2N2/cPYFqCnwaAkMrcECKPUN/vOTXAJyN5pYpxjNAdmtGnk/wDH5FrOGtEnk+xfkWgCOzfS17jR1uNAdnelr3GjjVkgRmoTUhqKqDMbVbO0oh2LiuCKjvn1bUA7CKmrWCOuakrndUBHTVIRXBFAcU1dU1Acr56LxivoevnlfOx+MV9CZoDI/tP/AMqsf90fkavHa9m/aYM7Js/91/4avIYoVaN5G4IVXHfn9KAibRHKpC604sD+Io/BsAJKw2lcJEhg5+DQd7e8DyaAKV0upVmdiBCF7c8Mdea2CbJlhs0ubx3ldBmGMkkIvEgAk8K1zqRjZPe9yO6hs0qztijCK+ab3JdK/hvRnINl3U2vVmNUBKMRkMeoVJFsLaM2dBgz2F60N3cxwIY9bSjmxJCYlyuetX6lB7agae5tXcSfRllKqYoXwc53ZTdk769Ol/t/rU2/DfyudrX+mxur1qr/AD5KPhFtSM3cbL2ja556FsDiy7xQ/ca2a7SaG5SO/Btw/F8EoPEu/dVvauxrG7QS2JhS5ZdS80cwyjtWumWy05K9Cbk9abVpdd3qclSjS30ZOS1i8pGA0tjODg8DTVYdp0U28oZebY5jPENXVqkUs6LKSFYgYFeS00eeVgG6gakCom9+k32P1oqLKKBopLmQpE7gD1qCNXDszSu44xcPdC3c2bSHeCNGnOBoxWvErr1433FsCd7vuXjwUVdSwviNYiOMZANF7N7OZkS3iYOx4afcARWnjsrxyYhpTTvZmYbt2RuGTWZDKHk7fLZPdtLBoUKUVSTq1VQsrWCW3uZbhtDRoeZGcHXvxkd9aEX1gkM0UUk85bpIihsJMjBgzKNzKd439tAJXhmcvrWJ8OzAphSdxCqANK1QDN+N9aJOHsT5FrPucsTWgTyfYnyLQF/Z/pi9xo41ArD0xO40dbjWSBGahNSNVeRtMbN2KTVBkZyJNoa48sDIFG49laOy2YbjfM2hR5XYKJvsi22fsvZU8oAnnu0a6fJIwYZnC7zig97eyTSFICUgXcgWvMVWVW6p9laz8Wv4yGuaLM8OyoJBGuZD176huIbIoNC6T6jmhWKYZU5U4rcqTVu3JtevodUaqSacE15nbwOAWTpLVaicdwjLhlCydo4Gqs0ecuo8QrYm9TKpThZSpvEms1/TzVvq+6bKlNXVNWw4yMekQDtevoKvnwelweKvoOgM7+0Zc7Ktf9z/AOGrya3QnWrYEIw8vbuyAB3k1uuU+302qTYJbtGtrO2XLcSuUrKCOIJJlc5RvfgkH2GrZlTSabV13deYtgWBubh7kjEcBwnj4n/gKv3VxeXNzPmX6PDHFiCM4IkQfCrls/8AhvJV3Aw7RnB/rc0G6HMMGD3waBWjkwuYvF2du7fXnUe3UrVHui8MP564nrVpOnRpUVZYu1Pv06/6osRhybg2UAhhFuv0mOYYYjDZaMepc0tVvicwZltdMSm5lbDRNv3Lr6TYG/dUW0bgW6GO7InvGiRbZoSVUKd550Bt+azl1cXV3M0ty+WP1RuA7gK9I8gNXt7YSRzxyO13ISv0eTGBjgeAwMVQ2Ze/RLhFlZ/ojN0+1P6x3VFbWTzwNMrRiNGVGGenkkAYUbzV232cs909ksgLsp5rIK5lA1KuG3jNelSc04uEs1ufhmr9xg6mHPNexreUmxlurD6fbYa5t1DTlOEsPU4rzqJkV1cZ3HIFerchLsXNnPZT75bTcFbrhfPyGsbd7KhseVUlnIP4Ys0sPgZS6+6tFZ3blrr15fZGMZXeEHyQSyWjkpNpSTTGrkbiezdnNDzGYWKztvG7QDmtHtK+RILhNK87JMwQdigDpd9ZdVLNvOSeJrjRuLUMuJFMUbBlOVKsdVErzaO2HtmDTO0LedUqFb2lQCRVWAKgwKMW6LKNJ4EYqkKNhtVECRTMkUOkpIEi6uGcq4LHvFTXtxaR7KjtrYRFi7EODqcxlmOWONxoBd27W1y8RG4HK91QKSp3d1AdVoV8kdyfItZ40fHAeFPkWgL9h6Ynto63Gs/YemR1oGrJAhaql0f4eTwkflVpqrTDVHp+0yr72ApcFjlfegf4fshOMWiec9jaCiis5Vbal19M5QT3Gcq05CeEdEVarh2angpQjwu/3PNg4rmu65NdQODRWFo5YNe4SL0ZV/P20LruEkSgA41dE1rnG64o7dnq4JWaUoyya/V9L8PRtEcqaJCBwO9aholdwMqaiN6mh1ZJ3Rpq03CTi1bgQr6ZD3ivoOvn1fTIvZX0FWRpPGb3/M7z/cS/OaibereFvganvwo2ndEdc8pP/NqhG/Pca2oxNdtq0iHJiNCdAxHjvCg1gLS4mgtbjS6xMiCMoVyz5JHsK5r0jauqbkurBdQCxn8s15rfQYk16uc1AFmHbXkbF/jmtfiO/PI66zblH9vldlOI4SSVt7AYTPad2fYKgFScFK9tcCvUOU6gle3uEmQ4KMGrSTzW/Su8n6ckyvFImdO7SQOzhWWNGkaVdl6F0c3qGrPldWfxrZF2a5/z1cwkrp8g1sm7ez5XiWMYS8yHX7wa/mrU7dtBLyk2XOR5yKVH/tBNY6JkXb2xn7RBr95Wtny1afmbJ7IkTCV8EfZKV1VbXqJLV/bel7HmUpPFRbe+KutbptN+55ntZlbadzpPRVzVRNwz21zKdTu3WW3mkc7gOJ3CuE9YsIzZ3AnHYK0OzGSXeCDg4NErGzhgtVQorMRmRiOuhEyfQdoo8e5JCUcesYYH3GqCDlFEEkjkA8rc1ZsitRt1xJaq3YwrLg1AOaPDgPCn/WlATR3qHgj/AOtaAuWPpkfea0LVnLH0yKtE3GqUhaqlyxSLUOIYEew6qtNUDJzrpH9rV+CMaxk7KT4GL3Mw8BJnQniWo/Wfg8+nirQGiKNTGuqY1ARGuW9XGpDXBoA5cSpPbqRjLp0h68VnqN2tuz2qydWSKDuMSMOwkVunTnG0pfXmj0tqnObpzkrNwXoiuvpkde/18/p6XF//AHXXv9aTzTxy/OdpXOAT++l/7GrqGG4c5EbBFGXJ3YHCvTuV0EENpC8MUaO83TZQAT0TWRsXiR5I5vNzoYmb7OeDew4o5NJtK/t1uBpNkLHf8n5LY41APCfmWvMJ0IZ006MHS6+sbq2+wLhrW/aE74pugx6tY4GqvKjZhtrs3aD9xcHLeqSvOptQrVIblPtRemLXrgjN5pGBaDUCOB6qpEMCQwwRR5lAFDZwMk16ZgUMVbDRm3Yvq53UNOM4/Sq5q/ZAEapSvMRMHlHWVHSwO+mqMJOyb7kFtnWk13yks7b60KK7+oKmutPyjcpebOgLlSqTTmqXJOOdprrako0vdEpF4M5bFBNtbUa75RPPEuuKAGCEZ6lBBauyUuzJ6Sll3nzlLBU2qKV3OhTtN/RiebXg2Zlz0m8ZrsNpkRjwDA1zIpDN7G99Md4riPpj0uF9UQKkFHUHNZTa06vcxIhzhmkP4KPhUEE94tvzccnRxuU5qiI5A3OSMGZjg1k2C3tJ82aDrLj8ASaCCr+0HyYovsLqbvah9QHZo6OA8Ef/AFrQI0c+qvgj+RaAtWXpcXfWhbjWcsvTIu+tIRVKQtXVnv2par63+Rq5apdm79swf0pI34AVpq/JU/a/Q56ztTqv9D9Dz/mjBftC24xylD7GIo6RXXKa1+i7f1gYS40yr8ppjVhK8YvvXmZU54oQl3rzOa5NdU1Zm0jNcGpDXDVAaCzuVGzY4TjKu595rPS75pD/AFGjK2zwwRs+QzIHIPYRqFA2OSx7zXo7RiUaEZJK0cvsvfM66s5NU4tWwxViunpMXr/Wvfq8Bj89B3V75mvPOQq8svQrf74/Kawca6sjhW85Zeg2/wB9/wCTWFRf3TvvwuB76gI3Cr0BvrXbP2jBtO1aw2iq86Rj1OO1exhWeaxKcXL9FGVoxlBq4B2+rRK7t4D0J/3NygUwSQA4I4DPca56tPGtU9Jap9LPUGf2xsO72eWkQNLafVccR4qyMwr1mPal9s/FttNEnXG6VCA5X1qxAaqkycjrtw90I4GI1DVmL81U1pVWpG0Zxcn+ZbvZeXI1uVjyhYXbpEFYgcNIeA66KbL2LPfzq8gdLIHLOdxcdiVvrmz5NWx5xMSOGUKm92LNvXSm8b+6gG2eUM8DNa2drJBIFBaWcdIA9arW1TlK6UXHj1keTXq7XK9OhTs3/wAr+VcV14SL239qwWFmLO00i6lQIiJwhirGWCW0V3G1yC9vwcKCxJxkDAOTvoYXZ2keVmeZ+LtvOaK7GWUMW1IqqGJLED6p+1XXdu1zq2XZY0ION8U5O9Sern08ubINpJHz3Ow5MZ3MQjIoP2QHA4fnQ5Psn2V6PtO/sH5LpaStBLeZMiIOIOvGsY7Vrz5oG4x7wOo8RQ9AtWhbLKW4jAB94rpsBmaTyI+P6e2qi9Hz7IgHryx7gKhnnM2AMhB7ye00BC7tJIztxY5pAZNMA2R8aukRLARCRI/13xw7s0BUNG/qL93H8i0ENGvqJ93H8i0BYs/S4vFWoNZW09Lh8YrUk0KV2oTd3b2N1b3KZzG6lgOtN+oe0UWes7tY9JakkmmnmmjGSTTTzTVmuBr+VMMV3sy1u497pNHzLdqPWWNT2210l2bFs6ZpWnS4hkhkk3gqHGV9lEdq2gWQ3FuMo3nUH1WrlprBaHimeXs7dP8ACnlm8L0t/d7rjdAWmp+NNXUeqcmuQoZwDwzv7q6ar0MUaRbwTO539ir2d5rs2ag601HRZyfDu8dyI3Ylu7t5YnZuLAItA33I3cat3Dhn0r5K/Gqc26F+6m0Tc6jV74ck9OPsuCRk5SlnLeRp5y38Ne7ZrwpPLtvBXudcZCPll6Db/ff+TWEViInXA3kHPdW75Zeg2/33/k1g18g1AHbdhOky2WhYdCG4iPlndhzH7KmjdH59bHTJblV54sSXHboB3nArMDI8kkd1dqzocxsyEjB0nGR2GqAzf6HtbgW5M0IMRMzNkqcEad+8is3dRa9mplM6JCok71zzfsxn21aDMoKqSFbyh1GonBKlcnSTkr1Z3jNAX4ESVITjN1rgEV9pGlMIvQPcMr6y1AOUeobRuBPKkjCKNIyBjG/VpqwJ7iC3mt4z+5m3SofiOw0GkEaoVK6l6waoDuzrCCfZtllRzj87zj9eQUq1tTYtnFBBIkeDIgZ6jsbsWWybKcoNANwwHtUVK93tW5ghS5NvzBGhGjOX3I0m8FNO7Tg1iUAXwSARKBgiNNPdrloZHIsl+HHkBSGPctErmCS4k1vPjACgaerjj3k1ZtrN4/RRzrkeSF6juJ3mqQNWW0diQ7MEd/bx6reMFW0audyurcxXiGNYCd0muJZYYzFFK7NDEDnSmT8K0Us9uskVksZfSxzE+D37wv8ATUvM263TrIIwIrciIKuOlngcbjQGPclsAgADsp0d1Qopwrbmq+X0JpHlkkyqF4/lgfnXdzDH/DtJoR2ULNFEOCDg53ganHwqgFnHVRr6ifdx/IKCtjJxw6qM/UT7uP5BQEtr6VD4xWoJrLWx/iYvGK0541QRNWd2tjI8WB7q0LUEvmjVWkcaiH6A9e+gBa2dz9GW6VcwJKscrZGQx4EjysGtbY3yq4SdsdQdt6kdj1jFLPiTUFAZejnecnqHqrQKkkpwq6u0mr2cmaXTc04yzvutvt/PH0D17s61l/e2rCNzvKcVPdQz/C7wjcFrhIZYTgylB9kcPcaI87cLF0JnUd1ejShTqXdrPmjWqG1RWGMlK3fvsRWloIWLSIusfzH4DwiqN7cRaytucn67/pUc6XUmWLmVevH6VRrKpXlTj8OnB0k/q1a1s1lz3vkI0mpY5O77tPPy0GqvcboW9eBVmqd35rvNeSjqOh5dt4K9yrw361v4K9wzQDcsvQrf74/LWDXyDW75ZehW33x+WsIPNmoCMV0eAphTngKALrbRT2ULMSr4IV/VqbdioGsE/wBdfaKkhuoxbRRaZGZQ2rSP6iaeSOdz0UkPcpqFB02z4wmp7mFd+MEN+QoTd2dmmkC7Q5UFuia0dxDfXDBpIm1KMAkYofPZXbnyI07yv5momAK4i/w4IbpjBC+5Qm/eSxADEHBNcm4UWsdzCZApdoI2YblJXBODIRwNTS7NuW6Jktu3e60o7ae3TS93bRKOCZOPwQ1biwKaV0zqkc6eLaVIPuNW4dpSxdKISHdgkIdPHtU1WmsrdX503tsXByECufxKVOiwqiGe8uNLprgWLd0g2Mncd1LoEJuoUBnnjJnYtonwQQSDnd7aqi+c3UfS1qWUM7ZyVzgip7qGxlmEq3UrhmwTL5XNgY4441T5iFRqSROcVwYwW4r66t0QIOqrKxUkBoF8rfjLY4GuFkkLzoUEgGmNnZekuNy47M8N9Rl5i2tZbYNpCadXAZznfUYS5ZpJTcgPJkylW3seO/FRMoLPXRn6ifdx/KKDUYPkR/dp8orMh3b+kxeNfjWpasrB6RF41+NahjvqgjNZzaZxGD/Wa0JNZ+8ikuHggi3vLJpFRlSbaSzb9TiCweSxe9Pm0dEQqeLF1GCMUeaRbcaUA1UQ22lvs3YEVnF9uMJ2swOomgDEsdTcTxrUsztqRVJxUX2sN3Ljn1HgO8kjnLmo9T9TN3UjXNbVkcTbedy5DcIBhwVfqYcDUc0Yky6DD9YHXVU1bt3BGD5S/iK9bZ5KtajUtZrsvW/pdb132adySk7LgUKp3h6KjtNFbqPQ4ceS/wAaFXf1B3mvOnSlCcqct6flo/G90RO5J9aDwV7ZXiZ3ND4K9qzWkp3yy9DtvvT8tYQebrdcs/RLb70/LWNglijt5UeJZGkGI3PFD2ioCoKc8BXaPEsTq8ep2xokyRp9nA5rg+SKALW02IVMks6qBg6D9XOPeOqq8zPJreCWQRR+WGZtWfbUIOEt8derP/KnMduZW5xubGBgL10sUrgyzZw0rsOC7zu7a1cr7MbZlmF5nnkBE+V6ft3ZrPyRRWya7e6JlyBpQ43Z9RqYDUQO3dVIWZZ9nqyacHSW4J2tGR1D7JqHbm0dl3skrQxOdZTBKgblGKja2cHIIB6qoS2hzgkZLaatgUZ7u2NxzyW24RGPBx2k54UT+nbJuUDwSQZ5sDTwIOVOMEA0IuoOagkfOcAj8M1iSuDQGtIUxWo3cJQf+MtPbxLuyo82v/ZWTV5UOUdxjhg1aj2jexcHDbgvSHUDmgNlDbQsyBo0OWkzkD7JrO7fhSC7hSNUQGFCdIxUS7Y2jvKtGNPAhes7jxqhNPPczB7h2kYDAJ7OwUBAaLnyI/u0+WhBov8AUj+7T4UA8Xn4/GvxrUvWVj89H41+NahuNUETHcak2JbpNe863GEZQett1QP5Ld1X+TvpMp7FBNaKrtCT6tdHZsy/Fp9Z4WAeVF00+1lh+pb4X+87zSNAridp7yaYnzsxY92qjhrZFWSXVzTVlinOXHy0Oa5rumqmoZMF1DcCcU4/cXA17wrdLw1wa6lOsgnjjBroi0oNrKcJqUX+l+zimubMGs+DVmaS/sl+hyKuCVAliP4/iKxcylpUBHFcjuyRWysbh57aON9+lebPdwrLXQK3uj/TjVfi3516tdKcqFX80bP1XqefQxpThJ3ae/rlcgfy4/Utez14xJ5ad1eyZrw5b2ekWOWXodt96flrCfy6i2ryh2nezy204g5mCZ+ZCr2EpVSG7diBKBpbd0e2pYF0U54CmpzwFATBk0wjUAU1F899J5IHJyu/tNcM8JhWMRAS53zaj8vCp2stK6dQ51SxkfP7ooADiJvrPv4UBVxCrZBB7s/mBVoXMQO4ntBxSazjDOQZNByIAR01YELmcfUXfS+hLlQS/ROLnT19PR/D/wCpQDtdsQSGBPec1SkupSpI0jG8Ak/hVoWWQQG6bEGEkjQEwxxK3BX3cK5azjbUQZdGnoAjp85hTl1+qm/yqAA3NxI8bISgDDB3GgEtvgDBBzwrYm3gglEVwSusMryY6Gd69Fuseuhk9gtq/N3Yfjqikj3qydtLgzs1jeQEc6mkEBgT2GoVtp3Uuq5QcSDWr2je7PnCHE+uNNGGYBT1cMmgQubVIuaVOiW1nLHOcY6lqgoaZApypwTjNcDIbIFTSzhzhAVT7NJHhBy6ZHUAaAhNFvqR/dpQk0V/lxfdrQCTzqeNfjWoessvlp4h8a1D1QQSn921GOTS5N+3WkGR7moLN5B9nxo9yW3tfL9qML+DVw7V/hn4f+0dFH549aM8whGTWlNZyIFWweIyDWjrsNA1NT01Ac1I4H0dW69RFR0iTpx1VsjJJVE9Y2XPEvYwa3czT7DjR7MueIlIrN3ID7YvP6X0+4AUb2K0gQqM6deay5lLbQun+1K/xr01NYKCfWX9nlKMvibQ78uTf9HEnlL3GvYq8dk4p7a9hryGeueWXfp9z9/J85qaLy07xXF6S20bljvJmkyT4zXcfnI+8VmA1Srk8aWRWALRMz26RLGCgydSp0s5O4tjJqIpdaFQiXQhLRqQcA9oqPPfS99ASH6YWkY85qlGJj9ocd9Nm7UxkGQGHzP9O/O6uaVAN/EaGTp6HbW69RbtNOXuSzMWk1Ouhz2pw0mkSQpwaj30BHMsroqvqKIMRg9Q44FC5o3xglsDhReq0qZoDMzRGhzoQeFaOaOhMsdUFDFdg8QQKYjBpfpQDmin8uL7tfzoWaKfy4vu1+JoBh5S+IfGtS9ZX6w7xWoeqCtN5PtrU8jEDS3jdnND56yk3V30R5O34sduQxOcRXitCfHuKVw7VFyo1EufgpJv0M4uzMvte1Nltu8t+pZWKeFjqFEKO8vbBku7baUY6EuIJ/GKBVtozxQi9bZ80R72c026npq6DE5NJ8BR24yaVdRRPPMsMYJZz+FY3smRtLN5JZvkbbZVvHFs2Any2Qyv7ckfhXmsLZuJT2ux/E1vmna2tHLniBEnu/IV5tExDZ7TXU6kWqdtyR5Gzwl+PJu+KV0/FvyvYIy/Ur1+vIJOCV65muZnsHnN5aXqXs7SW9wiNNJoZkYA9MncSKdElEqAo+4gndXqnLL0W1+9Py1hW4VbggPGlTU9QD09NT0AqempVAOfJqOpCd1R1QNTEZp6VUFGZKFTR1oHXIofNHQGblSqx3Gi80dDpUwaAiNEx5uL7sfFqGGia+aj+7HxagGrTvWYrTPQFSXiKD7Q185AUJVlJYMOIIwQaLyeVVciJpNEyhkKszdwoU31/ew7W5GTzkHWAgl1LjEodAWFYu5t5LSYwy9QBVu0UIea6sy8MLyLbXShJIicqV1BgRngQRWqWSLaKpFOdLKAFauCEHSxa08TfFKyt9rW5WMZStm/ECVzRK82Zc2hzukjPBhVZbO8kXUkTae010qpBpSUlbvMMcLXxKxVJxR7ZAS3BcjNzN0U/pT9WrnZ1rbq+qVWmmHAHdGn61FfXCQuyQMGlby3HBfUK5pzxt0434s4akvit0UnbV6e9u/v3Zoh21crLIYoj+7gVtTDrfG+sctaCMdIAKHJ3FT15oHKoS4dF8lXIHvrrjGySO6EFCMYrcl56sIScEr1mvJ38lK9WrM2BTlj6Na/etWFat3yx9FtfvTWEaoCvT01KqB6empVQPSpqVAP1Guac8K5oDoIx7Kfm39VSjgKegIebeoZIZOyrlKgAMsEn2aFTQyj6p91aqRKGzKQDvoDKOuDV9PNx+AfFqjmjqRB0E8I+LUA9aRjuHdWdrQE9EdwoCs/lUNunaOeJwAQAwYHrBwKIucsaEbRJDR4476FOGuHLaIiwR8LIHOcqCCAM9hosCVIKEqRwIrOrjnFA46xk1oaneQujaF2ECO2tew1Om1CiaRCmaFU1aHSpvfFGh0ab3xRalvLiXIDaFPELuqpilSrakluVjaklkkkQTyyQxF4jpcYCmg65LAneSd5oneH9wPWw+BoavlCqZBR/IT2V6pmvLH82vsr0+gDfLH0a1+9asI3E1vOWAY21rgE4lNYNuJoCClT0qAalSpVQPSpUt9AI8K4rqlQEo4CnzUWTSy1UEuaWaiyafUaA7bBFDZ11d1XiSaidCRkAkdtAZ6aOoQuNI/pHxNF5o6HSLhwP6R8TQERFGT5K91CsbqJk9Be4UBC3E0I2iTrjx2Gi1CNogl0A7DQpUTyl3/WFHs1nkPTTvFaDdUA5NNmlTd2T3UAs01KlUIUr49BB66oLxFGJYYpgNbEEeTpqubJM5WRvaKAmfzY7hXpleaPuSvSc0BvyAeNNNBYsMNDA39orqlJaRSDe0o8LYoDP7asdmLYSywW8UcqYIYVgOdQRszKnR7/AMiK9NuNgQToyG4ugG/qrPT8hkkXCX8470FUHnMG1zLeRWxtkzLKkSsrkAamC5wytW/m2BbKSI75T4l/RqpJ+zx4p0mivgWRg65SrsvJTbHEXcTVAUH2O6+TdWre0j8qqPYzL9eE9zCrsvJblAN6tG/c9C59hcoIhl4J+9aARt5R1Ke5h+tc8xN9hz3ChE1ptKPdIsy94NUyt2v13FAaAqwOCCDXOKBCbaCjAubgerU2K6+m7SX+cT3op+IoA3SoKNp3q+WkL964P4Gpk2v/AKtoD4XIqgqbUeeO9iZGICgGHvoxs2a4eCYSKAiSkJ3kZZR6hUI2paHGu2kyN6nKtg9oDIPjRi3hS5s0uYZGWJiwCMuCCDg5CsRvoAbIlCpk/fY/pH51pHtwq5MsQHr1D4rihMqRNNlJrduiBuccd+6qAYUq4fJXuFTG3Y8ChPiH61GykDG7Iqgr0wOOpT3iu+bc9nvFdCFzxKD2/oDUMiBgpG9E9wpqvLaauM0aj2/pVuLZto3nLvvCp+rUIBc01HNq2OybLZj3NrNPNcqy9B8BNJ7t9Y/6fKfqIKgClca1rrY91FLtO3ivBGYZJERgRu3kCvfIbHYEe6GDZ3sVDUIeBKS5wisx7FGatx2O0pfNWd2/dG36V7yixqMRhAOxQPyp6A8QHJzlJMMJYTj1vgVv/wDCdp/6NbClQCpUqVAKlSpUAqVKlQCpUqVAMVVhhgCPXSl2Zsybztrbt/aKelQA2XkzsKQ+j6PASKHScjdlt5Ek6Vo6VAYuXkQp81cj2rQ2XkVfjzbQvXo1KqDyWbkpthP5DP4aktUuNl2b217FLF0y8eta9WpEAjBANLg8Uv8AaETQFVNY9dTyjSrHfnhX001raN5UEB70X9K5k2RsmTyrWD2ClwfOuibsan/ejtr3t+TWxH4wEdxoZ/8AF9iNIcpPjqGugPGwZ/66cPMO2vdYuTGwIz6Kr+Mk0Qj2TsmLzdpbD+0VAfP6m5byUlbuBq5HZ7Xl81aXbdyN+le6rFEnkIi9wAp6A8XHJzlJcDBs5wv9e6rsPIfa7b3ht18cn5JXrdKgPOYeQd1kF57WLwA0bh5HafOX9z/ZWrpUAIh5NW0XG7v2/vorDs6GDyZLg+OQmuqVANT0qVAf/9k=







",jpeg
