,Title,Rating,Helpful,Text
0,"['Sport Smart Watch for Men, Smart Sport Bracelet, Bluetooth Fitness Tracker with Heart Rate Monitor/Body Temperature/Blood Pressure/SpO2 Monitor/Sleep Tracker/IP67 Waterproof/iOS&Android App (Black)', 'Sport Smart Watch for Men, Smart Sport Bracelet, Bluetooth Fitness Tracker with Heart Rate Monitor/Body Temperature/Blood Pressure/SpO2 Monitor/Sleep Tracker/IP67 Waterproof/iOS&Android App (Black)', 'Sport Smart Watch for Men, Smart Sport Bracelet, Bluetooth Fitness Tracker with Heart Rate Monitor/Body Temperature/Blood Pressure/SpO2 Monitor/Sleep Tracker/IP67 Waterproof/iOS&Android App (Black)', 'Sport Smart Watch for Men, Smart Sport Bracelet, Bluetooth Fitness Tracker with Heart Rate Monitor/Body Temperature/Blood Pressure/SpO2 Monitor/Sleep Tracker/IP67 Waterproof/iOS&Android App (Black)', 'Sport Smart Watch for Men, Smart Sport Bracelet, Bluetooth Fitness Tracker with Heart Rate Monitor/Body Temperature/Blood Pressure/SpO2 Monitor/Sleep Tracker/IP67 Waterproof/iOS&Android App (Black)', 'Sport Smart Watch for Men, Smart Sport Bracelet, Bluetooth Fitness Tracker with Heart Rate Monitor/Body Temperature/Blood Pressure/SpO2 Monitor/Sleep Tracker/IP67 Waterproof/iOS&Android App (Black)', 'Sport Smart Watch for Men, Smart Sport Bracelet, Bluetooth Fitness Tracker with Heart Rate Monitor/Body Temperature/Blood Pressure/SpO2 Monitor/Sleep Tracker/IP67 Waterproof/iOS&Android App (Black)', 'Sport Smart Watch for Men, Smart Sport Bracelet, Bluetooth Fitness Tracker with Heart Rate Monitor/Body Temperature/Blood Pressure/SpO2 Monitor/Sleep Tracker/IP67 Waterproof/iOS&Android App (Black)']","[5, 5, 5, 5, 5, 1, 4, 5]","[4, 5, 5, 0, 4, 0, 0, 3]","[""\n  The watch was delivered in a premium box and you don’t feel like you’re getting a cheap product. It's a very comfortable watch to wear. The touch screen interface is great. This watch is a true sports watch. This fits well on larger wrists. It has all features you'd need in a sports watch - heart rate monitor, stopwatch, calories, breathing app, BP, pedometer, camera shutter - all of it. I am also very excited that this is waterproof.I like this watch very much. If you’re looking for a nice smart watch with fitness tracking features for a good price then I would recommend this watch. It is a really good example of a smart watch without spending a ton of money.Overall quality is very good for the price. I hope this helps.\n"", '\n  So cool and stylish watch I ever had! Easy to pair my iPhone, Sports functions is awesome, Love it! I especially like the phone call reminder, WeChat and email, Over worth what you paying, Highly recommend it!\n', ""\n  Great quality and easy to use: this watch is pretty stylish and the touch screen is sensitive, and the battery life is quite well. It still has about 80% of battery after 2 days of usage.Overall it's a good smart watch.\n"", '\n  This smart watch is awesome!  I owned it for about a month . It looks pretty cool with its outstanding round dial design and comfortable on my wrist.  This smart watch comes with multiple features.  It will monitor my heart rate and body temperature while exercising or sleeping.  This watch is simple to set up and it is equipped with touchscreen. Another amazing thing is the long last battery. Even after wearing it for two days, it still has 80% of the battery remains.  It’s a great watch and better than expected. I just love it!\n', '\n  The watch overall is good the only thing I would like is if in the app I could look back on individual days of the sleep tracking.\n', ""\n  Would not recommend this watch. Didn't do what it states it will do.\n"", '\n  Instructions are vague . Took awhile to figure out trying to time and date.\n', '\n  Love the watch great for the money\n']"
1,"['Willful Smart Watch for Men Women 2020 Version IP68 Waterproof, Fitness Tracker Heart Rate Monitor Sport Digital Watch, Smartwatch for Android Phones and iOS Phones Compatible iPhone Samsung', 'Willful Smart Watch for Men Women 2020 Version IP68 Waterproof, Fitness Tracker Heart Rate Monitor Sport Digital Watch, Smartwatch for Android Phones and iOS Phones Compatible iPhone Samsung', 'Willful Smart Watch for Men Women 2020 Version IP68 Waterproof, Fitness Tracker Heart Rate Monitor Sport Digital Watch, Smartwatch for Android Phones and iOS Phones Compatible iPhone Samsung', 'Willful Smart Watch for Men Women 2020 Version IP68 Waterproof, Fitness Tracker Heart Rate Monitor Sport Digital Watch, Smartwatch for Android Phones and iOS Phones Compatible iPhone Samsung', 'Willful Smart Watch for Men Women 2020 Version IP68 Waterproof, Fitness Tracker Heart Rate Monitor Sport Digital Watch, Smartwatch for Android Phones and iOS Phones Compatible iPhone Samsung', 'Willful Smart Watch for Men Women 2020 Version IP68 Waterproof, Fitness Tracker Heart Rate Monitor Sport Digital Watch, Smartwatch for Android Phones and iOS Phones Compatible iPhone Samsung', 'Willful Smart Watch for Men Women 2020 Version IP68 Waterproof, Fitness Tracker Heart Rate Monitor Sport Digital Watch, Smartwatch for Android Phones and iOS Phones Compatible iPhone Samsung', 'Willful Smart Watch for Men Women 2020 Version IP68 Waterproof, Fitness Tracker Heart Rate Monitor Sport Digital Watch, Smartwatch for Android Phones and iOS Phones Compatible iPhone Samsung', 'Willful Smart Watch for Men Women 2020 Version IP68 Waterproof, Fitness Tracker Heart Rate Monitor Sport Digital Watch, Smartwatch for Android Phones and iOS Phones Compatible iPhone Samsung', 'Willful Smart Watch for Men Women 2020 Version IP68 Waterproof, Fitness Tracker Heart Rate Monitor Sport Digital Watch, Smartwatch for Android Phones and iOS Phones Compatible iPhone Samsung', 'Willful Smart Watch for Men Women 2020 Version IP68 Waterproof, Fitness Tracker Heart Rate Monitor Sport Digital Watch, Smartwatch for Android Phones and iOS Phones Compatible iPhone Samsung', 'Willful Smart Watch for Men Women 2020 Version IP68 Waterproof, Fitness Tracker Heart Rate Monitor Sport Digital Watch, Smartwatch for Android Phones and iOS Phones Compatible iPhone Samsung']","[4, 4, 5, 5, 4, 5, 5, 5, 1, 4, 3, 5]","[113, 74, 61, 36, 36, 28, 31, 0, 0, 0, 0, 0]","[""\n  This watch is great. It came on time and was packaged very well. Came with instructions and a charger cable. I however wish it came with two size bands. The band fits me as a man well but I got it for my wife and it wraps around her wrist.I charged the watch and turned it on. Downloaded the app and it took me a couple attempts to get connected but it did connect. The watch is responsive however the screen doesn't seem to be touch as you cannot swipe through menus. The only way to navigate is to use the touch button on the screen. At the price point I guess this is acceptable.It seems to detect the heart rate accurately and had a sleep tracker within the app. Had an alarm that you set through the app. Another downfall is that there are only 3 clock faces. Give more faces and it would be awesome.I can say that the watch is great at this price point. Just wish it had the ability to swipe through the menus and had more clock faces.\n"", ""\n  I have been looking for a watch that is similar to an apple watch that is not as expensive because I used to have an apple watch and it broke but I didn't want to spend the money to replace it. When I came across this product I was a little bit unsure about it but now I am so glad that I took a chance and ordered it. It is an incredible product and I am so happy with this purchase. The battery life is astonishing. I could be wearing it all day and wear it all night and I will wake up in the morning and it will still have 80% battery which I think is incredible. Although it does not have all of the features of an apple watch I feel like it has what I would use on my apple watch anyway so it is not even that noticeable (sometimes I even think that it is my apple watch). The only thing that bothers me a little bit is that once you get a notification and you look at it, it keeps coming back for a couple of hours which is kind of annoying but it is not that big of an issue for me. Although I have not really explored the mobile app to its full potential from what I can tell so far it is easy to use and easy to set up your personal preferences. Overall I am very happy with this product.\n"", ""\n  My brother told me about this smart watch so I took his advice and ordered it and I'm really pleased with it so far. I love being able to see my step process for the day and get my heart rate measured whenever I want. Also, the battery lasts for a really long time so I like not having to worry about changing it all the time. If you want a high value smart watch for the price I would suggest this one.\n"", ""\n  After trying two other fitness trackers from box stores, I decided to go to Amazon.  I am so glad I did!  This watch is just what I was looking for, for a Fraction of the price of the other two I had!  For people who are comparing, I had an itouch air special edition from Target.  It was very inaccurate when counting steps, so back to Target it went.  Then I tried an inspire HR from Fitbit.  I felt it was almost to generous when counting steps, and also the battery died Very quick, considering it was on sale for $80, I took that back also.  Ok, back to the Willful watch.  It has great battery life, even if using all the notification features, it lasted for me over two days.  If I turn off some notification features, it lasts even longer!  It is very accurate with step counting, not being over generous either.  It seems to wait until you take at least five or ten steps before it begins clocking them.  It has all the sports features I want including indoor and outdoor walking, running and cycling, hiking, rowing, elliptical, and others.  You can only put up to three exercises on the watch at a time, but it is very easy to switch them in the app.  I have also been very pleased with the app as well.  I have had no issues with it syncing with my watch.  Even when I haven't had great internet service, it has done fine.  The heart rate seems accurate as well as the sleep feature.  The only time the sleep wasn't accurate was when I put it on the charger as soon as I woke up.  It is a simple watch, but for the price, I have been very happy with it.  I would definitely buy it again!\n"", '\n  From the moment I pulled out of box and read instructions I was impressed with how it looked and how well the instructions were written. I like that I was able to read because of don’t being big enough and I was able to  comprehend what I was to do. Very easy to find app on apple store. Easy process in binding/pairing.I love the fact the battery life is long. I put on at 5am and it’s after 2pm and battery reading is at 97%.Quite accurate in reading of heart rate, steps and walking activity. (I used another device I have to compare and it stood well on its own. Had same readings as other device.Three things I find about product that is challenging. One It doesn’t stay lit long enough to read messages.  Secondly when outside it was hard to read display screen because of the sunny day. And thirdly, having to tap to get around in watch. These are minor issues  that to me will have to adjust to.Overall, I do love my smart watch just in short time I’ve had it.\n', '\n  A very nice watch!  Connecting to the app and Bluetooth was very simple. It has great features like recording your heartbeat, calories burned, mph, steps and mileage while tracking your walks, runs and cycling. It has a deep breathing relaxation mode to bring your heat rate down. Also has a stop watch and tracks your sleep.  The face of the watch is easy to read, but mine doesn’t show the entire text message.  I found that you can hang up your phone calls when long pressing the watch.  A great feature to use to hang up on telemarketers!The face of the watch is a little bigger than I like  but it does make it easy to read.  It gives you 3 different choices in screen styles.  I would like it even better if it read my blood pressure but all in all, it’s an awesome watch!\n', ""\n  \xa0This little watch is a great little fitness tracker it stayed on point with my Fitbit. The water resistance also does a great job I did a few tests with it as well as walking around in the rain it works great. The only weird thing is it's not a full touch screen you control it all from a little dot at the bottom but once you get used to it it's pretty intuitive.\n"", ""\n  I have used this watch over the past few weeks. Setting up the watch to pair with my phone was pretty straightforward. Thereafter, sync'ing would involve first turning on the app on the phone, and the data would be downloaded into the app.So far I have used it to monitor my sleep, heart rate and steps. The measurement of ambient heart rate seems accurate, and does reflect when increased physical exertion for instance going up stairs.Downside: the screen is not a true touch-screen. Functions are accessed via a pushbutton, and navigating forward or selecting the option is performed via the length of push on the pushbutton. Not the most intuitive, but not too complicated either.For the price and ease of use, I am really happy and satisfied with this product, and will recommend it to my friends.\n"", '\n  Pésimo producto se desconecta a cada rato de igual forma solicite la devolución y hasta el día de hoy no me han informado a través de que paquetería es que debo hacer la devolución para que no me genere un gasto extra\n', '\n  Simple watch with necessary functions that serves its purpose. Tested it under-water while swimming, and it is still working.  Good value for money.\n', '\n  no me convence mucho la relación costo / beneficio vs Honor 5\n', '\n  Bien\n']"
2,"['Willful Smart Watch for Android Phones and iOS Phones Compatible iPhone Samsung, IP68 Swimming Waterproof Smartwatch Fitness Tracker Fitness Watch Heart Rate Monitor Watches for Women (Dark Purple)', 'Willful Smart Watch for Android Phones and iOS Phones Compatible iPhone Samsung, IP68 Swimming Waterproof Smartwatch Fitness Tracker Fitness Watch Heart Rate Monitor Watches for Women (Dark Purple)', 'Willful Smart Watch for Android Phones and iOS Phones Compatible iPhone Samsung, IP68 Swimming Waterproof Smartwatch Fitness Tracker Fitness Watch Heart Rate Monitor Watches for Women (Dark Purple)', 'Willful Smart Watch for Android Phones and iOS Phones Compatible iPhone Samsung, IP68 Swimming Waterproof Smartwatch Fitness Tracker Fitness Watch Heart Rate Monitor Watches for Women (Dark Purple)', 'Willful Smart Watch for Android Phones and iOS Phones Compatible iPhone Samsung, IP68 Swimming Waterproof Smartwatch Fitness Tracker Fitness Watch Heart Rate Monitor Watches for Women (Dark Purple)', 'Willful Smart Watch for Android Phones and iOS Phones Compatible iPhone Samsung, IP68 Swimming Waterproof Smartwatch Fitness Tracker Fitness Watch Heart Rate Monitor Watches for Women (Dark Purple)', 'Willful Smart Watch for Android Phones and iOS Phones Compatible iPhone Samsung, IP68 Swimming Waterproof Smartwatch Fitness Tracker Fitness Watch Heart Rate Monitor Watches for Women (Dark Purple)', 'Willful Smart Watch for Android Phones and iOS Phones Compatible iPhone Samsung, IP68 Swimming Waterproof Smartwatch Fitness Tracker Fitness Watch Heart Rate Monitor Watches for Women (Dark Purple)', 'Willful Smart Watch for Android Phones and iOS Phones Compatible iPhone Samsung, IP68 Swimming Waterproof Smartwatch Fitness Tracker Fitness Watch Heart Rate Monitor Watches for Women (Dark Purple)', 'Willful Smart Watch for Android Phones and iOS Phones Compatible iPhone Samsung, IP68 Swimming Waterproof Smartwatch Fitness Tracker Fitness Watch Heart Rate Monitor Watches for Women (Dark Purple)']","[5, 5, 5, 5, 5, 5, 5, 5, 5, 5]","[1436, 1052, 633, 432, 317, 12, 11, 1, 12, 0]","['\n  You guys! I wouldn’t take the time to write a review if this watch didn’t just blow my mind! I got this watch for my husband for Christmas and got myself a brand new Fitbit Versa 2 for four times the price. Before you start judging me for buying myself the better gift, I wasn’t sure if my husband was going to like a smart watch so I proceeded cautiously when purchasing one.We both open our gifts at Christmas and he liked the watch and we got it all set up on military time and set up the app on his phone to be able to manage the watch. I set up my Fitbit watch and it was almost the same process, and almost the same look and feel when navigating around. Seriously! I paid close to $200 for my Fitbit watch and my husband’s was under $50, and they pretty much do the same basic things. The only difference I can really tell is the extras, such as the ability to download a variety fun watch faces, access to purchase the Fitbit premium service, and a few other things that I doubt I will even use.Long story short, buy this watch and save your hard earned money for something else. It lives up to the 5 stars ⭐️\n', '\n  \xa0Always wanted a watch that you could see full text messages on etc.  This works awesome!  Sometimes my finger doesn’t work the swiping very well but it gets there LOL.  I also am able to set alarms on it via the app, VeryFitPro, that correlates to the alarms on my phone. So now when my phone alarm goes off, I get the same alarm alert on my watch. It will show a pill for medication alarm which lets me know it’s time for my meds. This is awesome bc I don’t always have my phone on my person.  The HEART RATE MONITOR works AMAZING!  Love this function as it is matching my monitor.  The music control will play whatever music was last played on your phone. You can’t see the song list on watch but can start, stop, and pause plus skip. Handy feature.Worth the money!\n', '\n  \xa0I have tried numerous fitness trackers for quite some time now and this one is absolutely fantastic for the cost.It arrived fully charged.  The app was easily downloaded and pairing was pretty much automatic.  I love that it is waterproof for swimming (IP68) and actually utilizing the functions of the watch are simple and easy to learn.First thing, the watch face is easy to read.  I\'ve had numerous trackers with the display text so small it was impossible to read.  You can even see the display outdoors in bright conditions.2nd, the instruction manual is readable, too without a magnifying glass lol...and it\'s been written in full & complete English sentences.  The packaging is also handsome & the tracker comes in different colors.3rd, the watch band is so cool!  Instructions are provided for band removal and any traditional watchband in the appropriate width can by purchased for the unit.  It is also very secure with the band supplied.  I have lost a few trackers walking because the bands were trash and did not secure the tracker correctly to my wrist.4th, the applications work great and are easily customized to your individual specs via the app you bind the tracker to.  The button on the side of the watch allows you to scroll through to the unit you want to measure and the touch screen is responsive even though it is a bit sensitive and it can be easy to scroll too far.  Just pushing the button will take you back to whatever screen you want.I will update my review after I have utilized the tracker for a couple weeks.  Also, it comes with a full 1 year warranty which is important since a lot of economical trackers tend to die within a few months if not sooner.  Hopefully I\'ll get tons of good use from this one.All in all, I highly recommend and it would be a great gift, too!6/23/2020 UpdateI\'m still in love with this watch.  It has not failed me yet, no glitches.  I charge it for about 1/2 hr a day just to ""top off"" the charge.  I\'m positive this watch could go a full week and still have charge.  I seriously do not take this watch off unless I\'m in the hot shower.  It\'s the perfect and simple tracker for those who are on a budget, have never had one, had trash trackers, or those who are electronically challenged.  It is also perfect for elderly because it might encourage activity and good sleep...yes it tracks sleep but you have to wear it. Eww.  Anyway, nuff said.  Get this watch. ✌❤\n', ""\n  I am very impressed with this watch/fitness tracker. I have had a few fitbits that have died on me. I wanted to try something different.This watches battery life is amazing. Im not sure if you can see well in the pictures or not. I charged this up on Tuesday last week. Today is Wednesday. It is at 48% battery life remaining. I am blown away with that.It has find your phone feature. Which is really cool if you are like me and have kids that walk off with your phone. Just push the button on the watch. They will come running out with your phone! 😉The ease of the app is awesome. And pairing it was a very simple process.The only thing I warn and it is absolutely not a problem. Is this watch is called green in color. It's more of a tealish blue. Again not an issue. Just look at the pictures. The 'green' is pretty true to color of photo.The size is pretty awesome too. My 4 year old wanted to wear it for a few minutes. Fit him. Fits me. And i even had a friend try it on. Fit him too.Definately would recommend and repurchase this. Wish I hadnt wasted money on fitbits before!$$\n"", '\n  This is a fantastic smart watch fitness tracker for the low cost. But to start it needs mobile apps (VeryFitPro) which is easy to download and setup via QR code.It’s looks and finish is cool 😎  and look like Apple Watch.After use of a week it’s BATTERY 🔋 life is very impressive which stands for long and quickly charged.It has different mode Sports, Alarm, Relax and Heartrate. It help to track heartbeat and relax your breath by doing inhale and exhale.Now it is easy and I can  track my steps and calories on daily basis & weekly.My son (4.5yrs) try it and it fits and works for him as well. Size is awesome.Overall features and compare to price, it’s right choice.\n', ""\n  Have been using this smart watch for a while now and it's really great and meets all my requirements.  It looks a lot like the Apple watch and many of my friends have asked me about it. The battery life is really good.I haven't used all the features , I mainly use it to track my steps and workouts .The only thing I don't like is that the band gets dirty very quickly and it's hard to clean it.\n"", ""\n  I'm very happy with this product, and with its price too. The display is always highly visible, even in bright sunlight .I have been wearing a wilful watch (exactly the same model) for about 2 months now and it has always functioned flawlessly. The battery too lasts for some days without recharge, which takes a very short time anyway. Well worth the price.\n"", '\n  Lo uso todos los días, la batería le dura por semanas. El único inconveniente que las instrucciones no vienen en español, tuve que buscar en internet, fuera de ello esta genial\n', '\n  Wow wow wow!!! This is one of the best things I’ve ever bought. Value for money you bet your booties it does everything that products costing 4 to 7 times more.You will never regret buying this\n', '\n  Delivery was faster than promised and packed really well! Immediately went to charge the watch and set up was easy peasy! I loved the green colour! Instruction manual available in the box in English. Cant wait to use it! Highly recommended!\n']"
