,Title,Alias,Link,Seller,Price,Rating,Review Count,Availability,Features,Image Data,Image Extension
0,Redragon M602 RGB Wired Gaming Mouse RGB Spectrum Backlit Ergonomic Mouse Griffin Programmable with 7 Backlight Modes up to 7200 DPI for Windows PC Gamers (Black),RedragonM,https://www.amazon.com/gp/slredirect/picassoRedirect.html/ref=pa_sp_atf_aps_sr_pg1_1?ie=UTF8&adId=A04380321YM7ZOQJNVN9G&url=%2FRedragon-M602-Ergonomic-High-Precision-Programmable%2Fdp%2FB011HMDZ0Q%2Fref%3Dsr_1_1_sspa%3Fdchild%3D1%26keywords%3Dgaming%2Bmouse%26qid%3D1614633483%26sr%3D8-1-spons%26psc%3D1&qualifier=1614633483&id=1912198571670031&widgetName=sp_atf,Redragon,$19.99,4.7,"16,340",In Stock.,"['WIRED GAMING MOUSE; built for Gaming Computers - Ergonomic Redragon M602-RGB “Griffin” RGB Backlit Gaming PC Mouse up to 7200 DPI (user adjustable 800/1200/1600/2400/7200 DPI), 10G acceleration. The High-Precision Sensor delivers Pinpoint Accuracy while the Gaming Grade Micro Switches ensure longevity, greater durability and extreme responsiveness, giving you an even greater edge over your competition', 'RGB BACKLIT MMO PROGRAMMABLE PC GAMING MOUSE; 7 MMO user programmable buttons, 5 Memory Profiles each with distinct LED color option for quick identification. 7 different backlight modes. (Backlight can be disabled) The Redragon M602-RGB Gaming Mouse offers you total personalization for your Gaming Computer and Gaming Laptop', 'ERGONOMIC GAMER MOUSE; Delivering an extremely comfortable and precise experience for Computer Games. The ergonomic shape of the Redragon M602-RGB PC Gaming Mouse is built for comfort, fits naturally in your hand, the buttons are tuned to reduce click fatigue', 'HIGH-END PC GAMING MOUSE FEATURES; The Redragon M602-RGB Mouse features; Built-in Weight Tuning for the right balance, Anti-Skid Scroll Wheel, Durable smooth TEFLON feet pads for ultimate gaming control. 7 programmable buttons. Total 8 buttons. The Mouse works great with Redragon Gaming Mousepads & Keyboards. Comes with 6 foot, 3mm strong high-speed braided fiber cable and a gold-plated corrosion free USB connector for a reliable connection', 'PC GAMING MOUSE COMPATIBILITY: Windows 10, Windows 8, Windows 7, Windows Vista, or Windows XP, Limited Mac OS support Works well with all major Gaming Computers Brands and Gaming Laptops']","/9j/4AAQSkZJRgABAQAAAQABAAD/2wCEAAwMDQsNCxAODBANEA4QExYRDRASGR8dFhsVHhgYEx4YFRsVFBwYGyAZHhsjKyQpIyA6LCYxGSYoRC5FOUsyLkIBCA4NDhITDhERExMREhYTJxsSES4cHR8TKQsfERYeFhcfEBYZHBAXIRcpDCMRCy8gKBwUJxYSERQeFg4bHTAeIP/AABEIASwAswMBIgACEQEDEQH/xACqAAABBQEBAQAAAAAAAAAAAAAAAQMEBQYCBwgQAAEDAgMEBQgIBAYDAAAAAAEAAgMEEQUhMQYSQVETYXGRsSIjMlJygaGyFDM0QmJzksEkgqLRBxUlQ1NjNeHwAQEAAwEBAQAAAAAAAAAAAAAAAwQFAgEGEQACAgEBBgIIBAQHAAAAAAAAAQIDEQQSITFBUXFhwSIyQlKBkaGxEyMzcgWCstEUU2Kis8Lw/9oADAMBAAIRAxEAPwD1VCEIAQhCAEIQgBCEIASPO6xx5AlKkqzaknPKJ5/pK8PUstDNHO2eSwIyFyn1ltmZ3S1jgb5Rn5utalcQltJvx8ya2Gw0usU/nFPzBCEKQgBCEIAQhCAEIQgBCEIAQhCAEIQgBCEIAQhVOLbTUGGyGFgfU1LfTjj0b1PegLZC83q9tcXflTQ01OPe9ypJMfx6oPnK6cDlGQz5AEB7GirzpJ/yn/KVhdjqyd+JzQzPll6WEvDnuJsWuHjvLdVWVJP+U/5SvD1cUYfZDOvP5B+ZvIkLcLB7Gva7EjzNO75mcwt4oKfV/mf9bLuq/U/kj/xRMY7auroa2eCqgZNBHK9jSzKQNB7itNhm0ODYodymnAm4wS+RJ3HJ3uK8qxh1sQq/zpPmKzEjWudfiDcFWCifRKF5Lgu1GNUIEcr/AKZAPuTen7pNV6Ph+0mFVoAe800vqTfs/wBFAWaEgIIuEqAEIQgBCEIAQhCAEIQgBIieaGnidLO9rI25ucVhMXxyfESYYN6Kj/rf7aAssb2iLr02Fv6paoeESwL2gDxKm2AFgo8gyQFNObJpjk5VZEqJGc0Bt9laqGmx2IzyRxRvgmbvvIDb3jOpW6xzH8LpMKqHxTwVUpb0TIIZGF5L/I56BeJYhmymB9Z3yqKGtGYQG02YxuCgxNhrWbkUwMG+HZR3IIfJmvTjtFs6NcRo/wBa+fymZGt6N2XArlJLcjuU5SeZPLxjPglhfbBpsYkY/EKp8bmvjfM90b25tc0uJBB5FUSd3v4eEDhG3wCaXRwTaXVXTACM1T0wzCuo0BZUdfiFD9lne1vGM5s7nLU0W1UeTK+As/7Ys2+9pzWLCEB6xT1NNVR9JTSskbzafEahKvJ4amehnFVTucx0QL3AfeaMy08CCvTsHxqhxiB8tNvtfEdyeJ+rT4FASkIQgBCEIARimI0mE0EtbWOtFENOLncGM5lyQkAXOQGpXju2+LjF6mAQfYqYydE713ndu9AWtZidVixZPOd2IgOggHotB8SoigYa/fw+E8WgsPuJCnIAKZk0TyafogKGsUCM5qfWquZqgJNcbtpvaf8AKo6drD5NN7TvlXVdhUraWOos7y+NwBb3qGVkYuEW98niPcswplONkk0lCOX1xnkR7t4Fq4l+rd2FQ20rnvDWOjcSbWDhf4kXVxX0DqCnbfes9l80lZGMoQb3y9VdhGmUoWTTWIYyue98l9xsG8UfsN8EDVDfqo/Yb4JW6qYrFjThW8aqYFax6IB8IQhAR6g2im/Lt35LY/4fM/gKyX15w3uCxNUbU8562D4gr0XYVm5s80+vNK9AaJCEIAQhCASRgkjew6PaWnsIsvAq6MiiaD6UTg13uuw/Fe/LxfG4BHVYlCPuVExb2b5lCAiYI+9LIz1JPEK4WcwN1ppo+bA7uNv3WjQAm36JxNP0QFHWKsCs6rUqsQHdWfJpvbPgvQcSiEuz9EGRwPIAN5dAvPKm7m04Gu+fBbzEA1uC0sdSwybgHmxz8Fm30Sss001wrntP5Y8ytZqFXKqHO14SM9FH0srGtnoKotcN+EtAt7Ba4kK4213BSUgAA8hVe81zoxNTNDAR0ZYQS3tFhb3KVte/epqbqYl1DndpreVec/FCeo2J11f5nkZ1o8zH7DfBK3VdhvmY/Yb4BchaRZJ0KtY1Uwq1i0QEhKkQgK2vdajf+KW3cHL1zZSLotnKFvExl597iV4/iP2aFvrOc7wH7r3HDYxDhtLH6sEY/pCAEIQgBCEIAXmO08IZj9WOEzIpO+MR+LF6csJtpFuYrSy/80Dm++N/9pUB5nhTizEWNP3g5h7ifELVLI3EGJgnIMlBPYTfwK1x1KAVNyaLtNv0QFLUqtKs59VWvCASQ2dTHlItxjMxFBDuWu63gsLP6MHt/stHi0jnUcABtYC59wWnRDNWofRGddop3W6a5cKG3LsyAyWVrmnf38xvA6fCyttqNx+GwP8AvLLNLS4bjvKBzVxj0xdQwR8mXPcAuaYJ1ahvkke3aSdtunujnFLbl2aGQ3zEfsN8AmFOI8xH7DfAKGRms40CRCrWPRVUOqtI9EBJSONmlAXEj2MZeRzWtyF3GwQEGrb0lVSQjmz4uC9taA1oA0AsF4XVSNfUvkhePNx+bkYdHBpNwRxBK9H2V2rbX7lBiZDK/SGXhN/Z6A1yEIQAhCEALLbcQ3pqKf1JnRe57CfFi1KzW3b7YJGzg+qjDu56A8zxCIvoHn1bH42/dSqSTpaSF/EsAPaMiu6OAS4dVRguJDS7yiXHTm4k8FAwl16Qs4xyOH7qtXPLsj7r+hrauSmtLPn+EovvFlqm36LpcP0VkySqnVc9Wc6rnIBioyji9v8AYqfXvAw+IuuQoVR9VH+YPArh5MsYjkJcxubQrdV2xG6OM7ccLvk0KL41w1MGm/xIYX7skMTtLm7wFgcrahXOLG9NH7CqxTwD7p7yu6mR74iHkndbZvYlduzXdDHr439mKr4wq1FbTbsxh9maJ4tEz2W+CgnVWMg820fhHgoDtVUM8chCtI1WwqyYgHwuJGh+60gHO9iuk9Ts6SoDepRWS2YyfRFihZtqT99Z7ZKGuAjDwAAN0Cw5lzQob4bsaRcEZtcNQVNxjKZ7f+1jfmKdLB0AXsHmMX1RJqp7d10us2ejbGY/UYlG+grzvVdMwOZNxki0u/8AG1ateS7IkxbSUx0D2Ssd+guXrSkKYIQhACo9tYTLs5O/jA+ObucrxN41B9Jweth9eCT5SUB5Zs7aSeSI6PYVQ4eDFV1kB+64Ed5BU7Z2csr4CfvZFNVLeh2lqWcJN8j51mQ3ai1cpQTXcmlPMYR6fYlrhyW65K0yEgThVzgrOZV7ggI1T9Qz8xvgUwXNb6RAUmq+zDqexScGbG+WpEjGPyZbeAPNAVfSR+s3vXEpBiJGYIW0ENNf6mH9I/sshXhoq6hrQA3pLBo04IDTS6e5QSM1YTKEQgOogrBihRBTGoB5W2Dx79RI7g1qqFeYSejpaqXqICz9W2qpJc2l82SQlsyjLoYnFHb9cBzmee6wVnuOLAOCqJfOYi3qF+9xK0oaAwK9FYUV4HDeW2PbNxP/AM/o/aee6N69UWC2Wi38bB4Q08j/AHuLWLero8BCEIAQQCCDmDkUIQHhUG9SYgWHJ0M72H3PKmY75vH4JhpIG/EbiTaJjaTaSuY4hl5RKy/JzQ5N4+d+KhqBxYM+yxVGaxdVLqminbPZt065TyvjjPkSd4FckpsOu0FBKvFwZlUFwU56hvQESp+yn2mfME/gp/iagc2MTNT9lf2t+YJugqIaWplfMXBrowG2FyTdD01Y1WNrM62brnA+ICtX4x/wQOPXIbfAZqoJdJO177b8kzXOA0zcNEBq5tVEspkuqj2Q8OmBSWplgTwQHSton9FhEh4vKqDop1S7cw6JnMFyo6hZ/Cj1mUrp4lRHnOz6JNv7GZgG/XuPKw7gFpRos5QC8zn+s4nvN1fOeGsc7kFeLpr9jGb8+IVHIxQN9wc8+IWtVFsXCY8BbKdamaWf47g+DFeoAQhCAEkskcMT5ZXBkcbS+R50DQC4k9gSrD/4i4saagiwuA2lrc5+qBpHzlAebYlVnHK6avqQ8CR7hA0HRgtuj3NIVjXMDtn6ct0icWKip/sxb6jwfc5pHiAtFD57Z6pZxicHqGccuPg8mVrdy01nuaiOX/plmP8A3IlO/egYepPXVbRv8yByUveUxqjjio7l3dNuQESp+zSdig8FPnzp5fYKi0bI5atjJm78ZYTu3Nr+4hARy9t7Xz5DVOR+VPBbjLH8wWnibFFlExjB+EALNQ+ViEfXU3/rJQGrl1TICffqmkB21drkLpAB8SpGKO3Iw31IwPemYhv1ETObgm8ZcTK4fit3ZKCUcyg+hlWelqtPH3KpSfdtJEGhFgpFXLancOJTMHksUStku2ynNU9X2DrvpWBdA8+co3mL+Q3exadeT7EVRo8UDTlFVeYf7erCvWEAIQhAISALlfPeO4i7F8bqq0m8Zf0dN1Qt8lq9t2yr3Yfs3VvjNpZgKaHtkO6e5l18+tbZoCAmU9+iqPYD2/yuBK0GBSNnpa+AcYS5UVGAZA27PLD2Hmd5v7Kfsk62JviOkkT2qSCzKKMvXrOmv8MS+MZp+RBpjulzesqXvKG4Fk8jeTiE6HKM0k8pPqiRvJCU3dF0OjmXOGQfgd4FQKB38XF7JHwU92bHdhVTTSCKSKVwJDdba6IDVtdms3R54hD+cT4lSXYlJ/sxW63qPh4/1CDtcT+koemtcm12SuCh4dBBK5XD3WCAn4cOkr2fhaSq+vdv1B7SfirDBCOnmkOjWFVEjt6UlTOOIQfVv5bjHr9LWal+5TCK7tybC9mKrqXbzwOZU57rBVhO9N2Zf/WIUJsF/hgIa4g2c1wc0jnlpkOS9uwqsFdh8M49It3ZRyeMnLxXDxutf2NPjzJW52QriyrnoHnKQdPD7QsHD3j5UBskIQgPN/8AEuqJfQUI/HUyfIxeY2Wv27nM21ErOEEMUQ7jL4vWS4oCRG9zJY33ORbveTy8kj3fupOEn6NtCPbe3vBUOQEcJByG92HmnYZC/EYqgDdvI3eHXcAqWv14dyC6CnXbHrBr6DlYLV1QOUjk0Cnqw3rpus3TAXtscTmujFX6df7F9hy6W6bSqEnHAqeP0ArYFNspacatLuPlHLu0QFdcE2bcnkMz8FZYfBUCrZM+NzI2h2bstRbTVTowxgsxrWjqFlKa4oCTdckri6QlAdXUaVy6c5RXuugLTD5eihmPNpVcHXLj1rnpdyMD1lwzQ9ZWjdHFWjfvRk/9+PIpVQxZqZ+9KPyUBJXZKJCLvBy99v3anZjlZFODlr8e70lnF0vaKwa8C/D9+QCl0FX9CxalqNGslAk9g+SVGpwQH3vo3X+bmSolSgPdEJKJ/S0NPJ68Mbu9oKEB4PtK8ybS4k48Jyz9IDFTNtvi4aQTbytPerPGiXY7iJOpqpvnKr2DXM6WAAuSeSA5du7v+129hI+Nvilp8mgjg5dPJIJJdz9Ds/8Afckh9D3ruHrQ/d5npIqsq6XrDflCbUiuFsQcPwN+VqYU97zZN9f7HCjhJdEIlQhVToUJwLgLsIB5qeBUcJ0FAP7yQuTV1ySgBzkylJSBAN1F7RkcCnGeiunt32WTcehC1bt+m0T91zg++0pL+s62cJy6v64G5E/Rtab3tdvO37tPHwKacFIpmNPpXtxFzY9TgNQso5Lel3XRue0ENdYN0zAGosAotWMiprX5JtkJq6ynpW6zysj7yAgPaMMYYsMpGO1bBGD+gIQAALDQaIQHh+1VI+j2krWOFmzv+kwnm1+fwdcKgtyJB4Eahew7e4Q+sw9lfTtvPQ3MgGpgOv6F4+CCLhAckndDXb29xN/JITsAuQOJIXJU3D4ukrIGc3tLuy9yuo8US1xzOC6sXE//ACso5ADua0KMnaqQS19TINC82700vZ8We2Y259wQhKuCEAuwuUqA7C7BTaW6A7uuSUl0iAClC4ShAPt1C5mZ0c3U7MIUmRvT0tx6ca06fTqup9pP8SH7ksSXy+xqaeCtrvq9tLbrXb1l5rsQinojuqO119U8CswyyYJVq9i6Q1eLPq3i8VGzyfzn5DubdYkCWSRkMDXSTSuDIo26lxyAC92wHDGYThUNLkZfTqX85TqgJKEIQAQCCCAQciCvGdqsBOC1/SQt/wBOqXE05Gkb9TEV7Mivo6XEKOWlrGB8Mos4eBaeBCA+dLBWtB5iGeudkI2FkJ5yOG78E/W4JNQ4jJSPlZJCw+bmGrma5t4EKvxKqZIGUlP9TFy4uUSsTlsx3v2vBc/i/VNqml1QeosWFj8pc3Nrc8dEQYvRLjq4kpxIAAABwSqUxQQhCAVKuUqAVdXXF0oQHS5uhIgFXQXC7CA7CdikMT78OITISruMpRalF4aeU/EkhOUJRnB4lF5T8f8A3Ecngv5yHNjsy3korGzSSNihjkkleQ2KNgJcXHQABSGPcw3Cn0te6mnjqIzuSRODmlezlFtyxst8Vyz4dDfjXo9Vl7a01z4wf6Ts8Jezk9K2V2WGFWra/dkxF47Wwjk1adJQ1AqqOGpaC1k0bZGg8iAUqjPnWmm0+KeH3BCEIeAhCEB4ltW3E6HGZ6apd5qXztNK0WD4z+7dCs7Ey3lH3Be77T4EzGMMLIg0VkF5aJ59biw9T14b5Yc5kjXMkYSyRjsiHDIghcRjGO6KS/uTTtssw5ycsLC7CoQhdkIIQhACmRwRMjE1W5zWuziiZ6bxzzya3rPco8LWvmYHeje7/ZGZ+C0kFNh5c6ateyd7274jbcBjMrWtY5BSKqc09n4soX6qFONpSfgll9unfJUxvppXBkNC599AHuLz2WFv6VyaeGcONGXtlYCZKWT07DUscAA+3EWBVniEgZ0EuHsLY98Fj22zcDcNyNxmrXFoY6ulZX046Osia2XebqRrn1tVJ02xfoqXjvbXhlPKw/DDOP8AHVflOXoqxtLqpp4w8cOjMQhSasNM3SMAa2VokDRoCdQOx11GVhGinlZBdBcpQvT07SrlCAVWOD4e7FcWp6IegTv1J5RNzcq1xDWkleu7D4QaLDjXTttVVtnDm2DVgQGnaGtaGtADQLNA0A5BKhCAEIQgBCEIAWJ2y2aNTfFcMZ/FMF6uBv8Aut5t/GFtkID50a4OFwlXpe12yri5+KYQy7/TraVvzxLzMODm3bogFSpEIB2FwbK0nQ5O7DkVLohGyaQTvDAAW5nPPKwVend5jwBJcOGTXjwcrVU0nHcm08pP1eHBv4ZieOuM1KLeG19OmeXHdyLx89GQyIPaynhIe0NzLnJZcWBka2IebuWPHNhACouiHrx27T/a66DmRZsO9JwdwHZxJVx6izfuhWub57K4JLPwXLqzOl/C6dzkm8ZwnL2nxfVt8c/Y6qCOkDBpG0M9+p+JKYSIWW3ltmhFYSQJUiFydHaVchdMZLNLHBTtL55nCOFg1LjkgL3ZvCDjWLNjeD9DprS1h8Iv517OAALBRNn8JiwXC46YWMx85VyetKVMQAhCEAIQhACEIQAhCEALC7V7JmUyYlg7PPenVUo0fzfH+NbpCA+dAQeYtk4HUHkUq9b2p2TFeX1+FBkddrPFoyb9g9eRnea90cjXRysJbJG8Wc1w1BBQCpEJEAqFylQHSVcpUAISXAT9JTVtfN0NBBLUS8QwZDredGhAMlwaLlep7DYCYWf5xWsInmFqFh+5Efv9si5wPYaKItqccLJ5NWUjPqh7Z1etxpkEAqEIQAhCEAIQhACEIQAhCEAIQhACo9o9mKTGm9NGRBXtFo5+DvwzK8QgPnutpK3Dqk0uIROhmH6XD1mHRwUa4X0ZW0FDiEPQ10EU8fAPGnW06tPYsdX7E4Axhkh+mR8miTL+thKA8juEm80aleuUexGASRB8rq13bIP2jV7Bsps1TZtoYnnnMTJ85IQHhUTZZ3hlPHLK86NjaXHuaCtNRbI7SVmsDaSP16gj5G3evZYoYIGbkEccTODY2ho7mgBCAx+HbB4ZBZ+JSy1j/U9CL4HfWwp6enpYhDTRRwxN0ZGAB3BCEAIQhACEIQAhCEAIQhAf/9k=







",jpeg
1,Razer DeathAdder Essential Gaming Mouse: 6400 DPI Optical Sensor - 5 Programmable Buttons - Mechanical Switches - Rubber Side Grips - White,RazerDeat,https://www.amazon.com/Razer-DeathAdder-Essential-Gaming-Mouse/dp/B07Y693ND1/ref=sr_1_3?dchild=1&keywords=gaming+mouse&qid=1614633483&sr=8-3,Razer,$29.99,4.7,"20,714",In Stock.,"['The No.1 Best-Selling Gaming Peripherals Manufacturer in the US: Source - The NPD Group, Inc., U.S. Retail Tracking Service, Gaming Designed: Keyboards, Mice, PC Headsets, and PC Microphones, Based on dollar sales, Jan. 2017- June 2020 combined', 'High-Precision 6,400 DPI Optical Sensor: Offers on-the-fly sensitivity adjustment through dedicated DPI buttons (reprogrammable) for gaming and creative work', 'Durable Mechanical Switches: Supports up to 10 million clicks, backed by a 2 year warranty', 'Ridged, Rubberized Scroll Wheel for Maximum Accuracy: Small, tactile bumps increases grip and allows for more controlled scrolling in high-stakes gaming situations', '5 Programmable Buttons: Allows for button remapping and assignment of complex macro functions through Razer Synapse']",https://images-na.ssl-images-amazon.com/images/I/51S6IQ2lGwL.__AC_SX300_SY300_QL70_ML2_,jpg
2,Logitech G502 Hero High Performance Gaming Mouse,LogitechG,https://www.amazon.com/Logitech-G502-Performance-Gaming-Mouse/dp/B07GBZ4Q68/ref=sr_1_4?dchild=1&keywords=gaming+mouse&qid=1614633483&sr=8-4,logitech G,$47.49,4.6,"16,573",In Stock.,"['Hero 25K sensor through a software update from G HUB, this upgrade is free to all players: Our most advanced, with 1:1 tracking, 400+ ips, and 100 - 25,600 max dpi sensitivity plus zero smoothing, filtering, or acceleration', '11 customizable buttons and onboard memory: Assign custom commands to the buttons and save up to five ready to play profiles directly to the mouse', 'Adjustable weight system: Arrange up to five removable 3.6 grams weights inside the mouse for personalized weight and balance tuning', ""Programmable RGB Lighting and Lightsync technology: Customize lighting from nearly 16.8 million colors to match your team's colors, sport your own or sync colors with other Logitech G gear"", 'Mechanical switch button tensioning: Metal spring tensioning system and pivot hinges are built into left and right gaming mouse buttons for a crisp, clean click feel with rapid click feedback', '1 year hardware limited warranty']",https://images-na.ssl-images-amazon.com/images/I/51IOmsWQVAL.__AC_SX300_SY300_QL70_ML2_,jpg
3,"PICTEK Gaming Mouse Wired [7200 DPI] [Programmable] [Breathing Light] Ergonomic Game USB Computer Mice RGB Gamer Desktop Laptop PC Gaming Mouse, 7 Buttons for Windows 7/8/10/XP Vista Linux, Black",PICTEKGam,https://www.amazon.com/PICTEK-Programmable-Breathing-Ergonomic-Computer/dp/B01FZ3BR5S/ref=sr_1_5?dchild=1&keywords=gaming+mouse&qid=1614633483&sr=8-5,PICTEK,$15.99,4.5,"19,002",In Stock.,"['【Excellent gaming performance with 7200 DPI and 4 polling rate】 PICTEK T7 programmable gaming mice, default five DPI levels available from 1200/2400/3500/5500/7200 DPI. With two DPI button, you can adjust the dpi easily to get high accuracy and consistent responsiveness at any speed. 4 polling rate is adjustable: 125Hz/250Hz/500Hz/1000Hz, polling rate ensures smooth AND high-speed movement, up to 1000Hz makes it faster and more accurate than ordinary mouse.', '【All mouse buttons are programmable】 support macro editing, 7 mouse buttons can be programmed by PICTEK easy-to-program gaming software which makes the mouse more intelligent and meets more demands for different games. Great value and control FPS gaming mouse, also excellent for MOBA/ RTS games. (Driver Disk included) Compatible with Windows 10, Windows 8, Windows 7, Windows XP, Vista, Linux etc. ( Note: no programming function for Mac system).', '【16 million color fancy cool LED backlit】 16 million color options for the backlight setting to match your style. Easily shut on AND off the backlight with the convenient switch on the bottom. Plus, adopts high-definition optical gaming sensor, ensure quickly switch for different games.', '【Ergonomic design】 PICTEK T7 with symmetrical & streamlined provides a comfortable claw-grip design, long-term use without fatigue. Top choice for computer game players to keep your grip Firmly during game play. Excellent cool wired PC gaming mouse for casual gamers.', '【Reliable quality & Service】PICTEK T7 PC gaming mouse, 30 million clicks lifespan , intricate polish manufacturing processes and meticulous assembly provide the functional reliability of the mouse for years. \xa0PICTEK will spare no effort to provide the satisfied service to every customer, feel free to contact us when you meet any problem, we will reply you within 12 hours to help you.']","/9j/4AAQSkZJRgABAQAAAQABAAD/2wCEAAwMDQsNCxAODBANEA4QExYRDRASGR8dFhsVHhgYEx4YFRsVFBwYGyAZHhsjKyQpIyA6LCYxGSYoRC5FOUsyLkIBCA4NDhITDhERExMREhYTJxsSES4cHR8TKQsfERYeFhcfEBYZHBAXIRcpDCMRCy8gKBwUJxYSERQeFg4bHTAeIP/AABEIASwAuAMBIgACEQEDEQH/xACkAAABBAMBAAAAAAAAAAAAAAAAAQIDBAUGBwgQAAEDAgIFBwoFBAIDAQAAAAEAAgMEEQUxBhIhQWETIlFxcoGRBxQjMlKCoaKxwUJTYpLCFTOy4SRzNEPR0wEBAAMBAQAAAAAAAAAAAAAAAAIDBAEFEQACAgAEAwUGBQQDAAAAAAAAAQIRAxIhQTFRcQQiQmGBE2JykbHBMmOCstEjkqHhUnTw/9oADAMBAAIRAxEAPwDqqEIQAhCEAIQhAcp8oWEvoa+HHKIWErgyq4Tbn++Fe0KxZkFf5nlSYoDPSDcyqA9LH763LH6rBam2AV0wE+JMLIWDaWuzY93vgaq4XTisoamfD5CY6ykn5WmPs1ER/DwdZAeikJmDYjHi2FU1dHYcswGRvsyZPZ7rgU9ACFjtJMZ/oWF+eCIS+lZEGK5heLUOK0onpX7gZIz67boCVCEIAQhCAEIQgBCEIAQhCAEIQgBCEIAQhYvGtJ8GwV3JVMj5KqwcKaEXf35MagMotJ0j02gpC+jwXUqKvKSfOGI/zctJxvSvF8ZDoWnzOiOcMR57uEr1q7WhosBZAPkfPJM6qklkkqy8SumcbvLwb3utj0nHnsGG6R0gs+qYIK8N3VUQt84/wWuBJM0vpnWJvCeUA/S6zXeBsfFAbjo3pVTYC2pgna+aCeVk0LYvwPOyS66bDpNhUgGuZor7y27fFhK84BbdgNZysRpJTz4heHizo91AbZ5RcTo6rDaOGknhmvOXyhh2izPxhaXgddPC4ebyviqINsTm72b2npAUuM0hhlZiVO1rtQjzmNwuDuuR0HIqGuhgihpsWw1gZET6Zgy27LcNt2lXxw3KM5J6x1cd8nNdPEUyxFGUItOpaKW2fk+vhOrYbpbC8CPFGGJ/50YvH3jNq2eCeCojElPJHKw/iYQVxeN7Hsa5m1jwHM6j9wpWOkheJIJJIpBk+MkHxCoLjsiFz/DNK62keI8TvU035oHpWfZ63+mqKergbPTSMlifta9qAVCEIAQhCAEIQgBCEIAQqeP41S4HQGom58r+ZSwDN71xepx/HcSLxV1crWHaIYTqR26LNzQHa8Sx3B8MY41dVCJG5QtN5SegMbcrz7VTzVlXPWVP96okMj+F8mjg0bAjUaEwoCJCVIgHBSMcGvDiLt2h46Wkarh3gqJOCAovhfHM+IAvLDsIGbdzuogjxU9OKuCojmjY4PjN7O2XG8G5GYV6KVkM8E8oLogRBVAexmw938FnH4iI43y4bS0TxETy+s27gOnZqrdhYCnGcs1ZeMauVeSbV8NejMeLjTg4xjDNfjuoJ3wb1fQsnEaIsImDtRzbSNIBFjmDtWPwd1M2pnwmR+vRVoPmzjm1xFwOBcPiAoZtIMQnDTGyljA3Mjz/AHKBxkxSQSMbHBWxC7OTBaJLc7eTzm7lLDWHd4cpZtotaNbpNPi/De+hXie0knHEhGMdsRStqezcXFcNyagEtNNUYdP/AHKZ5MfFu/7EdZWWWIxKq5V1FizQBMLQV7B7bdnzD7LLgtIBbta4BzDwO0LLiQyyrZq4/A+H8GnCm5wTaqXCa/MTp/S4+VETxdQxvqKdxdTSzQuOZjcW/Qqw5QOVJeXo9IdIqc8ytlfwlAf/AJhZ7CdNK81IjxRkL4DnJE0h4WlvChadSRrtwO3qQHfGPZIxr43BzHgOY4ZEHaCEq1TQyuJbNh0jr8n6al7BPOHc4/MtrQAhCEAIQhAcS0nr5cSx6pe/+1TPNNTM6GtNietxWvHYQ7oW1aY0HmGkMrmi0NYBUx9rJ4/ctXKAeekKIpWHYW9GXUgoCIoTimoATgmpQgHhoeHRHKVup72bT+76qDDKp1NiEZf6jyIZweg83b1KZU65gEjZW5TDXPB+Tvjt71bCbhKMlsyE4qSlF8GqLldB5pWzQEu1Q68Q/QdoUNPNyEzJGukaWEEA31Ssri/pafDq0Zzwakh/W1Ya791iN4VmNHJiSy6K80ej1XyKMGWfDjm1dZZ/Em1L6GaxRrWyyan9itY2UcJCCQe8g+AU+Dz8rR6jvXgOoeydoVac8thVG87C176Z3AnnMJ7JYPEqphkvI4iGnY2cahH693zLZj1KF7wdr/rzVr+yTcf1xRHB0XnbT+OLq/VJM2cqFwU5CjK8o2FRwVd7VccFA4IDLYRXGirKStybG/k6j/rPMcuwLhtPYtkjOR2/Zdk0arDW4JTvebyxAwTdpnN+LbFAXkIQgBCEIDRPKRNTMpqCJ7CZ3yvMMvsgBoIPbXMCNi6Z5TKQvw2jqG5QzOY/3wuXwv5SIO35O60Ah2HW8U4pXBMGVuhABTU5NQCIQhAPCjnZylO/2ojyjer1XD6HuKcE9rg1wJ2tyeOlp2Ed4KAyjozLonG/8ie4P6XG31KwAF8iQnGeqp4p6APvTueCWngQ4Ob0XFlUJNlpxcRT9m91Cn1M2FhuHtE6p4jlHozNi78Eq2E3Mcscn2WNmcSYqhubwH3/AFg6rvmF/eW4UdNh81A0siAZOxvLtBO0jv3FUsaoYI8OY6lYGNgfcgey7YSp+0i1hr3Mk+VZnT9NH1iSjBp4j5zzL+1X9DIRyCaJkoykaHIKxeES8pR6m+J1u47VkyVjLxjgq7grJULkBFGdWZp3HYV0DQqp1KusojlI1tTF/g/6tXPXjeMxtC2bAJJW45RSQNe/WJZMGDKNwsSeDSgOoIQhACEIQFDSij8+0frYc3iIyx9pnPXnWmeGPs4gNd4XzHiF6YIBFivOeKUPmlfWUjvXgle1vFoP3btQE/JyOaXBjy0ZuA2Ku9rmEEgi6pNqqsMLGzShhzaDYFT08j5WvZI4ucOc0noyK01hNNRc81WrqqSt8Ndu6QuW9USpEBCzExEJUiAEqanBAQ1bbsimGY9DJ1ja097dnuKmASQGgknIBZPV5SOWL226zO2znDxFx7yoXDYWlh50hcH8ALbB1goDYsFqxEDRP5zy4viDTlsuRfJbG5sVTDJC7J7CxwOYuLXXOYJTBURTDON7XHqB2jvC6IbOIcN4u1wQGoYOXQ1ctO/Pa09ppWxLAVd4MZjnIs2Yhz+1fk3/ABB8VnzmgGlMKeUwoCIq7h1a+gq6OqY4tEVVFHU8YHkxuB/cFTKhmbr0tRH7UZLe0OcPiAgO7oTMGrPP8Io6vMzQRvf27AO+ZPQAhCEALkOn1J5tj4qWZTwMl72nkiuvLT/KHQcvg8VWwc+kl29h/MUlW6tV071aO/J6vpWhw4hOwMk5nqEB8fUd3cbjuSNJBDmmx3Kd414P1RH5HfYO/wA1BHvb3hROmQuDZwycEJkW1pZ7w+/x+qegBInIQDUIQgFBLXBwzaQR1jaqU7AySVrfVBEsfZO36O+VXFHM0PELiSBrcjKehp5wPgXftQFA6vSFs9JjVHFSRRTCUyRsDCQNmzYN61sjVcW6oBBLT3GyzuD61TrwvkLBGA6MNa3K+2+s0oCPEp4K6mNRTh45CVutrZ2eLf5M+KzUMvKQxv8AaYCeuySsp3mjki1y9rmloaQ0WcAXstqtG9tu9Y7DJNaiYN7CW/dAZMlMui6agApBn1ghCQHagOleT2p5bRwQHOjnlg+PLfzW1LnHk7n1MQxWi7E7Piwro6AEIQgBGK0grsLqqUi/LQvY3tWu3wKEIDzUAWOBk2RvvE87ug/tO3uVYtdE/nZtOq/6LP6RUhocZrKQXETZnvgb0NfzwsU8CVjX+2NWTtjZ8RY96nLLfdtqt+N1rw8/w+VHFe//AJbf7EN2Wf7J53ZOwqcpkHPhs7MXY9SOaGABt7W2fRFFtSfKrW9Pf7PzaF8ENQhCgdEQlSIBEjm68UjN5brN62874i470qVp1Xh3QboChJtfre2A/wARt+ZX8Hk5PEo+iQGMqhKzUlcwE2YSGdnMeIKIXSMqIntF3Ne1zQN5BBsgN+qbNp5HkgCMcpc5Xbz/AI2WsUPopqmHINfdg4bVmHGare19W0RwNIcylBvrEZGZ2RA9kLGSnVxmU/nRh3wA+yAvgoKiBslJQDroTLpboDMaIzim0xiGQqqeSH6S/WNdgXB6SfzbHsKqhcMZVMa5/wClzg0/Ald4QAhCEAIQhAcm8ocGpjkUv58DPEFzFoQe2IPZJsBILeDhsOziPouqeUhjmHDalu4ysPyELlMjjczEAva8PuetWNRyxea5Nu41oobO92zmt+XPzJ6R7DUuY0giRtx2h18FeqGhsYPHYsIT5vVB7PVY4PZxYecPEFbZLCJqc6m3WaHxn5h4qKk1fmqfR/xxj5pBowN+m4+njklQCksLqJ0VCTaMtvApQQRcIBEJUqAq1Y2sk9oap62/6I8FACQQ4ZgghZHYRYgEHMFROponeoSw8No8CgM/HJrsa4bwCsbUyRy4hC6A65Y0tmLch3quI6h7BFLIBC3czN3aVyNrI26rAA1AToTQUXQClwaN5vsAGZKACdslj0NHqj/6mH+63gHH6D7qRAU8RJFM17fWZI14K9DU0rZ6WGdvqyxskb1OaHLz5WjWo5eAuu36IT+c6L4c/oh5I+4TEgMqhCEAIQhAaV5SBfCaU9FT9WFceABFjkdi7D5SHAYPTcan+DlydlO4wPmJDQy1mnfdXQwsSanKMW4wVzeyj19NNyLklVurdLqUHtLoWk+tGTE/q2ub9x3LZsHl5WiDT68J5M9nNp8PosGG6zy3dMzZ2xtHxHzKzhMvJVmofUnaW+8OcPuFSSH1cXJVT2j1XHXZ1Hb8CqyzGJsu1kozadR3UdoWHQAm+qb/AIXZ8D096cl4HI5oASpgNtjt2R4J425IAUgUaeEBIFIFGFIEA9CRIHX9QX4n1f8AfcgAbZXcAB9SfspEwC19tydpPwTkA2bbBIOljvouneTWfldHXxb4KqRncQyRcydtaR0grcPJdPaTEqXhFMPmYgOnoQhACEIQGheUsjzKgZ0zPK5PcneV0fykyAVVBAN0b5FzkBdt1Vurutr6AebiNr/YeNvA7PrZEwLH68ewgiWPr9a3jsUzI+UjczLWaQDxzCiby7mM1owQBscHD7rgM3JI2pprjKRgc3r9YeBWGViMmGn1L7dtuFyTbuUCARCEIBUlgUIQBY7ie/b/AL+KeNboB6s/A7PikCeEAodwf4E/QKQEnId7tn+00J4QBqj8XO+nh/8AU9IhAKhJdF0Aqz2gUnm+lskW6pppWjxZN/Ba/dXtHpOR0rwuT2pTEfeaWIDuiEIQAhCEBx3yhTGTSLUGcFNGwfM9apTuYyzpGuc4bisrpNKajSbEXbmTGFvuARrFBpA4rThY08JtwUM20nFNrpeiISipaO65FtkhlnLyA3WyAVUnUkkZ0PNuo877qxALH6eKrVgLZw722jxCobbbb1bdt+8SSSpLgvoAOsUpUMTucQplE6NQhCAEqEIBU9IlQDgn3TEqAddCRCAVF01IgHEqOKbzfEKKoyEVTE8ngHAlISqNYfRjtID0whFPJytNFJ7cbH+LQUIAQhFdLyFBUzflQySftYXIDzfNVtlxCrlfe01RLIHdp5KnL4iMwOtUqdloQTm7aU7VbuCAvskia7a9niqdVPy0lm/22ZE7z0jgoiAMlGUAsbrSt8FcWMKylhyMUg/ELO6wrYwlKOJJcIJOXPK5Vfo2k+pFyScVz4da/wBDUJt0KokOTkxOCAeE5NCcgFTkiVACEqRANKaSlKYUA0lU6rbGOtWiq0/qN6yprxdPujh6O0dq4a3AaCeF2sPN42O7bGiNw7nBC5l5N8X5CsmwmY2jnvPS8JQOeO9n+CFA6dXWP0qk5LRrET0wGP8AeRGsgtd06cWaNTW/FJCw/vBQHEhsaEwqTcoygIyoSpSonICMrJwc/Dify3jwOz6lYsrKYdz6eqi/Rrju2rd2bV4sP+eDJfqUcy/YUYuijLlNfK6f7iJKmhKFhLx4TgmBPCAeFIxrneqO9MaLuAOVxdXI4zPUmFxIA1rAcFpwsNSq7dyUVFUrm+c3aitOT9CjExMqb0SUXJv3F7q1ZEGNHrPHU3al9F+tZAYY4ZytF8tn+0z+nTiSxLdT2/8AS2vs2Oqrs8eNcczvz79Lz0SMC7Z2Z3/X2vhSry7tv6lL0XS8JpA3EFX/ADejD9XldZ3RcfYKpIAJnAbB0dysfZmlF4kcKniqDcW8yk09dG8NVW6foWQx4ybUHiaQzaqlVrms2tlYqMqUqIrxT0iJyrzeq3vVhyqzfhUl4un3RzkXMDlfDj2HSR+sKqH4vAQtg0Ow0VePUG9sJfVynhHYN+chCidO3pmMYezFcLqaF51eWZZj/ZeOc13c4BPQgPOM8VRR1EtJWN5OogcWTNP1ByIO4qIkHJdu0u0YZjcHnNIGsxKFtojulZ+U9cIGvDI6GVrmFrix7HCzmuGwtIPQrIxUnV09uWble17HGyUqIp5TCqzpGVfwp1q0MOUjXNPgqBU9G/k6yJ36gtfZpVjYL99J/C9H+4pxVcJr3X86JrWJBzBslCkqRq1Mo/W4jxuolmlHK5R5Ovky1O0nzVjwpAogpAonR6yRk83roqi12PayQjgRquHcbrGq+0cvh5A2y0ZL+uBx2/sd/kr4SauuNqUfjjf2kzJjJd3NrB3CfwTpfVKPSTZDUu5aolkuXBziWE+zfZ8FnmVJdSRyBoAEMpc0e1GWtFlrmY2LY4XweYwPa06kcM4kYd7rtv4/dbOyzlnxHmptW+uda+luzzO3wiodmjkclGeWPT2UtPXIsvmtjXhnrcb7E65Jc4pic7Y0DedpWXCk1md92KzV+bTjB9bnfRSZ7U0rXN6fou3+350RFRuUhURWYsIiqsx53UFZKqyAuk1WgkuIaAMzwC7swdm8ndDqUU9e/OUinh7DOe/xkf8AIhblhlK3DMKpaMetDEGv7frPPe4lC4CVCEIAWj6baKefxuxPDWf85g9PCP8A3MH82reEIDzBG+41TmMj9ilK6hp1opbXxnC2frr4GfGZn81y1rtcfqHxV77/AMa/zH+UQ4dBCgGz2noKE1Up00+TJmZrv/KLvbax472hVVNUSsl5ItvdsTWP6woFox3F4uM4tNObae2rv7lWHahBPRpUPCeFEngrMWkwU8Ez6eZszLEt2OacnNOwtdwcFVBTwV1NqmiLSacWrTVNe6XaiJjAJ6e7qWQ8zpY7fG/iPiFdieP6U83HN5RhHb1FjIZnwk6tnMfsljdta4cQpL0ttZrpQwm5p+Payt8Vsw3FOUlSuDTi3STfiT3Sq6/FslI8/Ew5NQhK5KM1KM6ttLwyWzp1f4d24DWAavKP9QZD2j0KNxJJJzKV8jpDc2AGxrRkB0BRkrPKSpRj+FO73c+df4w+Sb3ZuSespcXtso8vvMQqJycSoyVUWDCs5ofQ/wBR0opgReKnJq5fcy+chYFxsCV1TyaUIjoqzEpM5niCLsNQHQkIQgBCEIAQhCARcc010WOFTHEsOZ/wJXemZ+S8/wAHLsiJoop4nwzMbJFI0skY4XBadhBCA8u31hffvCQraNK9HZcAr7xazqCck0kv1ietXJB+4Vj1133X3/k4XRkEJB6o6ghVnRyVMSoCQFPBUKddATXS3UN0t0BLdNJTLpt0A4lMJSEpEAyS2rYmwcQCeC9EYFSjD8BoqS1niIPlHQ5/pCCuGYHQHFMdoaO14zKJJ/8AqZz3r0IgBCEIAQhCAEIQgBCEIBuKUNHiVBLR1rNeKUd4O5zDuLV50xzBqzAq91JVC7M6af8ADJGvRqZiuFYfi9IaWviEjM2Oyex3tRuzaUB5qb6o6glW3Y3objGFEyUgdX0QydGPTM7bFpwcDs3jMFAPQhCAEqRCAW6W6ahAOukSIQCprnAcSdgAzJVmipK3EakU2HwSTzHc3IcXuyaOJXY9GdDabCnMrMQLKmvzZ+VF2EBHoPo5NhcL6+vbauqWBrIt8UOdjxetwQhACEIQAhCEAIQhACEIQAhCEALHYrozgWLXdVUzWznOoh5kveRn7yyKEByrEvJ9iMF34VUx1TN0M3Mk8fUK0qswzF6A2rqKqhHtlhLO57bsXopCA8yh7TvTrhekarA8CrL+c0FE8+1yYDv3NAcsDPoLovKbshnh7Erv5lyA4bdJcDMrqr9CcEEoaJa/97f/AMVsVJoRoxTG5p31B6Z3l3yizEBw+kpq2ul5Kgp56mToiaTbi45ALoOEeT+qmIlxuYQs30sG1/vyLp8MEFPGI6eKKKMZMjaGt8GgBKgEoMOoMNgEFBBFBHvDBtPF5zceJSoQgBCEIAQhCA//2Q==







",jpeg
4,"ROCCAT Kone AIMO Gaming Mouse (High Precision, Optical Owl-Eye Sensor (100 to 16.000 DPI), RGB Aimo LED Illumination, 23 Programmable Keys, Designed in Germany) White (Remastered)",ROCCATKon,https://www.amazon.com/gp/slredirect/picassoRedirect.html/ref=pa_sp_search_thematic_aps_sr_pg1_2?ie=UTF8&adId=A06563783SX2UVY3Q5EM3&url=%2FPrecision-Illumination-Programmable-Designed-Remastered%2Fdp%2FB07YCG26KZ%2Fref%3Dsxin_9_pa_sp_search_thematic_sspa%3Fcv_ct_cx%3Dgaming%2Bmouse%26dchild%3D1%26keywords%3Dgaming%2Bmouses%26pd_rd_i%3DB07YCG26KZ%26pd_rd_r%3D72b11609-47c3-42ab-9963-804b86ca1bf7%26pd_rd_w%3Dqjk4u%26pd_rd_wg%3DCZK7i%26pf_rd_p%3D4bad7638-dca1-43b9-ab64-2d55023aec7c%26pf_rd_r%3D36KSENE6VWEA4RS19PT2%26qid%3D1614633483%26sr%3D1-2-a8004193-6951-43f6-852a-aff7dbba9115-spons%26psc%3D1&qualifier=1614633483&id=8279333285812095&widgetName=sp_search_thematic,ROCCAT,$59.99,4.6,"4,535",In Stock.,"['5 lighting Zones - featuring five Independently configurable lighting Zones, you can now customize your gaming aesthetic like never before; they also Synergize perfectly to allow for even smoother and more fluid lighting transitions', ""Iconic Kone ergonomics - The legendary Kone shape has been tried and tested and is loved by Gamers the world over; close your eyes and place your hand atop it and you'll know it's unmistakably the Kone AIMO"", 'Evolutionary performance coating - grippy, durable and dirt-resistant thanks to a hybrid anti-wear coating; The performance finish helps you keep a firm hold of the Kone AIMO during even the most frantic of gaming sessions', '24 button functions - Upgraded to include an improved thumb area, The Kone AIMO now boast additional versatility; the lowermost of the three thumb button defaults to Easy-Shift for an impressive total of 24 possible functions', 'Roccat owl-eye sensor - experience unrelenting pointer precision with the all-new 16, 000DPI Roccat owl-eye Optical sensor; The sensor is adjustable in 1DPI increments and is characterized by exceptionally sharp accuracy and tracking capabilities']",https://images-na.ssl-images-amazon.com/images/I/710V93eGqgL.__AC_SX300_SY300_QL70_ML2_,jpg
