,Title,Rating,Helpful,Text
0,"['Simple Houseware 4-Tier Shoe Rack Storage Organizer 20-Pair, Grey', 'Simple Houseware 4-Tier Shoe Rack Storage Organizer 20-Pair, Grey', 'Simple Houseware 4-Tier Shoe Rack Storage Organizer 20-Pair, Grey', 'Simple Houseware 4-Tier Shoe Rack Storage Organizer 20-Pair, Grey', 'Simple Houseware 4-Tier Shoe Rack Storage Organizer 20-Pair, Grey', 'Simple Houseware 4-Tier Shoe Rack Storage Organizer 20-Pair, Grey', 'Simple Houseware 4-Tier Shoe Rack Storage Organizer 20-Pair, Grey', 'Simple Houseware 4-Tier Shoe Rack Storage Organizer 20-Pair, Grey', 'Simple Houseware 4-Tier Shoe Rack Storage Organizer 20-Pair, Grey', 'Simple Houseware 4-Tier Shoe Rack Storage Organizer 20-Pair, Grey', 'Simple Houseware 4-Tier Shoe Rack Storage Organizer 20-Pair, Grey', 'Simple Houseware 4-Tier Shoe Rack Storage Organizer 20-Pair, Grey', 'Simple Houseware 4-Tier Shoe Rack Storage Organizer 20-Pair, Grey']","[5, 5, 5, 5, 5, 5, 1, 5, 3, 5, 3, 5, 5]","[424, 189, 75, 40, 48, 49, 20, 26, 22, 14, 6, 4, 2]","['\n  Alright so all the reviews about it being difficult to put together, ignore those people if you have common sense it is incredibly easy there is no need for the parts to be labeled because it really is that easy I’m a teenage girl and it took me less than 10 minutes to put this together. I’m a mostly tennis shoes kind of girl I’d say you can fit 16 pairs on this, look at my picture. Also I read reviews about the bars being too thick to put the cloth over, I have literally no idea what those people were talking about because the bars I got fit right through. Also read a couple reviews about missing screws, I actually received two extra. There is a small piece of paper that comes with this product that has picture directions but honestly if you have common sense you don’t need it. Honestly if you get the screws all the way in this thing is very sturdy. I feel like most of the bad reviews came from people that didn’t know how to put this together correctly. This thing is definitely worth the money and made so much more room available in my closet. I have absolutely zero complaints.\n', ""\n  I really liked it, fits a lot of shoes and makes ny closet look so much more organized. Also you can't beat the price and same day delivery\n"", '\n  Easy to put together. I like the fabric shelves. Still very sturdy.\n', ""\n  My shoe sizes are between 13-14 (depending on brand). Able to fit 3 shoes per rack so if you're under size 12 you could probably fit 4 shoes per rack. Materials feel sturdy enough to last and it was super easy to set up (less than 10 mins). So yeah I'm pretty happy with this shoe rack. Everyone with tamale feet like me know the struggle when trying to fix shoes racks that actually works with our big shoes 😂\n"", ""\n  The rack only took about 20 minutes to put together. All I needed was a screw driver but I could do it by myself and it was not a huge hassle. I was worried that it might be really cheap and it would wobble and be off balance but it stands straight and balanced! It fits all my shoes (about 15 pairs) and there is a little space underneath where I put my slippers and flip flops. I also really like the mesh racks so that my heels don't fall through. Overall, would recommend!\n"", '\n  Best bang for your buck!! Did have a slight dent but not enough for it to not work. Also, very easy to assemble.\n', ""\n  It looks like a pretty okay product but it became useless as soon as I got to the last step. Which I hated! Because I wasted my time assembling and doing all the steps before finding out that it will just not work at all. So the problem I had is that the rods for the tiers won't align at all with the stand. No matter how I stretched the fabric and all the parts just to align them, it just won't do it. So the screws won't go in and nothing can be connected. Idk if it's a user error, because it doesn't seem to be an issue for most... Or maybe I'm just really unlucky to get a defective piece. Makes me really sad and disappointed. Oh well.\n"", '\n  I am happy with the shoe rack. Fits 12 pairs of shoes, the fabric prevents shoes falling thru and it looks nice too. There is room under the bottom shelf for more shoes. Takes a little time to assemble, but its not hard to figure out. Its pretty sturdy. I am gonna buy again. Hopes this helps.\n', ""\n  Please be aware that shelves are actually fabric, as vaguely indicated in the product specifications. This is not mentioned in the main product description, so I missed this fact altogether. No only that, but the fact that the fabric straps are hold by the flimsy metal bars, this makes it for a very uncomfortable process of assembly. Worse part, if the shoes are heavy, the fabric shelves will sag. The only reason I kept it is because I needed extra storage in a basement closet, so it's out of sight.\n"", '\n  It’s a shoe rack. I gave 5 stars because of the two extra screws included. I’m used to a missing piece, so that was nice to see\n', '\n  Not a bad shoe rack for the price but there were a couple of things I was disappointed by. Firstly, the shoe rack is a dark brown colour and not black, which was hard to tell from the images. Secondly, the shelving components are a piece of cloth, so when I was trying to put my heels on the shoe rack they kept falling because it wasn’t very sturdy.Overall, not a bad shoe rack for the price, but If you have heels, I would suggest getting something else.\n', '\n  I love this shoe rack.  Great for people with big feet your shoes will fit all the way on it and not keep falling off. Lots of room.My cat also loves to lay on the top tier.\n', '\n  This purchase was made to have a shoe stand that needed to fit into an existing space. The height is perfect and there is just enough side space for accessories.  I thought the depth might be an issue but all of our shoes fit comfortably. Tall boots will not fit but I was not expecting them to. Assembly was easy and the instruction sheet was not even required but nice too have as  a reference. It even came with 2 extra screws.\n']"
1,"['Simple Houseware 3-Tier Stackable Shoes Rack Storage Shelf, Bronze', 'Simple Houseware 3-Tier Stackable Shoes Rack Storage Shelf, Bronze', 'Simple Houseware 3-Tier Stackable Shoes Rack Storage Shelf, Bronze', 'Simple Houseware 3-Tier Stackable Shoes Rack Storage Shelf, Bronze', 'Simple Houseware 3-Tier Stackable Shoes Rack Storage Shelf, Bronze', 'Simple Houseware 3-Tier Stackable Shoes Rack Storage Shelf, Bronze', 'Simple Houseware 3-Tier Stackable Shoes Rack Storage Shelf, Bronze', 'Simple Houseware 3-Tier Stackable Shoes Rack Storage Shelf, Bronze', 'Simple Houseware 3-Tier Stackable Shoes Rack Storage Shelf, Bronze', 'Simple Houseware 3-Tier Stackable Shoes Rack Storage Shelf, Bronze', 'Simple Houseware 3-Tier Stackable Shoes Rack Storage Shelf, Bronze', 'Simple Houseware 3-Tier Stackable Shoes Rack Storage Shelf, Bronze', 'Simple Houseware 3-Tier Stackable Shoes Rack Storage Shelf, Bronze']","[5, 1, 5, 5, 3, 4, 5, 4, 3, 5, 5, 5, 1]","[80, 53, 35, 33, 19, 23, 15, 17, 7, 6, 3, 2, 5]","['\n  Very easy to assemble - came with easy to read directions and did everything with a screwdriver. Felt wobbly until the back criss cross pegs were screwed in, but now it seems sturdy as can be. Can hold even more than the 12 pairs of shoes I have on here depending on the width of your shoes. However, the ""bronze"" color is more like black, but it doesn\'t matter because it\'s in my closet anyway. Definitely recommend!\n', '\n  I loved my shoes rack so much i went to my previous purchases on amazon and reordered it. It just came in and im disappointed! I knew right away the packaging was much smaller than the original one. The design is different it has hinges in the middle (old design has an ""x"" to make it study) and is not stackable with my original shoe rack.  Its slightly smaller than my original one too. The design is much more simpler and easier to build but i still like the original better. The price for the newer designs is a two dollar more. Thats not a big deal but why change the design on the original page? Why not just add this new design on a New page for people to give the right reviews for the right product. Im sooo disappointed. I wanted the original rack and now i cant stack my racks up. This is my first bad review. Im disappointed\n', ""\n  I wanted a unit with wire mesh, not rollers/slats, and some space off the floor.  I wasn't sure about stacking another as I was concerned about stability and in a minor way, how it would appear in a hallway. The 3 shelf unit is inconspicuous so I've decided to order another but not to stack.  The instructions were small and rather faint but it would not be difficult to intuitively assemble.  I'm functionally blind, need electronic magnifiers to read, and still managed to assemble this item.  The screw-in legs are obvious, the X frame screws into the end pieces that have 4 holes, and that's it.  The other assembly pieces are the screw-in pins if you want to stack the units and 4 plastic plugs to fill in the holes on the top of the end pieces if you don't stack.  If a blind man can do this, well..........\n"", '\n  I ordered this and was very pleased with the product. I am 75 years old and figured out how to put it together. lol It looks great and is much sturdier than the one it replaced. Liked it so well I just ordered another one today. Definitely worth the money.\n', ""\n  Unless you have very tiny feet, this rack doesn't hold a lot of shoes. It literally can hold 2 1/2 pairs on each level, so no more than 7 pairs total of my hubby's sneakers (with one shoe on one level and it's mate on another). My fault for not reading the specs. I went by the picture of 9 pairs of shoes with room to spare. I don't feel like going through the trouble of disassembling and returning it so I'll just keep it for now.\n"", ""\n  I am really satisfied with this product. I needed a show rack to go inside my closet, and it really is perfect for that purpose. It isn't the most beautiful shoerack one could imagine, but it is also so subtle looking, that i dont mind that. I used to have one made out of plastic and metal rods, and it was so flimsy. This one seems very durable and easy to pick up and move.The only thing you should be aware of, is that you can obviously not put any higher shoes such as boots on the lower tiers. But overall, this one is a really good buy.\n"", '\n  So easy to assemble, very sturdy and fits my shoes perfect. Definitely recommend 10/10. Couldn’t be happier with my purchase, wish I had done it sooner!\n', '\n  It would be really great if it was just maybe an inch wider to squeeze in larger shoes since I do wear size 4D wide. Also it would be an advantage of the lines on the shelves went in to out instead of left to right. The reason being is that certain boat shoes or casual type boots that have a hiking boot type sole, it gets caught trying to pull them out. Be innovative in your thinking and it would be really nice. Overall I like it.\n', ""\n  While this unit is exactly as described, and is sturdy enough, (I only have one, haven't stacked them, as is possible), it is a good value.  My only issue with this piece, and it's kind of a big one, is the photo shows three pairs of shoes on a level.  While this may be possible if you wear a size 5 shoe, or use it for children's shoes, I'm pretty sure the average adult is only going to fit two pairs on a shelf, suddenly it basically loses a third of it's pictured capacity.\n"", ""\n  I don't know why I'm surprised/relieved this product lived up to all the positive ratings, but it's great! Got 2 sets to stack and well, see the before and after photos. I put them together myself on my kitchen counter while my son and husband watched - was so easy and satisfying to assemble because ALL screws and parts were included - even had 1 extra screw per set. Sturdy too - just when you stack them, there's nothing holding the racks together so you have to hold where they join, but not an issue (unless you forget and the racks have shoes on them). Because I was dealing with men's shoes, I didn't need to use 2 of the racks in order to accommodate boots so now I have 2 extra racks, screws and feet - I'd really like to purchase a set of the side brackets and have asked the seller if this is something they offer. Otherwise I will be purchasing 2 more of these shoe racks for me. Oh and came super quick having the next day option.\n"", '\n  Perfect for the bottom of the coat closet. Holds 9 pairs of shoes. It’s plenty sturdy. Easy to assemble (screws take either phillips or flat head screwdriver). I’m really happy with this rack and it’s so nice to finally have my shoes organized!\n', '\n  I really enjoyed how easy it is to assemble. This shoe shelf fits about 9 shoes + 3 slippers or flat shoes comfortably. It was a nice quick project to do it doesn’t take too much time; I would say 25-45mins depending on how savvy you are with building stuff. You might even take less time if you are good at building things because there aren’t too many parts.It’s really sturdy and really nice quality for the price paid. It also shipped very fast I was very impressed.\n', ""\n  All except one of the four feet screwed into the bottom, but one of the holes for the last foot was drilled at a slant so the foot wouldn't screw in properly and the whole thing couldn't stand up. Will be returning.\n""]"
2,"['Simple Houseware 3-Tier Stackable Shoe Shelves Storage Utility Rack, Silver', 'Simple Houseware 3-Tier Stackable Shoe Shelves Storage Utility Rack, Silver', 'Simple Houseware 3-Tier Stackable Shoe Shelves Storage Utility Rack, Silver', 'Simple Houseware 3-Tier Stackable Shoe Shelves Storage Utility Rack, Silver', 'Simple Houseware 3-Tier Stackable Shoe Shelves Storage Utility Rack, Silver', 'Simple Houseware 3-Tier Stackable Shoe Shelves Storage Utility Rack, Silver', 'Simple Houseware 3-Tier Stackable Shoe Shelves Storage Utility Rack, Silver', 'Simple Houseware 3-Tier Stackable Shoe Shelves Storage Utility Rack, Silver', 'Simple Houseware 3-Tier Stackable Shoe Shelves Storage Utility Rack, Silver', 'Simple Houseware 3-Tier Stackable Shoe Shelves Storage Utility Rack, Silver', 'Simple Houseware 3-Tier Stackable Shoe Shelves Storage Utility Rack, Silver', 'Simple Houseware 3-Tier Stackable Shoe Shelves Storage Utility Rack, Silver', 'Simple Houseware 3-Tier Stackable Shoe Shelves Storage Utility Rack, Silver']","[5, 5, 4, 5, 3, 5, 5, 5, 5, 5, 5, 5, 4]","[36, 41, 16, 26, 18, 9, 15, 14, 3, 1, 0, 2, 2]","['\n  I love these. Let me preface to say, I married a first generation Asian-American. When we first started dating, I was blissfully unaware of the horror I caused by wearing my shoes into my now husbands family home. I was very curtly scolded, and told myself I wasn’t going to go out with that guy anymore. Anyways, anecdotes aside, fast-forward to now and we’re  happily married, but shoe storage is a bigger deal than I thought possible.  We bought cheap storage solutions while in our post-grad home before buying and knowing whatever we had wouldn’t be an investment. He grabbed some at Walmart and I got these. For three years, every time he would grab shoes for me, he would always mention how it wasn’t fair I had the better storage unit. My shoes are visible from every height, the shelves are level so my shoes never slip off, and best of all, they fit in between. I have tall heels and booties and I’ve had no problems fitting them on the racks. I do put my higher shoes in the top shelf so I don’t have to worry about height, but they fit on the lower levels too.\n', '\n  I really love these racks! I bought 2 for my husband and they fit between 16-18 pairs! We have them next to each other, but they are also stackable which we love. Such an easy, affordable way to make our closet and his shoe area look neater. Definitely reccomend and will purchase more!\n', ""\n  Really nice product and can be stackable. It fits 9 shoes easily and maybe some flats or slides underneath. Easy to assemble. You'll just need a screw driver to make it sturdier to screwin the screws.. Its small enough to fit in a small coat closet or multiple in a long walk-in closet. I will be buying 3 more to go into my walk-in closet. Really love the dark espresso color. It also comes with floor protectors that screw in from the bottom. Really glad I got it as I have a huge show collection. It has an old vintage feel or you can pair it in a more modern home.\n"", '\n  Just purchased another one of these to put in the closet of our new house! These are compact and sturdy. In the small rental house, I had one shelf out in the room at the foot of the bed, between bed and chair, as the closet was filled with a dresser. They are attractive enough to leave out in the room, but hell on toes in the middle of the night! So, in the new house, they go into the closet. They stack solidly or work fine side-by-side. And they are surprisingly spacious! I have stored approx 21 pairs of shoes here by turning each pair on their side and toe facing heel, much as they come in their shoebox, but without the tissue wrapping or box. Assembly was straightforward and took only a few minutes and no tools. The dark metal looks up to date and modern.  And I store slippers and flip flops under the bottom shelf for even more shoe access and storage! Love it!\n', ""\n  Now that I have it put together, it's fine. However, it was a pain to put together by myself! The instructions are terrible!! They show you positioning it on it's side to insert the little pieces that hold it together. Which would require an extra set of hands to assist. I finally ignored the instructions and was able to construct it without too much trouble. I have another shoe rack, similar, that I bought at Ross a long time ago, it was super simple to snap together and has lasted me for almost 20 yrs, it's still fine, I just needed an additional shoe rack. So it's a good shoe rack, just don't follow the instructions!!!!! ;)\n"", '\n  I purchased 2 of these shoe racks to stack.  They were very easy to assemble and are quite sturdy because of the X brace in the back.  I have them stacked but did not add the top shelf due to space in our closet.  This does not affect how sturdy the unit is in any way.  The shelves are easy to move, and most of the stability comes from the brace in the back, which I really appreciate.  So I have 5 shelves total.  The unit easily holds 3 pairs of my husbands shoes per shelf (boots, athletic shoes, dress shoes).  I fit 4 pairs of my heels side by side as well as a pair of flip flops on one shelf.  I also like that this unit does not have a shelf sitting directly on the floor.  This gives a bit more space for shoes and is easy to clean under without moving the entire unit.  I also like that the shelves are flat rather than slanted to keep shoes neat and not worry about them slipping.  The shelves are made of wire mesh that is nice and sturdy - other shoe racks have just a couple of bars for a shelf, which I do not find helpful for storing heels.  This is a great unit and I would definitely purchase more for other closet reorganization projects in the future.\n', '\n  For girlfriend & she loves them! (her review). Sturdy product. I bought 7 to replace others from a store that were more expensive & made of wood & metal. I do wish the space between the shelves was about 2 inches more as I had to take out the middle shelves to put ankle boots & higher heels, therefore, purchasing more shelves. Very easy to put together (5 minutes). Customer Service is stellar. I had a damaged side & they replaced the shelf! I stacked 4 shelves against a wall, which no balance issues.\n', ""\n  LOVE THIS. I bought 2 of them to stack and they're so perfect. I love how easy it is to remove/add the shelves to customize the rack to your needs. (I have a lot of knee-high boots, which fit perfectly once I removed one of the shelves.) Also, the shoe rack I had before had poles instead of shelves, so my stilettos would keep falling off. Not with this rack though! It's really easy to assemble, too. It probably took me 5 minutes to put together one. The frame is pretty light but sturdy enough to hold a lot of shoes. Definitely highly recommended!\n"", '\n  You pay a few dollars more and get a metal one as opposed to a cloth one.  I bought my 2nd rack only a day later.I love it!!!!\n', '\n  This utility/shoe rack arrived on time and was so easy to put together. Done on a snap. It was exactly what we needed for an entry closet and I will be purchasing two more for other spaces. Why have shoes sitting on the floor haphazardly when they can sit on this rack and be perfectly tidy?\n', '\n  Product worked as described. Nice shoe rack. Not meant for boots as the spacing between shelf are too shallow.  I had some damaged pieces. The supplier was quick to sent replacement parts. I would order again\n', '\n  Love this only dislike it’s not very tall between shelves if you have taller boots they don’t fit very well even if they’re folded down.\n', '\n  Good for 9 pair of men’s shoes. Assembly instructions could be larger\n']"
