,Title,Rating,Helpful,Text
3,"['Homemaid Living Bamboo 3 Tier Shoe Rack Bench, Premium Shoe Organizer or Entryway Bench, Perfect for Shoe Cubby, Entry Bench, Bathroom Bench, Entryway Organizer, Hallway or Living Room(Black)', 'Homemaid Living Bamboo 3 Tier Shoe Rack Bench, Premium Shoe Organizer or Entryway Bench, Perfect for Shoe Cubby, Entry Bench, Bathroom Bench, Entryway Organizer, Hallway or Living Room(Black)', 'Homemaid Living Bamboo 3 Tier Shoe Rack Bench, Premium Shoe Organizer or Entryway Bench, Perfect for Shoe Cubby, Entry Bench, Bathroom Bench, Entryway Organizer, Hallway or Living Room(Black)', 'Homemaid Living Bamboo 3 Tier Shoe Rack Bench, Premium Shoe Organizer or Entryway Bench, Perfect for Shoe Cubby, Entry Bench, Bathroom Bench, Entryway Organizer, Hallway or Living Room(Black)', 'Homemaid Living Bamboo 3 Tier Shoe Rack Bench, Premium Shoe Organizer or Entryway Bench, Perfect for Shoe Cubby, Entry Bench, Bathroom Bench, Entryway Organizer, Hallway or Living Room(Black)', 'Homemaid Living Bamboo 3 Tier Shoe Rack Bench, Premium Shoe Organizer or Entryway Bench, Perfect for Shoe Cubby, Entry Bench, Bathroom Bench, Entryway Organizer, Hallway or Living Room(Black)', 'Homemaid Living Bamboo 3 Tier Shoe Rack Bench, Premium Shoe Organizer or Entryway Bench, Perfect for Shoe Cubby, Entry Bench, Bathroom Bench, Entryway Organizer, Hallway or Living Room(Black)', 'Homemaid Living Bamboo 3 Tier Shoe Rack Bench, Premium Shoe Organizer or Entryway Bench, Perfect for Shoe Cubby, Entry Bench, Bathroom Bench, Entryway Organizer, Hallway or Living Room(Black)', 'Homemaid Living Bamboo 3 Tier Shoe Rack Bench, Premium Shoe Organizer or Entryway Bench, Perfect for Shoe Cubby, Entry Bench, Bathroom Bench, Entryway Organizer, Hallway or Living Room(Black)']","[5, 5, 1, 4, 1, 4, 5, 4, 3]","[134, 69, 22, 12, 12, 22, 3, 5, 0]","[""\n  I bought three of these for my front entryway.  It says it takes 2 people to assemble, but I'm a 50+ female & assembled them by myself with no problems.  With 4 females in the house, there was a need for organizing the shoes that tend to accumulate there.  I love how they look & that they are sturdy for sitting on.  They all line up nicely & make my room look larger than when I just had one plastic rack!  The only thing I wish was different is that they were even just 1 inch taller so that shoes could also be laid on the floor beneath them.  Right now, I can only slide sandals under the bottom shelf.  I may make cushions for the seating area, but I haven't yet decided.  I think they look pretty good as is.  I am extremely pleased with this purchase!\n"", '\n  Very sturdy and beautiful item. Took me less than 15 minutes to assemble. No problems with assembly. Found instructions to be adequate, and everything on my unit was aligned.It\'s lovely, does not overpower the area, and serves it purpose.We have had several men over 200lbs sit on it to put on their shoes (not simultaneously, obviously), and it does not creak or shake. We do have to keep it an inch or two from the wall to give people enough ""landing space"" for their posteriors.Very pleased with this purchase.As a bonus for me, it exactly matches an umbrella stand I purchased elsewhere.\n', '\n  When I started to put this together I noticed that none of the holes lined up with the pre-drilled screw holes.  That makes the whole bench weak and unable to support the weight advertised.  However I must admitted after seeing this on the first brace I was putting together I stopped and checked the rest.  They were all thesame so I didn’t go any further in the assembly and packed it up ready to ship back to Amazon.\n', ""\n  Purchased for my bathroom, and as others suggested, we added glue to the joints to increase it's sturdiness.The instructions were easy to follow (pictures) however it states the tools required for assembly include a flat (slotted) head and Phillips (posilock/star) head screwdriver, despite the included hardware being in allen wrench format only.  An allen wrench wasn't included, so have one ready.  I believe it was 4mm in size.We plan on adding a coat of exterior polyurethane to increase the effectiveness of the existing finish and to stay mold-free in a wet environment.Edit: added table top epoxy and shields the water well.  Time will tell but I'm certain the epoxy stiffened things up even further so should last a while.\n"", '\n  Unfortunately, the quality control on the screws is lacking. And since the since the screws hold it together the overall product review was negative. There was a time when you always got one or two extra screws just in case Something went wrong on your end, but when it goes wrong on their end and they don’t send you extras, I question the product Quality. The design is good, The style caught my eye. it does what it supposed to do I shouldn’t have to go to my tool crib To find a screw to finish the job I paid money for this and it’s not just principle.\n', '\n  Having read other reviews and now own:Can confirm that some screw holes were misaligned. Each leg has 6 holes—2 pairs of screw holes and a pair of bolt holes.My workaround was to loosely install the legs to the shelves by adding a screw into the most centered hole of the side-by-side pair of screw holes (that’s one screw per leg per shelve). The assembly will be wobbly and that’s OK.Next I added the Leg assembly to the seat by loosely attaching all 8 bolts and then stood the whole thing upright on a hard, flat floor before tightening everything. It should be pretty sturdy at that point.I added the last 4 screws to the misaligned holes last. The wood is very soft so the only issue one might have is over-tightening and stripping the the wood—which is really easy to do.The finished piece looks nice. Smells like wood and it’s quite light. I was able to fit 3 pairs of shoes on each shelf, but people with big feet or bulky footwear with not have the same ability.This functions for me. Definitely great for kids or as part of a decor accent. Sitting on it seemed fine, but I’m not sure how they rated it’s sturdiness to be in the 300 lb area unless it’s centered, unmoving weight. I would not recommend a 300lb man sit on this thing.I’m happy with it, but for the quality, it’s definitely something that should really be in the $30 range.\n', ""\n  Buying things on the internet is always a gamble, you have no idea of the quality until it arrives. I can happily say this item is exactly what it should be. It may even seem better, because we as consumers have been conditioned to accept poorer and poorer quality items. The bamboo has a nice finish on it, there were no cracks anywhere and it doesn't feel brittle (the way cheap/untreated bamboo items do). Assembly was easy with one person, if you are furniture assembly inclined (takes some balancing, and you will need to wait to tighten everything). Everything lined up perfectly, and it stands flat with no rocking. It easily holds 200 lbs (no creaking) but I haven't tested anything more than that. It has really helped clean up our small tiled entryway.\n"", ""\n  This is a juggling-weight little bench.  It's quite small, although still usable, and light enough that the wind can knock it over under the right conditions.  It's nicely made.  I wouldn't have two adults sitting on it at the same time.  It's not flimsy, but it's not terribly strong.  It'll hold shoes or the like, sure, and a reasonably lightweight adult can sit on it without being overly careful.We've been using ours as a garden bench.  We added an extra layer of polyurethane to the lower legs and put it right on the ground, unprotected outdoors, and it's been a few months of sun and rain.  It's unchanged from its new condition, so it's at least fairly weather-resistant.  For the money, it's very nice.\n"", '\n  Pièce arriver endommagé...\n']"
4,"['Simple Houseware 3-Tier Shoe Rack Storage Organizer 12-Pair / 20-Pair, Bronze', 'Simple Houseware 3-Tier Shoe Rack Storage Organizer 12-Pair / 20-Pair, Bronze', 'Simple Houseware 3-Tier Shoe Rack Storage Organizer 12-Pair / 20-Pair, Bronze', 'Simple Houseware 3-Tier Shoe Rack Storage Organizer 12-Pair / 20-Pair, Bronze', 'Simple Houseware 3-Tier Shoe Rack Storage Organizer 12-Pair / 20-Pair, Bronze', 'Simple Houseware 3-Tier Shoe Rack Storage Organizer 12-Pair / 20-Pair, Bronze', 'Simple Houseware 3-Tier Shoe Rack Storage Organizer 12-Pair / 20-Pair, Bronze', 'Simple Houseware 3-Tier Shoe Rack Storage Organizer 12-Pair / 20-Pair, Bronze', 'Simple Houseware 3-Tier Shoe Rack Storage Organizer 12-Pair / 20-Pair, Bronze', 'Simple Houseware 3-Tier Shoe Rack Storage Organizer 12-Pair / 20-Pair, Bronze', 'Simple Houseware 3-Tier Shoe Rack Storage Organizer 12-Pair / 20-Pair, Bronze', 'Simple Houseware 3-Tier Shoe Rack Storage Organizer 12-Pair / 20-Pair, Bronze', 'Simple Houseware 3-Tier Shoe Rack Storage Organizer 12-Pair / 20-Pair, Bronze']","[5, 5, 5, 5, 5, 4, 5, 5, 4, 4, 5, 5, 5]","[58, 21, 19, 13, 11, 7, 8, 2, 4, 3, 2, 1, 1]","['\n  Very sturdy. Hold heavy shoes and cats\n', '\n  Exactly as described, good light duty shelf. Fits my size 9 and spouse’s size 13 just fine. Shelves are made of a durable cloth, as mentioned in other reviews.\n', '\n  I purchased this for my son who is going away to college and has limited space but wants to keep his room tidy. They work great ... I bought one for me also ... he wears a size 12 and his shoes fit great!\n', '\n  Great price and exactly the right size for our closet. Amazed that it held 90% of the shoes we have. I feel much more organized now.\n', '\n  I love this shoe rack! Though this doesn’t  fancy and luxurious, it is strong, sturdy, and definitely great for shoe keeping and organization. It holds 4 pairs per shelf and has 3 shelves. It took me 10 minutes to put the rack together and though it’s easier to put this together with another person, it is very doable to do alone. Like I said, 10 minutes is all it takes. The instructions are easy and straight forward.\n', ""\n  Easy to assemble, plenty of room for shoes, it's just not very aesthetically pleasing lol but very functional. Overall am pleased because my boyfriend has more shoes than I do and this shoe rack helps me keep some of his shoes organized.\n"", '\n  Covers the bases. Would be great if they could add some washers to keep the screws from stripping the paint. Does the job though. I have them in my closet underneath my clothes. Top rack forces the shoes to touch the bottom of my clothes, so it could be a little shorter. Boots dont really fit but you can make em fit.I wear a size 11 shoe. At most I can fit three pairs of shoes in the side by side config and squeeze a pair of chucks stacked on top of each other on the end of each level. So the real max is 16 pairs of shoes for me.\n', '\n  Assembly was more of a bear than you\'d think - the lightweight pieces snap together easily, but then you have to slide rods into the fabric ""shelves"" and that\'s oddly difficult, then stretching the fabric between the sides is also hard because it\'s a very tight fit. Had to use some real strength to pull them into shape while tightening screws. Now that it\'s together, however, it looks great, works well, seems sturdy and workable. Dimensions appear to be about spot-on too.\n', ""\n  Decent shoe rack for the price. Not fancy looking or anything but looks decent enough. It's not as sturdy as I would think but it's holding up well. The material wipes clean easily. This is being used to hold children's winter boots. I like that you have to option of using different heights for each rack.\n"", '\n  I’m glad I got this, it is a great shoe rack that holds twelve pairs of shoes/boots easily with space for four more underneath. My only issue was that one of the fabric shelves was just a tad not wide enough for easy assembly. Did finally get it together, but it was a struggle. Would probably be trivial with two people working on it. Still recommend it.\n', '\n  I purchased this to organize my hallway closet and it was $20 well spent. I have a small condo and lots of shoes and this really helped organize my shoes and shoe boxes. I have enough space to put more boxes underneath the bottom shelf and it isn’t too high to get in the way of my jackets that are hanging. It’s not the sturdiest but this doesn’t bother me at all as it does what I wanted it to do.\n', '\n  Love these shoeracks!! I got 2 and assembled them with the top rack one position down from where their picture shows because it works better for tall boots. Sturdy and attractive!\n', '\n  I was kind of leary ordering this, but am very pleased with it.  It is strong and sturdy enough to hold adult shoes and boots and clean up my back door area!\n']"
5,"['Simple Houseware 3-Tier Stackable Shoes Rack Storage Shelf, Bronze', 'Simple Houseware 3-Tier Stackable Shoes Rack Storage Shelf, Bronze', 'Simple Houseware 3-Tier Stackable Shoes Rack Storage Shelf, Bronze', 'Simple Houseware 3-Tier Stackable Shoes Rack Storage Shelf, Bronze', 'Simple Houseware 3-Tier Stackable Shoes Rack Storage Shelf, Bronze', 'Simple Houseware 3-Tier Stackable Shoes Rack Storage Shelf, Bronze', 'Simple Houseware 3-Tier Stackable Shoes Rack Storage Shelf, Bronze', 'Simple Houseware 3-Tier Stackable Shoes Rack Storage Shelf, Bronze', 'Simple Houseware 3-Tier Stackable Shoes Rack Storage Shelf, Bronze', 'Simple Houseware 3-Tier Stackable Shoes Rack Storage Shelf, Bronze', 'Simple Houseware 3-Tier Stackable Shoes Rack Storage Shelf, Bronze', 'Simple Houseware 3-Tier Stackable Shoes Rack Storage Shelf, Bronze', 'Simple Houseware 3-Tier Stackable Shoes Rack Storage Shelf, Bronze']","[5, 1, 5, 5, 3, 4, 5, 4, 3, 5, 5, 5, 1]","[80, 53, 35, 33, 19, 23, 15, 17, 7, 6, 3, 2, 5]","['\n  Very easy to assemble - came with easy to read directions and did everything with a screwdriver. Felt wobbly until the back criss cross pegs were screwed in, but now it seems sturdy as can be. Can hold even more than the 12 pairs of shoes I have on here depending on the width of your shoes. However, the ""bronze"" color is more like black, but it doesn\'t matter because it\'s in my closet anyway. Definitely recommend!\n', '\n  I loved my shoes rack so much i went to my previous purchases on amazon and reordered it. It just came in and im disappointed! I knew right away the packaging was much smaller than the original one. The design is different it has hinges in the middle (old design has an ""x"" to make it study) and is not stackable with my original shoe rack.  Its slightly smaller than my original one too. The design is much more simpler and easier to build but i still like the original better. The price for the newer designs is a two dollar more. Thats not a big deal but why change the design on the original page? Why not just add this new design on a New page for people to give the right reviews for the right product. Im sooo disappointed. I wanted the original rack and now i cant stack my racks up. This is my first bad review. Im disappointed\n', ""\n  I wanted a unit with wire mesh, not rollers/slats, and some space off the floor.  I wasn't sure about stacking another as I was concerned about stability and in a minor way, how it would appear in a hallway. The 3 shelf unit is inconspicuous so I've decided to order another but not to stack.  The instructions were small and rather faint but it would not be difficult to intuitively assemble.  I'm functionally blind, need electronic magnifiers to read, and still managed to assemble this item.  The screw-in legs are obvious, the X frame screws into the end pieces that have 4 holes, and that's it.  The other assembly pieces are the screw-in pins if you want to stack the units and 4 plastic plugs to fill in the holes on the top of the end pieces if you don't stack.  If a blind man can do this, well..........\n"", '\n  I ordered this and was very pleased with the product. I am 75 years old and figured out how to put it together. lol It looks great and is much sturdier than the one it replaced. Liked it so well I just ordered another one today. Definitely worth the money.\n', ""\n  Unless you have very tiny feet, this rack doesn't hold a lot of shoes. It literally can hold 2 1/2 pairs on each level, so no more than 7 pairs total of my hubby's sneakers (with one shoe on one level and it's mate on another). My fault for not reading the specs. I went by the picture of 9 pairs of shoes with room to spare. I don't feel like going through the trouble of disassembling and returning it so I'll just keep it for now.\n"", ""\n  I am really satisfied with this product. I needed a show rack to go inside my closet, and it really is perfect for that purpose. It isn't the most beautiful shoerack one could imagine, but it is also so subtle looking, that i dont mind that. I used to have one made out of plastic and metal rods, and it was so flimsy. This one seems very durable and easy to pick up and move.The only thing you should be aware of, is that you can obviously not put any higher shoes such as boots on the lower tiers. But overall, this one is a really good buy.\n"", '\n  So easy to assemble, very sturdy and fits my shoes perfect. Definitely recommend 10/10. Couldn’t be happier with my purchase, wish I had done it sooner!\n', '\n  It would be really great if it was just maybe an inch wider to squeeze in larger shoes since I do wear size 4D wide. Also it would be an advantage of the lines on the shelves went in to out instead of left to right. The reason being is that certain boat shoes or casual type boots that have a hiking boot type sole, it gets caught trying to pull them out. Be innovative in your thinking and it would be really nice. Overall I like it.\n', ""\n  While this unit is exactly as described, and is sturdy enough, (I only have one, haven't stacked them, as is possible), it is a good value.  My only issue with this piece, and it's kind of a big one, is the photo shows three pairs of shoes on a level.  While this may be possible if you wear a size 5 shoe, or use it for children's shoes, I'm pretty sure the average adult is only going to fit two pairs on a shelf, suddenly it basically loses a third of it's pictured capacity.\n"", ""\n  I don't know why I'm surprised/relieved this product lived up to all the positive ratings, but it's great! Got 2 sets to stack and well, see the before and after photos. I put them together myself on my kitchen counter while my son and husband watched - was so easy and satisfying to assemble because ALL screws and parts were included - even had 1 extra screw per set. Sturdy too - just when you stack them, there's nothing holding the racks together so you have to hold where they join, but not an issue (unless you forget and the racks have shoes on them). Because I was dealing with men's shoes, I didn't need to use 2 of the racks in order to accommodate boots so now I have 2 extra racks, screws and feet - I'd really like to purchase a set of the side brackets and have asked the seller if this is something they offer. Otherwise I will be purchasing 2 more of these shoe racks for me. Oh and came super quick having the next day option.\n"", '\n  Perfect for the bottom of the coat closet. Holds 9 pairs of shoes. It’s plenty sturdy. Easy to assemble (screws take either phillips or flat head screwdriver). I’m really happy with this rack and it’s so nice to finally have my shoes organized!\n', '\n  I really enjoyed how easy it is to assemble. This shoe shelf fits about 9 shoes + 3 slippers or flat shoes comfortably. It was a nice quick project to do it doesn’t take too much time; I would say 25-45mins depending on how savvy you are with building stuff. You might even take less time if you are good at building things because there aren’t too many parts.It’s really sturdy and really nice quality for the price paid. It also shipped very fast I was very impressed.\n', ""\n  All except one of the four feet screwed into the bottom, but one of the holes for the last foot was drilled at a slant so the foot wouldn't screw in properly and the whole thing couldn't stand up. Will be returning.\n""]"
