,Title,Rating,Helpful,Text
4,"['FURINNO Econ Multipurpose Home Office Computer Writing Desk, French Oak Grey', 'FURINNO Econ Multipurpose Home Office Computer Writing Desk, French Oak Grey', 'FURINNO Econ Multipurpose Home Office Computer Writing Desk, French Oak Grey', 'FURINNO Econ Multipurpose Home Office Computer Writing Desk, French Oak Grey', 'FURINNO Econ Multipurpose Home Office Computer Writing Desk, French Oak Grey', 'FURINNO Econ Multipurpose Home Office Computer Writing Desk, French Oak Grey', 'FURINNO Econ Multipurpose Home Office Computer Writing Desk, French Oak Grey', 'FURINNO Econ Multipurpose Home Office Computer Writing Desk, French Oak Grey', 'FURINNO Econ Multipurpose Home Office Computer Writing Desk, French Oak Grey']","[1, 5, 5, 5, 2, 5, 4, 2, 1]","[197, 675, 146, 117, 15, 27, 4, 2, 6]","['\n  This is a long one. I\'ve been sitting on this rage for a bit so hold onto your butts. First I\'ll extend an olive branch: the desk fits well into anyone\'s budget. At the time (like, 2 weeks ago) I got it for $40. Not bad. It\'s a desk. It does desk things. That\'s about all the good I have to say here.But speaking of the price, I bought it for $40 and as soon as I started assembling this god damn thing I knew I got gypped. The instructions were clear enough. Allegedly the desk should be assembled in roughly 30 minutes if you have someone helping you. My roommates were out so I tackled the project myself, figuring that at most it would take an hour. 4 hours later, I\'m still working on it. Why? Because there were supposed to be holes for all the screws and pegs that were drilled into the wood already, according to the instructions, but I guess the guy who was supposed to do that got drunk on the job because there\'s no holes. I don\'t have tools either. I have one Gerber multi tool and I had to painstakingly ""drill"" my own holes with a broken knife, a now-worn down screwdriver head, and a series of other tool-heads that are now similarly worn. Before you say, ""What\'s the problem, don\'t Gerbers have a lifetime warranty?"" Yeah, it\'s only good for the one replacement. This was it. I paid $80 for the Gerber and $40 for the desk, but now that half the tools in my Gerber are useless, technically I\'m out $120. If the manufacturer is reading this, I accept reimbursement through the Cash App.Speaking of price, as I clicked on this product to file my initial complaint, I found more reasons to get pissed off. The price on this piece of excrement actually JUMPED by $15 in the literally 2 weeks since I bought this. How is the demand rising at all? I feel like it should be plummeting faster than our president\'s approval ratings. I wouldn\'t even buy this again if the price dropped $15. I wouldn\'t even take it for FREE if I knew what I was getting into.Now the sturdiness. It\'s okay. Not great, not terrible, but I\'m a little concerned at how much this thing wiggles just from me lightly typing away on my laptop. The directions say the desk is prorated to hold 15 pounds across the main part of it, but the directions also said the holes were supposed to be pre-drilled so I don\'t know about that. The good news is that if I\'m unlucky enough to fart on this thing and it collapses, the manufacturer owes me a new computer.That\'s right, this desk is so awful that I\'m praying that it breaks for a payout. Maybe I\'ll tack on extra charges for emotional pain and suffering. I could be paying my bills right now. I could be writing that novel I promised I\'d start on once I get a new desk. But instead I\'m putting off my entire life to warn the people of Amazon to not buy this desk.""But Nick! It\'s cheap, you knew what you were getting into!"" Maybe, but it really says something about this economy that I can\'t even save money or else I just end up wasting it. What sick person would charge someone $40 (and then $55.11 before tax and shipping) and then blame them for not throwing down an extra $500 when it blows up in their face? That\'s not how you compete with other businesses. I\'m an English major and I have no skills but I could make a better desk out of cardboard and pubic hairs.Oh and one last thing: the pull out drawer or whatever it\'s called, the thing you put your keyboard on? Flimsier than a tightrope walker with Parkinson\'s. I look at it funny and it just falls off. There\'s nothing holding it together. I\'m not sure if I should add more holes so I can screw it on, but god forbid I finish the manufacturer\'s job.Anyway, my point is don\'t buy this desk. 2/10; I\'m burning this when I find something better.\n', ""\n  I read a lot of negative reviews on this desk about it being flimsy and things breaking, first thing about this is they are probably comparing it to a $500 desk this desk costs under $50 your not going to get a top of the line model for that.  This being said it's a very well made desk for the money very sturdy I was actually impressed how sturdy it was I was planning on reinforcing it once I got it but after setting it up realized I didn't need to.  I keep all my school books and my iMac on it without any issues.  This desk is definitely worth the money.\n"", '\n  So i was back and forth on this purchase but im very happy i made it. It took me about 30 minutes to assemble with relative ease. The instructions are fairly simple to follow but the piece letters can be a little difficult to read. for under 60 dollars its definitely worth the money. You might want to reinforce some areas with some extra tacking nails but other than that this desk is solid. i put a 23"" AIO on the low side and a 24"" smart tv for a second monitor on the the high shelf no problems. i highly recommend this item for small spaces and a small budget.\n', ""\n  For $25 this desk is AWESOME! I honestly don't understand the highly negative reviews. Maybe Furinno made some changes but mine came well packaged with all the hardware bits sealed up in a baggie. Nothing was damaged and all the pieces were labeled.Assembly takes some time but is not difficult to figure out if you have a bit of patience- I used the manual and the amazon video together and had no problem.Once assembled this desk is MUCH sturdier than I expected. Everything is stuck tightly together and seems strong enough to hold a printer/monitor/whatever you like. The only area I had some trouble with was the keyboard tray but I decided not to use it anyway.Overall if you're looking for a place to sit on your computer or to get some work done without taking up a ton of room this is your desk. I did a lot of research before choosing this and i'm glad I did.\n"", ""\n  Its sturdy and worth the money however This is nothing like the colour on the photo so if your buying it like I did toMatch your room furnishings then this is nothing like grey it's a brown oak colour nothing like grey\n"", ""\n  This desk is awesome.It took me a little while to put it together by myself but only because of the amount of pieces and the complexity. I found the instructions to be excellent, so relax!The boards and hardware were well defined, with stickers and not markers as other people have experienced in the past.The design is great, as I'm able to put my printer, books and even my bag nearby. The little cloth drawer is better than I thought. Beside the file cabinet they make a perfect pair.Pros:-Great design and size for my small place.-Reasonably easy to put together, with clear instructions.-Excellent price and value for the money.-Handsome piece! Looks clean and tidy.Cons:-The packaging was poor and flimsy. It's a miracle it came undamaged, especially because Canada Post left it out in the rain and no notification of its arrival :(-The keyboard tray could have been a couple of inches deeper.-It's sturdy enough for my needs. But as I said its good value for the money.All in all I am super happy with this desk. I'd buy it again.\n"", ""\n  Needed to get a smaller desk after moving, but didn't want to spend too much, and after a lot of trawling across the 'net,  this seemed to fit the bill.Seems OK after nearly 2 months, but still getting used to not having anywhere near the space I had with my old one.Would be handy if the shelf on the right hand side was adjustable, as I prefer my PC Base unit on the floor rather than up on the shelf as it has to be in this case.I measured everything carefully to ensure that everything I needed to fit on the desk would fit, and as you can see it does.The material appears to be MDF with a black indeterminate covering, but the covering is VERY thin so will become easily damaged - mine has a couple of scratches already.Each part of the desk is around 12mm thick, so NOT for heavy duty use. I would say ideal for a kid's bedroom (apart from the fact it damages easily) or a small room / office where space is at a premium, but if you have the space, there are better desks out there.**NOTE** The hutch my monitor is standing on in the pic was bought separately and wasn't part of this desk.\n"", ""\n  As the review states, the design of of this desk is excellent. The size is reasonably small, it has multiple layers, it has a place to put your keyboard and mouse under the desk, it has a compartment to put things in. It's pretty great.The concern is the quality of the wood itself, and the paint coming away from the wood so early into its life. There are several areas which have seen quite minor use which have paint pulling away from the wood. Although at this point in its life it is mostly just an aesthetic problem, I am fairly certain that in the not so distant future I am going to need to repaint the wood and possibly varnish it.I would also like to clarify that although it just looks like a surface, cleaning it only adds more white dots, and upon further inspection it is quite self-evident that this is whatever is underneath the paint coming through the top layer of paint.Tl:Dr - This is a well designed but cheap item, the actual quality of the item itself is very poor, however the design is excellent. I'd also add that it was easy to put together alone, although a little time consuming.\n"", ""\n  This was perfect for my sons needs to organise all of his gaming equipment. Don't bother! Instead spend an hour assembling it, feel chuffed with yourself and then for the finishing touches..peel off all the stickers. Only did 2 (and gently) as they also peeled the wood effect off to reveal the cheap ply beneath. Ruined.  Another hour to disassemble and pack up and now need to find the time to take it to the Post Office (it's a 2 person carry). Still they will refund up to £4.75 postage..will probably cost me £15 due to the weight! Son bought it out of his birthday money and is gutted.\n""]"
5,"['Cubiker Modern L-Shaped Desk Computer Corner Desk, PC Laptop Writing Study Desk for Home Office Wood & Metal, Rustic Brown', 'Cubiker Modern L-Shaped Desk Computer Corner Desk, PC Laptop Writing Study Desk for Home Office Wood & Metal, Rustic Brown', 'Cubiker Modern L-Shaped Desk Computer Corner Desk, PC Laptop Writing Study Desk for Home Office Wood & Metal, Rustic Brown', 'Cubiker Modern L-Shaped Desk Computer Corner Desk, PC Laptop Writing Study Desk for Home Office Wood & Metal, Rustic Brown', 'Cubiker Modern L-Shaped Desk Computer Corner Desk, PC Laptop Writing Study Desk for Home Office Wood & Metal, Rustic Brown', 'Cubiker Modern L-Shaped Desk Computer Corner Desk, PC Laptop Writing Study Desk for Home Office Wood & Metal, Rustic Brown', 'Cubiker Modern L-Shaped Desk Computer Corner Desk, PC Laptop Writing Study Desk for Home Office Wood & Metal, Rustic Brown', 'Cubiker Modern L-Shaped Desk Computer Corner Desk, PC Laptop Writing Study Desk for Home Office Wood & Metal, Rustic Brown']","[5, 5, 2, 5, 5, 5, 5, 5]","[27, 13, 8, 14, 14, 6, 8, 1]","['\n  All in all this is a good desk. Look modern and sleek. Only took a bit over 15 minutes to assemble, and instructions were easy to follow, very satisfied with the purchase.\n', '\n  I’ve been meaning to set up my home office for awhile and really needed a corner desk. There were allot of options but didn’t know that these tables can get so expensive. I decided on taking a chance on this one after searching for some time.For the price, I’d say it was a little on the expensive side for what it is but having been able to use it for 2 weeks, I can say with some relief it was well with worth it.The materials all came packed separately but thank goodness the instructions are really easy and straight forward. It caught me off guard because it seemed so easy that I thought I overpaid for cheap quality. But it was the complete opposite.Pros: the table is well sized for a large monitor (32”) in the center and still plenty of space for a 13” MacBook Air on my right side and doing other tasks on my left. Although, from the photos the table looked to be a little bigger, I’m glad it’s the size that it is; anything bigger would have seemed to clunky. It’s the perfect size for something modern and saves space. The table is also very sturdy too. I hate it when cheap tables shake easily or feels very weak. While it looked cheap when I initially unboxed the materials, after putting it together I realized it was made to hold together very strong. I’ve been very happy with itCons: for the price I had hoped the quality came from higher grade materials. The color options could have been better. I prefer gray or something out of the Apple store but it’s growing on me.If you’re saving money but need a study corner desk, this one is a sure winner. Don’t have to break the bank on this on and it has plenty of space to get your work done.\n', '\n  The desk has a nice look and is very functional, but!!First, the build quality of the frame pieces is quite poor.  Several pieces need to be adjusted with a grinder to fit properly.  One piece was off by over 1/4"" and would have left gaps in the desk surface.  Another would piece would not lineup, any of the four holes, without considerable grinding.  It was off square by several degrees.  Even then the welded parts with the threads were not square.  I had go adjust screw holes to get the piece together.The top pieced of the desk are not very heavy.  It is too flimsy with far more flex that I would like in a desk.  It\'s just not a quality piece.  The top of the desk needs added supports to be sturdy.It\'s a nice design, just not good quality.  I would not buy again.\n', '\n  The desk dimensions are (51.2""+51.2"")L*19.7""D, 29.5""H, double desktop. There are 4 small cylindrical woods for connecting 3 pieces desktop, do not forget them before they were joint together. And the round metal for the bottom was set up at the last, otherwise, it may not be easily seamless to make the 3 piece together. It’s useful one!\n', '\n  This is a great desk, especially for the price.Assembly -the instructions recommend you assemble with someone for efficiency, but I was able to assemble the desk by myself in about 30 minutes. The instructions are easy to read.Sturdiness - this is a strong deskThe desk is able to hold my 24 inch monitor, laptop, and tablet. My desk still feels big despite having all these items on it.I would say you get good value for the price of the desk.\n', '\n  Big fan of the desk and the overall design.- Build of the desk is solid, materials do not feel cheap- Design is stylish and modern with plenty of space (2 monitors, keyboard, mouse, fan, printer, knick knacks with room for a workspace still)- Plenty of space underneath for placing your feet/PC. (I would recommend a small stand to keep your PC off the ground)- All the tools to put it together were provided and even had a few extra screws.- Nice to have the option of which side you want to put the shelf on (easily exchangeable too)Nitpick- While the desk boards feel sturdy I wish they were a little thicker.Overall a solid product and a professional presentation.  Cubiker is a company I will look for when ordering my next desk.\n', '\n  The desk fits perfect for my children to do their homework and at the same time use it as a gaming desk.Easily assembled, no missing pieces. My 10 year old son was able to put it together all by himself following the instruction manual.\n', ""\n  My teenage sister received this as a gift for Christmas and it fits perfectly in her room, with her decor and all. She's extremely happy with it. She was able to put this together by herself (we offered to help, but teens, man), so I assume it wasn't difficult. Be warned that the box it HEAVY, so you'll need help to lift it. It didn't come delivered in any sort of hidden packaging either. Just the box the desk is in, so if you're worried about porch pirates or someone seeing what it is, you might wanna plan to hang around the day it's supposed to be delivered.\n""]"
6,"['Casaottima L Shaped Gaming Desk, 51"" Home Office Desk with Round Corner Computer Desk with Large Monitor Stand Desk Workstation,Black', 'Casaottima L Shaped Gaming Desk, 51"" Home Office Desk with Round Corner Computer Desk with Large Monitor Stand Desk Workstation,Black', 'Casaottima L Shaped Gaming Desk, 51"" Home Office Desk with Round Corner Computer Desk with Large Monitor Stand Desk Workstation,Black', 'Casaottima L Shaped Gaming Desk, 51"" Home Office Desk with Round Corner Computer Desk with Large Monitor Stand Desk Workstation,Black', 'Casaottima L Shaped Gaming Desk, 51"" Home Office Desk with Round Corner Computer Desk with Large Monitor Stand Desk Workstation,Black', 'Casaottima L Shaped Gaming Desk, 51"" Home Office Desk with Round Corner Computer Desk with Large Monitor Stand Desk Workstation,Black', 'Casaottima L Shaped Gaming Desk, 51"" Home Office Desk with Round Corner Computer Desk with Large Monitor Stand Desk Workstation,Black', 'Casaottima L Shaped Gaming Desk, 51"" Home Office Desk with Round Corner Computer Desk with Large Monitor Stand Desk Workstation,Black']","[5, 5, 5, 1, 5, 3, 4, 2]","[168, 159, 142, 52, 224, 8, 150, 4]","['\n  \xa0The table is very spacious for me to keep my laptop, printer as well as few books and still have some space left. The quality of the material is excellent as well. I followed the instructions sheet which came along and the table was really very easy to assemble. All and all it was a perfect find.\n', '\n  This desk is amazing and the company that I received it from is as well. I have been looking for an L-Shaped desk for a long time now as I definitely need the space. I ordered this one and it was delivered fast and even on a Sunday! The instructions for putting it together are super easy and the assembly is super simple as well. I was able to get it together and up in less than 20 minutes! I have even tested the sturdiness of this desk as I can be quite the grumpy gamer when I lose matches and it can handle my angry hulk smashes time and time again! I definitely recommend this desk 100% 10/10!\n', '\n  Product came and was packaged well no damage, I am not good at setting furniture up but this only took me 30-40 mins by myself all acres and tools came with it. Fits all of my equipment and is exactly what I was looking for.\n', '\n  This was missing a piece(piece ""E"") crucial for holding the desk togther.... now I have no idea what to do. I feel like I wasted my money.\n', ""\n  I really enjoy this table since it pretty lightweight compared to others, but its material looks very heavy duty and sturdy. I love the way they design the L shape. Instead of sharp, they make it shapes like a circle so that you have lots of room behind for wires and stuff like that. Overall, it is a good one for the office table, but if you are looking for a gaming table it shouldn't be an option for you in my opinion. It is not as wide enough as the regular gaming table. So if you are looking for an office table, this is the one for you!! I don't know why I cannot post a real picture of what I have set up but anyway, just give it a shot I would say :)\n"", '\n  I’m going to start off with the bad, I received the product defective. As shown in the pictures, there was supposed to be two holes on one side to insert the screws, but it was defective and one hole was on one side and the other on the correct side. I made do, and assembled it just fine after figuring out that the diagram was completely off and did not match ANY parts.I had to use the picture to assemble most of it.I did have trouble aligning the parts since the holes were mostly off or not a perfect fit.The good,It looks very nice assembled. It only wiggles (barely) on the side that is missing the screw. The height is perfect. It’s also long enough to fit my 32 in tv, Xbox and 22in monitor. I wouldn’t recommend using the shelf for the monitor as it would be way to high and a strain on your neck.Cleans good, and once you properly adjust the little caps on the legs, it’s perfectly straight and not wiggly.Had it not been defective and hard to assemble I would give it 4 stars because the quality is good. For a beginner gaming desk.\n', ""\n  I want to let you know that this manual is mostly picture driven and that you may wind up changing up many things before you get it right. My biggest recommendation is to keep everything loose until you know that is is going to work. As for the integrity of the desk there is always going to be one part (pictured above) that does not center correctly no matter how many times you redo it (three for me) I could not get it flush. It does not seem like the kind of desk that will last for years to come.  If you bought this for gaming you probably do not want to use the monitor stand unless you got a cheap LCD like I did and have a little money to throw around. My final thought is that this desk seems more at home in a quiet setting which should help it last longer but you know the old saying caveat emptor (Let the buyer beware for those who don't speak Latin).\n"", '\n  The desk itself is beautiful and very easy to put together. For my personal needs, however, it is way too wobbly and shakes when I type or write. I do not type or write very hard - I believe I am pretty average in those areas. I have the desk placed on carpet and it shakes so much as I am typing this that my coffee is sloshing around in the mug next to the keyboard. The ""levels"" on the legs do not work very well as they are inserted into the legs with cheap plastic. So if you unscrew one or two of them on once of the desk, the corresponding ones on the other side of the desk might not work the same.While measurements are provided in the description of the product, I guess I didn\'t think things through well enough when I was considering purchasing this product. The desk top is so shallow that I simply cannot have my monitor on the desk and still have room for the keyboard and mouse. It is way too close to my eyes. So I had to place a narrow table behind this desk to hold my monitors so I didn\'t blind myself. I feel as though I am still too close to the monitors.I am thinking of using this as a sewing table instead and hopefully the weight of the sewing machine will hold it down from wobbling so much. But it\'s really not worth the effort to uproot everything and then find out it will continue to wobble horribly for the sewing machine, too.I am honestly not sure how to remedy this situation. I can\'t be the only person experiencing this problem. Again, I don\'t type or write that hard. I did not have this problem with the previous desk this replaced. I can\'t remove the carpet from my office just to see if that remedies the situation - but I think no carpet would be worse.I guess it\'s worth the price I paid for it. But I can\'t really use it for anything but sitting and watching movies. I can\'t imagine how a GAMER would be able to use this desk without it shaking all over the place. Unless you play games that don\'t require the keyboard - then i can see how this would be a good desk.I think all of the positive reviews for this encouraged me to purchase it - but I am terribly disappointed. Not worth packing it all back up and try to get a refund. So think about this carefully before you decide to purchase.\n']"
