,Title,Rating,Helpful,Text
0,"['Apple AirPods with Charging Case (Wired)', 'Apple AirPods with Charging Case (Wired)', 'Apple AirPods with Charging Case (Wired)', 'Apple AirPods with Charging Case (Wired)', 'Apple AirPods with Charging Case (Wired)', 'Apple AirPods with Charging Case (Wired)', 'Apple AirPods with Charging Case (Wired)', 'Apple AirPods with Charging Case (Wired)', 'Apple AirPods with Charging Case (Wired)', 'Apple AirPods with Charging Case (Wired)', 'Apple AirPods with Charging Case (Wired)', 'Apple AirPods with Charging Case (Wired)', 'Apple AirPods with Charging Case (Wired)']","[5, 5, 5, 5, 5, 1, 1, 4, 5, 5, 1, 5, 1]","[6216, 4860, 3544, 1976, 1883, 1531, 1449, 915, 99, 69, 26, 14, 19]","['\n  Everyone is posting that there isn’t a difference between these and the 1st gen.  This is misleading and inaccurate.  Is the improvement drastic, no, but it is still an improvement.  The improvement is that Apple has upgraded the on-board chip to the H1, which leads to faster and more stable pairing.  This isn’t anecdotal.  It’s been tested and proven to be faster.Also, if you opt for wireless charging, buy the case with the gen 2 AirPods and you’ll save a few dollars.If you already have the 1st gen, then it’s probably not worth the upgrade.  If you are looking to buy your first pair of AirPods, then go for these.\n', '\n  These AirPods are amazing they automatically play audio as soon as you put them in your ears and pause when you take them out. A simple double-tap during music listening will skip forward. To adjust the volume, change the song, make a call, or even get directions, just say ""Hey Siri"" to activate your favorite personal assistant. Plus, when you\'re on a call or talking to Siri, an additional accelerometer works with dual beamforming microphones to filter out background noise and ensure that your voice is transmitted with clarity and consistency.Additionally, they deliver five hours of listening time on a single charge, and they\'re made to keep up with you thanks to a charging case that holds multiple additional charges for more than 24 hours of listening time. Just 15 minutes in the case gives you three hours of listening to time or up to two hours of talk time.I would highly recommend it to anyone looking to buy\n', '\n  These are great but not much better then gen1. Only addition is Siri feature. I will rather buy the previous model on discount and Save some green.\n', '\n  Excellent, pretty useful... easy to use and reliable. At first I had some doubts about it being reliable to my Mac as some Bluetooth speakers sometimes cut off, but these work great and are really comfortable to my ears. Aesthetically, they look great to me.Worth every penny.\n', ""\n  My son really wanted airpods but his parents thought that they were a waste of money so I bought them for him behind their back and he loves them!! He has wanted them for a while now and these are really good quality!! Real things!! He wore them all day long!! Glad he's thankful!! God Bless, Margaret (Michael's mother)\n"", '\n  Poor quality microphone. Not suitable for a remote worker taking calls. If your job requires dictation or a high quality mic, go elsewhere\n', '\n  I had the AirPods for only a few days.. every time I opened the charging case (after couple hours - enough time for charging), the left earplug was always at very low battery (0-5%), but the right one is fully charged. So I returned it.\n', '\n  Got it for my wife’s birthday. Since XS doesn’t have the old headphone plugs, AirPods work perfectly. More importantly she loves it. Sound effect is pretty good too.\n', ""\n  First off, Airpods are great. Seamless connection, great sound quality, compact and high quality design you always receive from apple.However, I was very nervous to buy on Amazon. Many reviews stated these were generation 1 airpods which came out in 2016. In the product description it did state the second generation model number  MV7N2AM/A and with amazon's amazing return policy I decided that it was the risk to buy and if the 1st generation did show up, I could easily return and purchase somewhere else. Thankfully, after checking serial numbers on both the box and after the airpods were connected through my phone I can confirm these are authentic, second generation airpods.  Based off others reviews that they received generation 1 airpods, I can't 100% guarantee you will get 2nd generation airpods, buit it seems like they've stopped sending out the old pairs at this point.\n"", '\n  Look at the box. If they are A2032, A2031 or A1602, they are Gen2.\n', ""\n  If you're buying these for on the go, don't. If your phone is in your pants pocket they don't have a stable connection when outside and there's nothing for the bluetooth to bounce off. Pretty useless for walks or commuting on foot.Will half work if I put it in my upper jacket pocket so it's closer to the earbuds\n"", '\n  I’ve had these for almost a year now. So easy to use and portable and comfortable. Lost them a week ago and today I found them outside after a snowstorm and rainfall. They still work fine. I am not quite sure how they managed to keep working but I am not complaining. Best wireless headphones out there.\n', '\n  Com um mês de uso um dos fones não está funcionando, estou aguardo um retorno do vendedor. Muito decepcionada\n']"
1,"['Apple AirPods with Wireless Charging Case', 'Apple AirPods with Wireless Charging Case', 'Apple AirPods with Wireless Charging Case', 'Apple AirPods with Wireless Charging Case', 'Apple AirPods with Wireless Charging Case', 'Apple AirPods with Wireless Charging Case', 'Apple AirPods with Wireless Charging Case', 'Apple AirPods with Wireless Charging Case', 'Apple AirPods with Wireless Charging Case', 'Apple AirPods with Wireless Charging Case', 'Apple AirPods with Wireless Charging Case', 'Apple AirPods with Wireless Charging Case', 'Apple AirPods with Wireless Charging Case']","[1, 3, 5, 5, 1, 5, 5, 5, 3, 3, 1, 5, 5]","[1439, 1431, 751, 667, 667, 629, 334, 261, 25, 18, 17, 3, 2]","[""\n  After 10 15 minutes of use my ears started burning when I got home I noticed that I had bleeding open wounds on my ears located where the airpods rest. I'm glad I wasn't more seriously injured. The pain continued for over 6 hours even after washing the area.\n"", '\n  I ordered these the 1st day they were available and received them today.  They connected easily but on the 1st song I played the audio started slowing down less than a minute in and distorted the vocals and music.  I thought maybe it’s just a glitch because they are only 75% charged so I charged them up and reconnected them and it was even worse than before.  I called Apple support and spoke to 2 women who were beyond slow and the opposite of geniuses.  I was told the 2nd one was a senior supervisor not sure what her qualifications were as she was as inept and unhelpful as her subordinate. After 37 minutes on the call timer and being on hold over 5x I hung up.  I’m going to the Apple store tomorrow.  So I went to the Apple store and with help from the guys there we were able to determine the music issue only happens with Amazon music -  which is my service of choice.  I’ve been checking everyday for an update to fix this glitch.  Apple said they will take them back if one doesn’t come out in the next week or so.  I hate being a casualty in someone’s else’s war....😕Alright there is a workaround - Settings-Amazon Music-Turn Microphone to Off.  Then when you pull up Amazon Music deny permission for microphone access for Alexa.  It fixes the distortion issue when playing music but then I have to turn it back on when I’m using it in the car.  So I’m updating my rating from 2 stars to 3 stars.  If they release an update so I can use Alexa again I’ll raise it up higher.\n', '\n  I go to the gym and with these they were so good my head exploded in tiny pieces\n', ""\n  \xa0Wireless charging is something that you can't go back\n"", '\n  Does not work properly with amazon music. Slows down and speeds up randomly, mostly when switching apps. My other pair of wireless headphones still works fine with amazon music. So it must just be the AirPods. Works perfectly fine with Apple Music, no glitches, but I do not have the Apple Music subscription... so this is clearly a ploy by Apple to get people to solely use their music app. Pretty annoyed by it since I have the amazon music with my amazon prime subscription.\n', '\n  Perfect! Came brand new in the box, almost fully charged, everything perfect and sealed.\n', ""\n  While we have to wait and see the long term reviews of gen2 airpods but for now I will stick with gen1 as there doesn't seem to be a huge improvement.  Will be buying them on discount  now  hopefully around 100 bucks.\n"", '\n  This was a gift for my son. He’s very happy with these and says the sound is really good. He loves that he can use “Hey Siri” and says they fit perfectly in his ears, staying while he runs around with his dog. He has zero complaints.\n', '\n  A descrição deixa explícito que, apesar do produto ser da TWS, os fones e a caixa são idênticos ao produto original, o que não é verdade, já que os fones são maiores e a caixa é de plástico e de base reta. A qualidade de som não é a mesma, no entanto não é ruim, mas me incomodou ter comprado com a certeza de que a aparência seria semelhante e recebido um produto totalmente fora do que descreveram.\n', '\n  Infelizmente produto muito sensível. A seguir, a aparecia após cair no chão de uma curta distância.\n', '\n  produto veio diferente do que estava na amazon\n', '\n  Delightfully surprised that these are genuine, 2nd gen AirPods. The sound quality is much better than the wired (lightning cable) earbuds, and they were shipped in padded packaging so they arrived without damage (my main concern when ordering). Easy to pair with my iPhone 8 and my girlfriend’s old iPad running iOS 11. The double tap controls aren’t as sensitive as I’d wished, but seems to be getting more responsive the more I use it.\n', '\n  Work great. Pairs quickly to your phone. Sound quality is good too. Have also used them while on calls and have to say the sound quality coming in is much better than just the phone and more comfortable than holding a phone for an extended period.\n']"
2,"['Apple AirPods with Wireless Charging Case', 'Apple AirPods with Wireless Charging Case', 'Apple AirPods with Wireless Charging Case', 'Apple AirPods with Wireless Charging Case', 'Apple AirPods with Wireless Charging Case', 'Apple AirPods with Wireless Charging Case', 'Apple AirPods with Wireless Charging Case', 'Apple AirPods with Wireless Charging Case', 'Apple AirPods with Wireless Charging Case', 'Apple AirPods with Wireless Charging Case', 'Apple AirPods with Wireless Charging Case', 'Apple AirPods with Wireless Charging Case', 'Apple AirPods with Wireless Charging Case']","[1, 3, 5, 5, 1, 5, 5, 5, 3, 3, 1, 5, 5]","[1439, 1431, 751, 667, 667, 629, 334, 261, 25, 18, 17, 3, 2]","[""\n  After 10 15 minutes of use my ears started burning when I got home I noticed that I had bleeding open wounds on my ears located where the airpods rest. I'm glad I wasn't more seriously injured. The pain continued for over 6 hours even after washing the area.\n"", '\n  I ordered these the 1st day they were available and received them today.  They connected easily but on the 1st song I played the audio started slowing down less than a minute in and distorted the vocals and music.  I thought maybe it’s just a glitch because they are only 75% charged so I charged them up and reconnected them and it was even worse than before.  I called Apple support and spoke to 2 women who were beyond slow and the opposite of geniuses.  I was told the 2nd one was a senior supervisor not sure what her qualifications were as she was as inept and unhelpful as her subordinate. After 37 minutes on the call timer and being on hold over 5x I hung up.  I’m going to the Apple store tomorrow.  So I went to the Apple store and with help from the guys there we were able to determine the music issue only happens with Amazon music -  which is my service of choice.  I’ve been checking everyday for an update to fix this glitch.  Apple said they will take them back if one doesn’t come out in the next week or so.  I hate being a casualty in someone’s else’s war....😕Alright there is a workaround - Settings-Amazon Music-Turn Microphone to Off.  Then when you pull up Amazon Music deny permission for microphone access for Alexa.  It fixes the distortion issue when playing music but then I have to turn it back on when I’m using it in the car.  So I’m updating my rating from 2 stars to 3 stars.  If they release an update so I can use Alexa again I’ll raise it up higher.\n', '\n  I go to the gym and with these they were so good my head exploded in tiny pieces\n', ""\n  \xa0Wireless charging is something that you can't go back\n"", '\n  Does not work properly with amazon music. Slows down and speeds up randomly, mostly when switching apps. My other pair of wireless headphones still works fine with amazon music. So it must just be the AirPods. Works perfectly fine with Apple Music, no glitches, but I do not have the Apple Music subscription... so this is clearly a ploy by Apple to get people to solely use their music app. Pretty annoyed by it since I have the amazon music with my amazon prime subscription.\n', '\n  Perfect! Came brand new in the box, almost fully charged, everything perfect and sealed.\n', ""\n  While we have to wait and see the long term reviews of gen2 airpods but for now I will stick with gen1 as there doesn't seem to be a huge improvement.  Will be buying them on discount  now  hopefully around 100 bucks.\n"", '\n  This was a gift for my son. He’s very happy with these and says the sound is really good. He loves that he can use “Hey Siri” and says they fit perfectly in his ears, staying while he runs around with his dog. He has zero complaints.\n', '\n  A descrição deixa explícito que, apesar do produto ser da TWS, os fones e a caixa são idênticos ao produto original, o que não é verdade, já que os fones são maiores e a caixa é de plástico e de base reta. A qualidade de som não é a mesma, no entanto não é ruim, mas me incomodou ter comprado com a certeza de que a aparência seria semelhante e recebido um produto totalmente fora do que descreveram.\n', '\n  Infelizmente produto muito sensível. A seguir, a aparecia após cair no chão de uma curta distância.\n', '\n  produto veio diferente do que estava na amazon\n', '\n  Delightfully surprised that these are genuine, 2nd gen AirPods. The sound quality is much better than the wired (lightning cable) earbuds, and they were shipped in padded packaging so they arrived without damage (my main concern when ordering). Easy to pair with my iPhone 8 and my girlfriend’s old iPad running iOS 11. The double tap controls aren’t as sensitive as I’d wished, but seems to be getting more responsive the more I use it.\n', '\n  Work great. Pairs quickly to your phone. Sound quality is good too. Have also used them while on calls and have to say the sound quality coming in is much better than just the phone and more comfortable than holding a phone for an extended period.\n']"
3,"['Apple AirPods Pro (Renewed)', 'Apple AirPods Pro (Renewed)', 'Apple AirPods Pro (Renewed)', 'Apple AirPods Pro (Renewed)', 'Apple AirPods Pro (Renewed)', 'Apple AirPods Pro (Renewed)', 'Apple AirPods Pro (Renewed)', 'Apple AirPods Pro (Renewed)']","[1, 1, 4, 1, 5, 5, 5, 1]","[277, 122, 110, 67, 57, 50, 39, 32]","['\n  Headline says it all\n', '\n  I was so excited to get these. While the sound quality / ANC is amazing, I have a consistent, irritating buzzing / static noise in the right Airpod. When you spend this kind of money on a product, you expect it to just WORK. I have troubleshooted online, reset the Airpods several times, etc... still has the buzzing static sound in the right pod. I regret making this purchase through Amazon.\n', '\n  I was a little mad about the price but I didn’t want to wait until next month until brand new AirPod pro’s were in stock, and these came in good condition too.\n', '\n  This product arrived LOOSE IN A BOX. The items left ear pod refuses to charge above 77 percent. The box flashes amber and WILL NOT PAIR as a set. When The right one is Individually  placed in box the right one will pair allow you to remove it from box and play music well. The left one when individually placed in box will pair and play in charging box, but refuses to remain connected once removed to use.  As a set these refuse to work at all. Performed reset options on Apple website, nothing works.  Product advertised as amazon tested and renewed.  Seller questions suggest having Apple fix them at a repair location. I find this a ridiculous request to customers, would not paid the price for broken Apple AirPod pro.  They do appear to be genuine Apple product. All S/N match. Processing return as I write this.\n', '\n  These headphones are great mine came brand new\n', '\n  I ordered these as a Christmas gift. It says renewed but it looks and sounds like brand new. Great sound. Great noise cancellation. These are with the wireless charging case.\n', '\n  It was perfect band new !!! Good job will come back again .\n', ""\n  Mic doesn't work, loud clicking noises happen frequently, sometimes refuses to connect. Difficult to contact support. Took to an Apple store and they confirmed this was a fraudulent product. Do not buy! I am appalled that Amazon allows fraudulent products on their platform\n""]"
