,Title,Rating,Helpful,Text
0,"['Royal Decanters Wine Decanter Set with Wood Base - With 750ml Crystal Glass Decanter and 4 Stemless Wine Glasses - Great Gift and Beautiful Display Piece for Red or White Wine - Patent Pending Design', 'Royal Decanters Wine Decanter Set with Wood Base - With 750ml Crystal Glass Decanter and 4 Stemless Wine Glasses - Great Gift and Beautiful Display Piece for Red or White Wine - Patent Pending Design', 'Royal Decanters Wine Decanter Set with Wood Base - With 750ml Crystal Glass Decanter and 4 Stemless Wine Glasses - Great Gift and Beautiful Display Piece for Red or White Wine - Patent Pending Design', 'Royal Decanters Wine Decanter Set with Wood Base - With 750ml Crystal Glass Decanter and 4 Stemless Wine Glasses - Great Gift and Beautiful Display Piece for Red or White Wine - Patent Pending Design', 'Royal Decanters Wine Decanter Set with Wood Base - With 750ml Crystal Glass Decanter and 4 Stemless Wine Glasses - Great Gift and Beautiful Display Piece for Red or White Wine - Patent Pending Design', 'Royal Decanters Wine Decanter Set with Wood Base - With 750ml Crystal Glass Decanter and 4 Stemless Wine Glasses - Great Gift and Beautiful Display Piece for Red or White Wine - Patent Pending Design', 'Royal Decanters Wine Decanter Set with Wood Base - With 750ml Crystal Glass Decanter and 4 Stemless Wine Glasses - Great Gift and Beautiful Display Piece for Red or White Wine - Patent Pending Design', 'Royal Decanters Wine Decanter Set with Wood Base - With 750ml Crystal Glass Decanter and 4 Stemless Wine Glasses - Great Gift and Beautiful Display Piece for Red or White Wine - Patent Pending Design']","[4, 2, 5, 5, 5, 5, 5, 1]","[1, 2, 1, 1, 1, 0, 0, 0]","['\n  The hole set is not dishwasher safe.so not wash the glasses in the dishwasher .the glasses are beautiful and very handy perfect for a good occasion.The wine holder very delicate but after all is glass.\n', '\n  Arrived in tact. Poor quality for the price.\n', '\n  Needed a decorative piece for a side bar in the dining room, this set looks fantastic and the tray is such a nice addition.\n', '\n  We bought this for a newlywed couple and they absolutely loved it\n', '\n  Beautiful\n', '\n  Looks very elegant and modern.\n', '\n  Stunning! Looks beautiful.\n', '\n  Glasses weren’t round, they had flat spots and I did not like the cheesy different colored glasses.\n']"
1,"['Oster Master Series Blender with Texture Select Settings, Blend-N-Go Cup and Glass Jar, Grey', 'Oster Master Series Blender with Texture Select Settings, Blend-N-Go Cup and Glass Jar, Grey', 'Oster Master Series Blender with Texture Select Settings, Blend-N-Go Cup and Glass Jar, Grey', 'Oster Master Series Blender with Texture Select Settings, Blend-N-Go Cup and Glass Jar, Grey', 'Oster Master Series Blender with Texture Select Settings, Blend-N-Go Cup and Glass Jar, Grey', 'Oster Master Series Blender with Texture Select Settings, Blend-N-Go Cup and Glass Jar, Grey', 'Oster Master Series Blender with Texture Select Settings, Blend-N-Go Cup and Glass Jar, Grey', 'Oster Master Series Blender with Texture Select Settings, Blend-N-Go Cup and Glass Jar, Grey']","[2, 4, 2, 2, 1, 5, 5, 4]","[10, 4, 8, 3, 4, 5, 1, 1]","[""\n  Good price for what you get. However, there are a couple of design flaws. Small amounts of liquid shoot out of lid and it does not blend things very well.  The unit has a few programs that run automatically as well as pulse features. The programs start with a few pulse blends before going full throttle. During the pulsing, liquids are pushed all the way to top of the lid and small amount of liquids shoot out. Also, some combination of the blades and wideness of the container create very chunky blends. I'm not happy with this and intend to return it.\n"", '\n  Graduated from an decade old programmed Oster blender to this when the older one stopped working consistently. This is an OK blender, blends fine. The plastic chassis seems a little cheap and thin over the traditional thick black plastic of all the older Oster blenders I’ve had. The smoothie cup is helpful.This model has a safety latch on the blade base that prevents the glass or cup from coming unseated from the the base during blending. Never seen one of these before but it works fine on the glass pitcher, easy to screw on. Unfortunately the smoothie cup isn’t designed as well and you can easily think you are screwed on tight but actually it’s loose. The pitcher has the latch stops designed with slight angles so the latch is pushed up over the stop as your are screwing it on. The smoothie cup doesn’t have the angles so if you don’t pay close attention, the latch could hit one of the stops and fool you into thinking the base is on tight. We already had one moderate mess from that design flaw.The automatic settings are sort of mysterious to me. The older Oster blender had several presets that once pressed, would run and then stopped. This model, for example, has three “smoothie” settings when activated do slightly different routines but then go into a perpetual blend mode and don’t stop. Perhaps I haven’t waited long enough but quite frankly if your smoothie isn’t done after 2 minutes I don’t know what I’ve been doing wrong all these years.\n', '\n  Product does not handle ice well at all. Used it 3 times for ice drinks and it would seize up.. smelt hot after 15 seconds ofnuse. Returned it.\n', ""\n  I don't understand how whoever designed this thought it would be fine to have gaps in the lid.  I noticed this right away and decided to return it.  I'm surprised this got as many good reviews, though it seems like it would be OK if not for this one flaw.\n"", '\n  Liquids shoot out of the top of the jar because there are four small openings around the edge of the plastic plug in the center of the lid. I find it hard to believe that Amazon and Oster are associating their names with the thing.\n', ""\n  I took a long time choosing the best blender for the money, I looked for a glass jar, high power motor and ease of use, this one checked off all the boxes, couldn't be happier.\n"", '\n  My nutribullet burned up in less than 6 months so I needed a replacement. I picked this one and am glad I did. it was less than 1/2 the price of the other and is nowhere near as loud as the other was.  It does the job for my smoothies! First time I have purchased an Oster product and I am very pleased with this blender!\n', ""\n  Good economical blender.  Comes with a smaller smoothie piece that comes in handy.  It has an unexpected feature of start and stopping when you start a smoothie.  Not sure why.  Maybe it gives the fruit a second to settle before starting again.  The only think I don't like it the gasket takes a little effort to pill out so the base can be cleaned.  Minor problem that wouldn't dissuade me but worth mentioning.\n""]"
2,"['NutriBullet Pro - 13-Piece High-Speed Blender/Mixer System with Hardcover Recipe Book Included (900 Watts)', 'NutriBullet Pro - 13-Piece High-Speed Blender/Mixer System with Hardcover Recipe Book Included (900 Watts)', 'NutriBullet Pro - 13-Piece High-Speed Blender/Mixer System with Hardcover Recipe Book Included (900 Watts)', 'NutriBullet Pro - 13-Piece High-Speed Blender/Mixer System with Hardcover Recipe Book Included (900 Watts)', 'NutriBullet Pro - 13-Piece High-Speed Blender/Mixer System with Hardcover Recipe Book Included (900 Watts)', 'NutriBullet Pro - 13-Piece High-Speed Blender/Mixer System with Hardcover Recipe Book Included (900 Watts)', 'NutriBullet Pro - 13-Piece High-Speed Blender/Mixer System with Hardcover Recipe Book Included (900 Watts)', 'NutriBullet Pro - 13-Piece High-Speed Blender/Mixer System with Hardcover Recipe Book Included (900 Watts)', 'NutriBullet Pro - 13-Piece High-Speed Blender/Mixer System with Hardcover Recipe Book Included (900 Watts)', 'NutriBullet Pro - 13-Piece High-Speed Blender/Mixer System with Hardcover Recipe Book Included (900 Watts)', 'NutriBullet Pro - 13-Piece High-Speed Blender/Mixer System with Hardcover Recipe Book Included (900 Watts)', 'NutriBullet Pro - 13-Piece High-Speed Blender/Mixer System with Hardcover Recipe Book Included (900 Watts)', 'NutriBullet Pro - 13-Piece High-Speed Blender/Mixer System with Hardcover Recipe Book Included (900 Watts)']","[1, 1, 5, 1, 1, 1, 3, 3, 5, 4, 3, 5, 1]","[276, 310, 161, 382, 284, 259, 124, 117, 52, 41, 24, 26, 20]","['\n  I was so looking forward to receiving my NutriBullet Pro. The demo videos were great, most reviewed were great. I couldn’t have been more disappointed I don’t think. First I arrive home to find it sitting in my front porch in plain view of anyone who drives by (as always) but the problem was it was not revised. So everyone could see there was a NutriBullet sitting in my front porch. Second, it came via UPS. They are notorious for rough handling of packages so my purchase was not protected from the physical abuse of UPS. It was scuffed up and corners dinged in. Fortunately the unit inside was not damaged. So in summary of these issues, product not shipped in amazon box which protects it physically and doesn’t advertise for hthe neighborhood what I bought. Now the third issue is the product itself. Cheap. Doesn’t blend well. Bounces around in the counter as it’s blending. I used 1 cup of milk, 1-1/2 cups frozen fruit chunks and a 1/2 scoop of protein powder. That didn’t take up much space in the cup. The instructions do say to fill to the max line with liquid. I was making a smoothie for myself, not a whole family. So, it spun and spun just the bottom part. Then the thing would jump as another piece of fruit slid down into the blades. This went in for several minutes before it finally had all the contents whirring around as it should. So now it’s done and I have a giant cup not even half full, pop a lid on it and go. I ordered this to replace my Ninja that quit working. I plan to send the Nutribullet back and get another Ninja.  The Ninja cup was about 14 ounces or so, and my smoothie was ready in a matter of about 30 seconds or less. The unit had suction feet so it didn’t bounce around on the counter. This was my first and last NutriBullet. NEVER again.\n', '\n  The unit is way to fast. At first I thought this was normal but after a couple of weeks the rubber below the blades started to rip appart.The cup contact ears broke within a month.\n', ""\n  I really like my NutriBullet Pro and have made a number of great smooties.  I did get some leaking early on, but once I reversed the order of ingredients from what the book recommends I had NO more problems.  The instruction say to shove the green stuff in first with frozen items and ice on top, but you're flipping this thing over!  When I loaded as recommended, the frozen items gave it a hard time and the greens stayed up in the top.  Numerous stops, shakes, and re-starts caused the leaking!  I put frozen items in first, then layer on fruit, yogurt, greens, then a few ice cubes on top - works great!  Pulverizes everything, including whole almonds.  Make sure the lid is tight especially if you stop and re-start, or pulse.  Afterwards, the lid can be a bit difficult to remove but not a huge problem.  Experiment!  Some smoothies look pretty gross, but taste good nevertheless.  I definitely did NOT need all these parts - will probably never use the flip top lids or handle attachments.  The blender cup is large, and I just pour everything into a different glass.  Save your money on that one.  The book was useless and is just a big advertisement.\n"", ""\n  Unit arrived in good order, but I believe the NutriBullet Company's products are made cheaply compared to what they were just a couple of years ago.  I tried my new unit yesterday and I do know that you have to seal the blades onto the plastic glass container rather securely.  I did.  However, quite a bit of my drink ended up leaking out and dripping down into the motor housing...what?!!?  I'm not a weak person, and I do know how to secure the unit prior to mixing a smoothie...but it leaks, simple as that.  Totally unacceptable, not to mention somewhat dangerous - I imagine.  Returning item for refund.  NutriBullet needs to use much more effective gasket, I guess.Roger\n"", ""\n  We've given this a good shot and we're not happy. We had the original NutriBullet and used it every day. We decided to upgrade to the better model and it is SO, SO Loud you need to leave the room when it's running, not to mention it unscrews the base from the container making a mess. We actually think there might be something wrong with this specific one, but can't figure out how to exchange it through Amazon. We'd like to try a different one and hope ours is just defective. If not, then we would prefer to go back to the original model.\n"", '\n  This is my third NutriBullet, and I am very displeased with the NutriBullet Pro.  I purchased it to make Bullet Proof Coffee every morning for my husband and I.  It has leaked 10 out of the 12 times I have it.  It leaks so badly that the motor smells like it is going to burn up.  I have tried everything to keep it from leaking, including having several other people look at it to see if I was doing something wrong with the device.  Do not buy this model.  Something has to be wrong with it when you take it out of the box and it leaks immediately.  I will be contacting Customer Support about this model.  I will return it and buy another model if that is possible.\n', ""\n  THE NUTRIBULLET STOPPED WORKING TODAY.  THERE IS AN INHERENT DESIGN FLAW.  JUICE FREEZES THE 3 WHITE SPRINGS ALONG THE TOP RIM OF THE HOUSING RENDERING IT INOPERABLE.  EVERY OWNER CAN EXPECT THIS TO HAPPEN.  THE MANUFACTURER SHOULD SEND OUT A TROUBLESHOOTING BULLETIN TO EVERY PURCHASER.CALLING CUSTOMER SERVICE I WAS TOLD TO APPLY SOAPY WATER TO THE FROZEN SPRINGS AND TO WAIT 2-3 MINUTES.  HOWEVER, IT REQUIRED USING A SCREW DRIVER AND A SMALL TACK HAMMER TO FREE THE SPRINGS.WHEN THE NUTRIBULLET WORKS IT IS A GOOD PRODUCT.  THE BLADE DESIGN IS HAZARDOUS.  IT'S A GLORIFIED BLENDER.  PURCHASERS SHOULD CONSIDER BUYING A QUALITY BLENDER INSTEAD.\n"", '\n  The unit itself and the accessories work as described.  The included ""Nutribullet Pocket Nutritionist"" and ""Blasting For Optimum Health Recipe Book"" are absolutely pathetic! I was actually looking forward to these 2 items so that I could get up to speed with the Nutribullet but they are full of useless testimonials, sales hustle and only contain the bare minimum information. They will go right into the garbage where they belong. Buyers would be much better off if the company stopped shipping this nonsense and passed the production & shipping cost savings on to the buyers in the form of a lower price.\n', '\n  Funciona muy bien !!! Por el precio está muy bien y no importa si son 12 o 13 piezas, lo tiene todo y un libro de recetas. Todo en inglés :(... viendo funciona también :)  También tiene una cálcalo is que dice ser original el producto\n', '\n  Porque lo anuncian con 13 pzas. Si únicamente trae 10 pzas. ???\n', '\n  Tengo duda si es original, ya que me llegó en esta caja 🤔\n', '\n  Maravilloso producto, realmente licua y pulveriza practicamente todo, es mucho mejor que una licuadora convencional. Y lo que mas aprecio, es el libro que mandan con recetas, están muy variadas, y son muy prácticas. Algunos ingredientes que recomiendan no son tan fáciles de conseguir, pero no imposibles, valen la pena. Estoy contento con el producto.Los únicos peros que le pongo son los siguientes: los vasos se ven muy fragiles, no creo que aguanten ni una sola caida por ejemplo, así que hay que cuidarlos mucho. También el diseño de las navajas se me hace inseguro, ya que el aparato permite ponerlas y activarlas sin vaso, siendo esto muy peligroso; quizás se debió haber pensado en algun método a prueba de este tipo de errores.\n', '\n  Excelente producto! Hasta que dejo de funcionar a los 5 meses, ni el fabricante no Amazon se hicieron responsables por la garantía.El fabricante dice que no tiene convenio con Amazon y Amazon dice que después del mes no tienen garantía.\n']"
