,Title,Rating,Helpful,Text
0,"['JOISCOPE Home Office Computer Desk,Small Study Writing Desk with Wooden Storage Shelf,2-Tier Industrial Morden Laptop Table with Splice Board,47 inches(Vintage Oak Finish)', 'JOISCOPE Home Office Computer Desk,Small Study Writing Desk with Wooden Storage Shelf,2-Tier Industrial Morden Laptop Table with Splice Board,47 inches(Vintage Oak Finish)', 'JOISCOPE Home Office Computer Desk,Small Study Writing Desk with Wooden Storage Shelf,2-Tier Industrial Morden Laptop Table with Splice Board,47 inches(Vintage Oak Finish)', 'JOISCOPE Home Office Computer Desk,Small Study Writing Desk with Wooden Storage Shelf,2-Tier Industrial Morden Laptop Table with Splice Board,47 inches(Vintage Oak Finish)', 'JOISCOPE Home Office Computer Desk,Small Study Writing Desk with Wooden Storage Shelf,2-Tier Industrial Morden Laptop Table with Splice Board,47 inches(Vintage Oak Finish)', 'JOISCOPE Home Office Computer Desk,Small Study Writing Desk with Wooden Storage Shelf,2-Tier Industrial Morden Laptop Table with Splice Board,47 inches(Vintage Oak Finish)', 'JOISCOPE Home Office Computer Desk,Small Study Writing Desk with Wooden Storage Shelf,2-Tier Industrial Morden Laptop Table with Splice Board,47 inches(Vintage Oak Finish)', 'JOISCOPE Home Office Computer Desk,Small Study Writing Desk with Wooden Storage Shelf,2-Tier Industrial Morden Laptop Table with Splice Board,47 inches(Vintage Oak Finish)', 'JOISCOPE Home Office Computer Desk,Small Study Writing Desk with Wooden Storage Shelf,2-Tier Industrial Morden Laptop Table with Splice Board,47 inches(Vintage Oak Finish)', 'JOISCOPE Home Office Computer Desk,Small Study Writing Desk with Wooden Storage Shelf,2-Tier Industrial Morden Laptop Table with Splice Board,47 inches(Vintage Oak Finish)', 'JOISCOPE Home Office Computer Desk,Small Study Writing Desk with Wooden Storage Shelf,2-Tier Industrial Morden Laptop Table with Splice Board,47 inches(Vintage Oak Finish)', 'JOISCOPE Home Office Computer Desk,Small Study Writing Desk with Wooden Storage Shelf,2-Tier Industrial Morden Laptop Table with Splice Board,47 inches(Vintage Oak Finish)']","[5, 4, 4, 5, 5, 5, 5, 5, 5, 4, 5, 5]","[150, 65, 57, 52, 57, 29, 45, 54, 0, 0, 0, 0]","['\n  This desk is amazing for the price. The box arrived in great condition, all the wooden pieces nicely wrapped, with plastic protectors on the desktop’s corners to protect them. All of the various bolts came with one extra. My one gripe, none of the pieces were labeled so I spent 15 minutes sorting everything by the pictures. If you’re good at assembling flat pack furniture, you’ll be fine. If not, you might struggle. The plastic feet on the desk are adjustable, so if your floor isn’t level, make sure you adjust the feet.\n', '\n  Needed a small desk for a child’s room. Arrived with no damage and more bolts than we needed for assembly.  This is a perfect small sized desk, and the attached shelves are a plus. The desk is very sturdy.  However, the instruction manual is pitiful. Parts list pictures are so small we needed a magnifying glass to try and tell the legs units apart. Here are some helpful directions. Part E is the table top support, while Part F and H are the little shelf legs, and G is the lone desk leg. Also, part F has two metal tabs sticking out of one side. They support part E when it is attached to the desk top. Also, step one says the “padding iron pieces” should be facing outward. Have no idea what that is, but I think they mean the metal tabs should be facing the desk side when assembled. Hope this helps some. It took us an hour, but it would have taken 30 minutes if the directions had been better. The photo I posted is a shot looking under the desk at the metal tabs. My granddaughter loves this little desk!\n', ""\n  This is a case of getting exactly what you pay for.  For the low cost, this desk is a great value and is nice looking once assembled. The laminate desktop is decent quality, the frame rails could probably use more than a spot weld though and some thicker material.  The desk is plenty sturdy to hold my dual monitor setup, but I wouldn't try to sit or stand on it myself.  The shelf is just about perfect for holding a mid-tower PC case.  Came with extra short and long bolts, but was missing 2 of the medium size bolts.  Fortunately I didn't need them since I planned to put my PC where the middle shelf goes. Could it be better? Definitely, but this desk resolved my new work from situation for a reasonable price.  I think they improved the instructions too, I'm handy, but the manual I got is different/better than the one in some other reviewer pics.  There's also a short video on YouTube from Joiscope on how to assemble this desk.  Being handy, I watched the video and was assemble the desk in less than an hour without needing any further instructions.\n"", '\n  I read some of the reviews before buying so I will address some of the comments that they made. Packaging was great, nothing damaged, and the box could\'ve taken and beating and nothing would have been hurt. The instructions were fine. Is putting furniture together ever fun and exciting? No, it\'s not. You have to pay attention and take your time. If you throw it together..... the final product is going to look thrown together.I think I understand why some of the reviews say the top gets broken when assembling. The directions say if the screw holes don\'t line up well, turn the top around and try again. Also the directions state not to over tighten the top. I didn\'t and nothing moves around. As the furniture settles I might tighten a little but that\'s pretty normal. Also, there is some ""play"" in the top cross bars that hold the top. Let me explain, two bars come together to make a corner, they are held together by a screw, if you tighten the screw when the pieces are not level, the resulting corner will not be level. Then if you put the straight top on a crooked corner piece, it\'s going to break. Make sure that when you tighten, you use your other hand to make sure the corner is where it need to be.The picture shows the 40"". Great for a smaller space with an extra monitor and a bit of storage.\n', '\n  Was able to put this together in under an hour, with just one person. Nice big desktop, and pretty sturdy for the money. It’ll still wiggle a little bit if you knock it real hard, but I’ve moved houses with it, had fat-cats jump on it, and use it daily for work.Super recommend this desk\n', ""\n  This is a wonderful desk. To say it's sturdy would be an understatement. The claims made in the product copy are true. This thing is a ROCK.The 4-star overall rating is because I did have an issue with a piece being improperly manufactured and thus didn't work with the rest of the unit. But, I contacted JOISCOPE via email and they got back to me within 48 hours. And even though supply chains are strained due to COVID-19, a fix is in the works and I am more than pleased with JOISCOPE's efforts to make it right.This is a GREAT desk that is more than sturdy and very handsome to look at. I can confidently recommend this product and the service that backs it.UPDATE: As stated above, a fix was in process at the time of the original review. That fix was received in a timely manner and I can happily give JoiScope a 5-star rating. Great product, great service and great job JoiScope!\n"", ""\n  I bought this desk for my daughter who needed an upgraded work area since all of her college classes are now online.  We were a little skeptical after reading some of the reviews, but we are pleasantly surprised with this product.  We weren't expecting it to come with two fabric drawers, so that was a nice unexpected bonus.  We do agree that the directions were not clear, but if you have a basic knowledge of putting things together you should be able to assemble it with little to no issues.  Overall, we are very satisfied with our purchase.\n"", ""\n  This desk is suitable to work. My previous computer desk is very unsteable, even a little act would shake it. I'm satisfied to sturdiness of this new desk .  It's very easy to assemble, if you fellow steps in the manual. I jusk spent 30 minutes to assemble it. It will be my working partner in my bedroom during this time.\n"", '\n  I bought this desk because I work from home. What I liked about it when I saw it online was that it has shelves. Instead of my books and binders being everywhere, I can put them all in one spot. This desk gives me more room than what I had before. I absolutely love this desk. It’s solid, I love the colours and it was pretty easy to assemble. I built it all by myself in a couple of hours. Anyway, I don’t know why I waited so long to get this. I love my new desk. I actually want to work at home now because of my newfound office space (even if it’s in the living room/dining room!). I am so pleased with it! A purchase worth making!\n', '\n  Amazing product. Exactly how the description says. It has the edge protectors but unfortunately one of the caps was broken and that resulted in a minor chip. The seller was easy to reach out and offered part compensation.Other than that, it’s steady and cute looking\n', '\n  perfect size and very sturdy and lots of room\n', '\n  Good table.\n']"
1,"['CubiCubi Computer Office Small Desk 47"", Study Writing Table, Modern Simple Style PC Desk with Splice Board, Black and Rustic Brown', 'CubiCubi Computer Office Small Desk 47"", Study Writing Table, Modern Simple Style PC Desk with Splice Board, Black and Rustic Brown', 'CubiCubi Computer Office Small Desk 47"", Study Writing Table, Modern Simple Style PC Desk with Splice Board, Black and Rustic Brown', 'CubiCubi Computer Office Small Desk 47"", Study Writing Table, Modern Simple Style PC Desk with Splice Board, Black and Rustic Brown', 'CubiCubi Computer Office Small Desk 47"", Study Writing Table, Modern Simple Style PC Desk with Splice Board, Black and Rustic Brown', 'CubiCubi Computer Office Small Desk 47"", Study Writing Table, Modern Simple Style PC Desk with Splice Board, Black and Rustic Brown', 'CubiCubi Computer Office Small Desk 47"", Study Writing Table, Modern Simple Style PC Desk with Splice Board, Black and Rustic Brown', 'CubiCubi Computer Office Small Desk 47"", Study Writing Table, Modern Simple Style PC Desk with Splice Board, Black and Rustic Brown']","[5, 4, 5, 5, 1, 5, 4, 5]","[123, 115, 82, 38, 14, 68, 9, 50]","[""\n  \xa0I absolutely love my computer desk！It is very sturdy and spacious.That my computer sits on it very well.I love the color and it is made up of quality materials.It can hold plenty of things.Except for my laptop,mouse,keyboard,books and so on, there’s still enough space for drinks \\various other objects on it.The desk arrived on time ,it took me about 30 minutes to assemble.Directions were easy to follow.I’m very pleased with this, it is larger than I pictured.For the price, this an outstanding value! I'm so glad that I've already owned it!\n"", '\n  Assembled it, secured it, nice desk.\n', ""\n  I got the 63'' one. it can fit 2 32'' monitors and a 24''. The wood feels sturdy enough the frame is made out of metal and it feels like you could over tighten them and start bending the metal in so keep that in mind. you need a mallet with the one i had cause you have hammer the frame together. the packaging arrive damaged but it had plenty of Styrofoam so the table was undamaged. everything fit together quite well the adjustable feet on the bottom gives you about a inch of play. i didnt use the hook as intended but instead i screwed it into my wall and i use it with my oculus rift. overall im super happy with the desk and so far i can tell this is gonna last me for a long time.\n"", '\n  I got the 63 inch rustic wood model.  Came packaged well all clean and new.  All holes where they should be and all nuts and bolts worked as intended on the main unit. Putting it together was fairly simple took me 30 minutes and I\'m a pretty handy person but I was ""working"" from home as well and got pulled into a phone call and chat or two.  Could easily be done in 20 minutes needing zero tools of your own.  Overall a decent looking sturdy long desk for cheap that easily garners 4 stars.Strangely enough I bump it to 5 for the great response and service from the seller (Sold by: Tespo Store) due to a minor issue.  The 4 bolts that are needed for the small monitor table that comes with this unit are not long enough.  Strange because screw in well and were in a sealed new bag as was the rest of the hardware, but nowhere near long enough to get through the ""legs"" and into the sunken nuts within the bottom side of the table board.  I emailed the seller that evening and got a fast response stating they were out of all hardware but would refund me a reasonable decent amount of money if that would be okay by me.  I replied some money back would be fine and the next day had a nice go buy myself lunch as well as the 4 bolts I need at the store and still have  few bucks left over.  Way to take care of your customer, extra star indeed!Few things that may help others:1) I have 2 swing arm monitor mounts clamped to this desk with no issues.  The clamps securely tighten to the under frame and the top of the desk and the displays as well as the desk feel secure and sound.  My monitors are 27 inch Dell S2716DG\'s.  The display mount arms I use are also from Amazon and are here for reference or interest https://www.amazon.com/gp/product/B07Z7YNCBW/ref=ppx_yo_dt_b_asin_title_o02_s00?ie=UTF8&psc=12)  I\'m a big dude 6\'2 280 and I fit fine at this desk.  More than ample amount of leg room side to side and all around.  I did adjust the casters on the legs to give me about an extra inch of height but almost feel like my old desk was too high.  I\'ve used this new CubiCubi for a few days working from home and some play as well and don\'t seem to have the shoulder or neck fatigue I would sometimes get with my old desk.All in all a great looking working desk that didn\'t break the bank and great service to boot.  If you are in the hunt for a long computer table in this lower tier price range I feel this unit is a great choice.  **Pictures before I bought and installed other identical monitor and swing arm**\n', '\n  I ordered TWO of these desks and the kids love them, BUT one had the holes incorrectly aligned so one leg won’t go together correctly or safely. I contacted the company, angry because it took over an hour to assemble and I was upset to have to take it apart to return one to be replaced. I said I wanted the part replaced or I was returning both desks. I received a response that I would be sent a replacement desk and would not have to return the defective one.That was a month ago.No desk has arrived.\n', '\n  This joint color design makes the whole table look less monotonous. Whoever packed this package are careful. The packaging is neat and the gadgets are complete. This made it easy for me to install. The table top and legs are secured with a lot of screws and are very sturdy. I got this due to my child told me his toddler desk was getting smaller for him. This bigger and taller desk is just right for him. It can hold a lot of things. He has a printer under his desk, books and his tablet on the right. Potted plants can be placed on the left. Nice purchased.\n', '\n  Good looking desk and the 63” was able to comfortably fit all 3 of my computer monitors. The entire top is actually made out of plastic and is not wood or metal. I wasn’t really expecting it to be and don’t have a problem with the top as it makes it a lot easier to clean, but don’t be deceived by just the pictures alone. It was relatively easy to assemble and didn’t take too long, my only issue was the supporting frame holding up the top was split into two pieces and you have to pressure fit these together before screwing the top on. The fit was so tight I had to use a hammer to get it the rest of the way and it still didn’t seem exactly right, but after screwing the top on, everything seemed to work out.\n', '\n  Easy to assemble, Easy to use. Sturdy and Great for a desktop setup!!The instructions were clear,  literally took me about 10 minutes! It just needs to install 4 legs and 2 leg bars, then fix the desktop board and you will finish it.  I ’m particularly satisfied with the 1.6"" sturdy desk legs, which are very stable.The contrasting color desktop boards are beautiful, and iron hook is convenient, it\'s easy to hang a bag or headphone. Perfect size and very useful for my home office. I 100% recommend this desk!\n']"
2,"['Cubiker Modern L-Shaped Desk Computer Corner Desk, PC Laptop Writing Study Desk for Home Office Wood & Metal', 'Cubiker Modern L-Shaped Desk Computer Corner Desk, PC Laptop Writing Study Desk for Home Office Wood & Metal', 'Cubiker Modern L-Shaped Desk Computer Corner Desk, PC Laptop Writing Study Desk for Home Office Wood & Metal', 'Cubiker Modern L-Shaped Desk Computer Corner Desk, PC Laptop Writing Study Desk for Home Office Wood & Metal', 'Cubiker Modern L-Shaped Desk Computer Corner Desk, PC Laptop Writing Study Desk for Home Office Wood & Metal', 'Cubiker Modern L-Shaped Desk Computer Corner Desk, PC Laptop Writing Study Desk for Home Office Wood & Metal', 'Cubiker Modern L-Shaped Desk Computer Corner Desk, PC Laptop Writing Study Desk for Home Office Wood & Metal', 'Cubiker Modern L-Shaped Desk Computer Corner Desk, PC Laptop Writing Study Desk for Home Office Wood & Metal']","[5, 5, 2, 5, 5, 5, 5, 5]","[27, 13, 8, 14, 14, 6, 8, 1]","['\n  All in all this is a good desk. Look modern and sleek. Only took a bit over 15 minutes to assemble, and instructions were easy to follow, very satisfied with the purchase.\n', '\n  I’ve been meaning to set up my home office for awhile and really needed a corner desk. There were allot of options but didn’t know that these tables can get so expensive. I decided on taking a chance on this one after searching for some time.For the price, I’d say it was a little on the expensive side for what it is but having been able to use it for 2 weeks, I can say with some relief it was well with worth it.The materials all came packed separately but thank goodness the instructions are really easy and straight forward. It caught me off guard because it seemed so easy that I thought I overpaid for cheap quality. But it was the complete opposite.Pros: the table is well sized for a large monitor (32”) in the center and still plenty of space for a 13” MacBook Air on my right side and doing other tasks on my left. Although, from the photos the table looked to be a little bigger, I’m glad it’s the size that it is; anything bigger would have seemed to clunky. It’s the perfect size for something modern and saves space. The table is also very sturdy too. I hate it when cheap tables shake easily or feels very weak. While it looked cheap when I initially unboxed the materials, after putting it together I realized it was made to hold together very strong. I’ve been very happy with itCons: for the price I had hoped the quality came from higher grade materials. The color options could have been better. I prefer gray or something out of the Apple store but it’s growing on me.If you’re saving money but need a study corner desk, this one is a sure winner. Don’t have to break the bank on this on and it has plenty of space to get your work done.\n', '\n  The desk has a nice look and is very functional, but!!First, the build quality of the frame pieces is quite poor.  Several pieces need to be adjusted with a grinder to fit properly.  One piece was off by over 1/4"" and would have left gaps in the desk surface.  Another would piece would not lineup, any of the four holes, without considerable grinding.  It was off square by several degrees.  Even then the welded parts with the threads were not square.  I had go adjust screw holes to get the piece together.The top pieced of the desk are not very heavy.  It is too flimsy with far more flex that I would like in a desk.  It\'s just not a quality piece.  The top of the desk needs added supports to be sturdy.It\'s a nice design, just not good quality.  I would not buy again.\n', '\n  The desk dimensions are (51.2""+51.2"")L*19.7""D, 29.5""H, double desktop. There are 4 small cylindrical woods for connecting 3 pieces desktop, do not forget them before they were joint together. And the round metal for the bottom was set up at the last, otherwise, it may not be easily seamless to make the 3 piece together. It’s useful one!\n', '\n  This is a great desk, especially for the price.Assembly -the instructions recommend you assemble with someone for efficiency, but I was able to assemble the desk by myself in about 30 minutes. The instructions are easy to read.Sturdiness - this is a strong deskThe desk is able to hold my 24 inch monitor, laptop, and tablet. My desk still feels big despite having all these items on it.I would say you get good value for the price of the desk.\n', '\n  Big fan of the desk and the overall design.- Build of the desk is solid, materials do not feel cheap- Design is stylish and modern with plenty of space (2 monitors, keyboard, mouse, fan, printer, knick knacks with room for a workspace still)- Plenty of space underneath for placing your feet/PC. (I would recommend a small stand to keep your PC off the ground)- All the tools to put it together were provided and even had a few extra screws.- Nice to have the option of which side you want to put the shelf on (easily exchangeable too)Nitpick- While the desk boards feel sturdy I wish they were a little thicker.Overall a solid product and a professional presentation.  Cubiker is a company I will look for when ordering my next desk.\n', '\n  The desk fits perfect for my children to do their homework and at the same time use it as a gaming desk.Easily assembled, no missing pieces. My 10 year old son was able to put it together all by himself following the instruction manual.\n', ""\n  My teenage sister received this as a gift for Christmas and it fits perfectly in her room, with her decor and all. She's extremely happy with it. She was able to put this together by herself (we offered to help, but teens, man), so I assume it wasn't difficult. Be warned that the box it HEAVY, so you'll need help to lift it. It didn't come delivered in any sort of hidden packaging either. Just the box the desk is in, so if you're worried about porch pirates or someone seeing what it is, you might wanna plan to hang around the day it's supposed to be delivered.\n""]"
