,Title,Rating,Helpful,Text
3,"['SHW L-Shape Corner Desk Computer Gaming Desk Table, Black', 'SHW L-Shape Corner Desk Computer Gaming Desk Table, Black', 'SHW L-Shape Corner Desk Computer Gaming Desk Table, Black', 'SHW L-Shape Corner Desk Computer Gaming Desk Table, Black', 'SHW L-Shape Corner Desk Computer Gaming Desk Table, Black', 'SHW L-Shape Corner Desk Computer Gaming Desk Table, Black', 'SHW L-Shape Corner Desk Computer Gaming Desk Table, Black']","[4, 4, 5, 5, 5, 5, 5]","[390, 63, 32, 19, 43, 9, 13]","['\n  This desk arrived on time and was relatively easy to assemble.  I have it set up in the corner of my spare bedroom, and it fits the area nicely.  I was able to place my computer on the middle section of the desk, which works beautifully for my needs.  This desk does not have a slide-out keyboard tray, which I don’t mind. You won’t miss the slide-out keyboard tray at all if you’re using this desk with a laptop, anyway. I am using it with a desktop, but I prefer to have the keyboard up higher anyway, so that my wrists aren’t bent at awkward angles.There was a warning label on the middle section of the desk which states that the device isn’t meant to hold more than 25 pounds. I am not sure if the sticker meant just the middle section of the desk, or the entire thing, but my most reasonable guess would be the entire thing. The 25 pound limitation is of no consequence to me; the desk holds my computer monitor, a desk organizer with many pens, etc., file dividers, and a laminator, and some other miscellaneous office supplies, just fine. It can be slightly shaky if I accidently roll into the side of the desk with my office chair, if I type too vigorously, there can be slight vibration. The desk isn’t solid oak, it’s a metal frame with a tempered glass top.I don’t think that I would place a printer on this desk, however, unless you can be certain that it won’t exceed the weight limitations.One thing I noted is that there are no suction cups to secure the tempered glass in the middle section of the desk.  Both of the sides have the suction cups to secure the tempered glass, but for whatever reason, the corner middle section does not. The glass does fit somewhat securely; however, when we tilted the desk on its side to move it into its permanent location, the corner section of glass did tumble out of the desk and land on my laminate flooring. I am very relieved that it did not break.I am rather pleased with this desk. Suits my needs fine, quite an upgrade from my old desk. Would recommend to anyone who needs a reasonably priced desk to fit in a relatively small area, for less than 25 pounds of items.Regarding the label on the glass in the center section, I was able to peel the label off relatively easily, from one corner. Some of the label did remain once I peeled the majority of it off, but I just used an alcohol pad to finish breaking down the adhesive and cleaning the gunk off the area.I hope this review was useful to anyone considering this desk. I have included some photos so that you can see the desk in action!Please click ""helpful"" if you found this review to be helpful.\n', '\n  The instructions were very clear which made the desk really easy to assemble. It also fits perfectly in the corner of my bedroom. I read that the weight was 50lbs so I shouldn’t have any problems with dual monitors. I’m only giving it 4 stars because one of the legs had rust on the corner so I’m not sure what happened there. Other than that, I think it’s a nice desk.\n', ""\n  Just got this on the mail today and writing this review based on ease of putting it together as well as the prompt customer service I received.My son and I put this together in about 10-15 minutes. It fits great in his room and looks great. Time will tell how wear and tear work with this.We couldn't find the screw kit that comes with it. After 30 minutes of going through the box multiple times I called the customer service # and was sent to a voicemail. I left a message explaining what was missing and requesting an immediate return call (I was a little pissed). My son went through everything 1 last time and found the screws tapes to some of the packaging. That's when we started putting it together. 10 minutes later they called back and this was after 6pm. The man was very kind and helpful.That man is the reason I'm giving this 5 stars.\n"", '\n  Pros: The price for a solid quality desk. Looks amazing. Very sturdy, no wobble at all. Very easy assembly ""45 minutes"". Only 2 different size screws, so impossible not be able to figure out how to assemble it. Great pictured instructions.Cons: Horrible chemical smell when I opened the box. I think it was from the styrofoam. Once the packaging was thrown out the smell was gone. The two large glass sections bolt down with 4 short screws. 2 screws on one of the glass sections would not thread in far enough to secure the glass to the frame. This gave a little wobble and noise. The fix was easy, I  used a washer between the screw and bracket and it was able to securely tighten, Besides those two things I still give this desk 5 stars.Overall: I am extremely happy with this purchase and would highly recommend the desk. One thing I thought from the pictures is that the black glass was just a dark tint and you would be able to see through it. Well you can\'t, it has a incredible looking black finish. Also my optical mouse does not work due to the finish, so you will need a mouse pad.\n', ""\n  Could not be happier with my new desk.  Light weight, well packaged. I'm older and able to lift it. Assembles easily - seriously if I can assemble it, anyone can. Little narrower than I need since I like to spread out when I work. However, it is well made, sturdy. I have two large dogs that crawl in and out, and it stays in place. Nice to look at. Great price.\n"", '\n  This desk is very nice. It took less than an hour to assemble. The instructions are easy and straight-forward....just pictures, letters for the parts and numbers to follow. Be careful to follow the instructions of making sure NOT to tighten the screws all the way until you have lightly screwed them all in. Once the screws are in place, then tighten them. Also, be careful with the glass tops. They are thin, but they do feel of good quality. I bought the desk for my teenage son’s gaming/streaming and he LOVES it. I love it too. I might get one for myself. The price was good for this desk.\n', ""\n  Sturdy enough that it doesn't collapse when my 27 lb. Maine Coon cat jumps up for a head scratch (and is immediately yelled ***DOWN***).  Roomy enough for all the stuff that somehow accumulates over the course of the day.  Easy to clean of coffee drips, bagel crumbs, and other food detritus.Easy to assemble -- at least according to my wonderful grandson who did the actual work.  In other words, I'm very happy -- and comfortable -- with my 'out-of-the-way' corner desk and will not pester you with any complaints for a few years at least.\n""]"
4,"['FURINNO Econ Multipurpose Home Office Computer Writing Desk, French Oak Grey', 'FURINNO Econ Multipurpose Home Office Computer Writing Desk, French Oak Grey', 'FURINNO Econ Multipurpose Home Office Computer Writing Desk, French Oak Grey', 'FURINNO Econ Multipurpose Home Office Computer Writing Desk, French Oak Grey', 'FURINNO Econ Multipurpose Home Office Computer Writing Desk, French Oak Grey', 'FURINNO Econ Multipurpose Home Office Computer Writing Desk, French Oak Grey', 'FURINNO Econ Multipurpose Home Office Computer Writing Desk, French Oak Grey', 'FURINNO Econ Multipurpose Home Office Computer Writing Desk, French Oak Grey', 'FURINNO Econ Multipurpose Home Office Computer Writing Desk, French Oak Grey']","[1, 5, 5, 5, 2, 5, 4, 2, 1]","[197, 675, 146, 117, 15, 27, 4, 2, 6]","['\n  This is a long one. I\'ve been sitting on this rage for a bit so hold onto your butts. First I\'ll extend an olive branch: the desk fits well into anyone\'s budget. At the time (like, 2 weeks ago) I got it for $40. Not bad. It\'s a desk. It does desk things. That\'s about all the good I have to say here.But speaking of the price, I bought it for $40 and as soon as I started assembling this god damn thing I knew I got gypped. The instructions were clear enough. Allegedly the desk should be assembled in roughly 30 minutes if you have someone helping you. My roommates were out so I tackled the project myself, figuring that at most it would take an hour. 4 hours later, I\'m still working on it. Why? Because there were supposed to be holes for all the screws and pegs that were drilled into the wood already, according to the instructions, but I guess the guy who was supposed to do that got drunk on the job because there\'s no holes. I don\'t have tools either. I have one Gerber multi tool and I had to painstakingly ""drill"" my own holes with a broken knife, a now-worn down screwdriver head, and a series of other tool-heads that are now similarly worn. Before you say, ""What\'s the problem, don\'t Gerbers have a lifetime warranty?"" Yeah, it\'s only good for the one replacement. This was it. I paid $80 for the Gerber and $40 for the desk, but now that half the tools in my Gerber are useless, technically I\'m out $120. If the manufacturer is reading this, I accept reimbursement through the Cash App.Speaking of price, as I clicked on this product to file my initial complaint, I found more reasons to get pissed off. The price on this piece of excrement actually JUMPED by $15 in the literally 2 weeks since I bought this. How is the demand rising at all? I feel like it should be plummeting faster than our president\'s approval ratings. I wouldn\'t even buy this again if the price dropped $15. I wouldn\'t even take it for FREE if I knew what I was getting into.Now the sturdiness. It\'s okay. Not great, not terrible, but I\'m a little concerned at how much this thing wiggles just from me lightly typing away on my laptop. The directions say the desk is prorated to hold 15 pounds across the main part of it, but the directions also said the holes were supposed to be pre-drilled so I don\'t know about that. The good news is that if I\'m unlucky enough to fart on this thing and it collapses, the manufacturer owes me a new computer.That\'s right, this desk is so awful that I\'m praying that it breaks for a payout. Maybe I\'ll tack on extra charges for emotional pain and suffering. I could be paying my bills right now. I could be writing that novel I promised I\'d start on once I get a new desk. But instead I\'m putting off my entire life to warn the people of Amazon to not buy this desk.""But Nick! It\'s cheap, you knew what you were getting into!"" Maybe, but it really says something about this economy that I can\'t even save money or else I just end up wasting it. What sick person would charge someone $40 (and then $55.11 before tax and shipping) and then blame them for not throwing down an extra $500 when it blows up in their face? That\'s not how you compete with other businesses. I\'m an English major and I have no skills but I could make a better desk out of cardboard and pubic hairs.Oh and one last thing: the pull out drawer or whatever it\'s called, the thing you put your keyboard on? Flimsier than a tightrope walker with Parkinson\'s. I look at it funny and it just falls off. There\'s nothing holding it together. I\'m not sure if I should add more holes so I can screw it on, but god forbid I finish the manufacturer\'s job.Anyway, my point is don\'t buy this desk. 2/10; I\'m burning this when I find something better.\n', ""\n  I read a lot of negative reviews on this desk about it being flimsy and things breaking, first thing about this is they are probably comparing it to a $500 desk this desk costs under $50 your not going to get a top of the line model for that.  This being said it's a very well made desk for the money very sturdy I was actually impressed how sturdy it was I was planning on reinforcing it once I got it but after setting it up realized I didn't need to.  I keep all my school books and my iMac on it without any issues.  This desk is definitely worth the money.\n"", '\n  So i was back and forth on this purchase but im very happy i made it. It took me about 30 minutes to assemble with relative ease. The instructions are fairly simple to follow but the piece letters can be a little difficult to read. for under 60 dollars its definitely worth the money. You might want to reinforce some areas with some extra tacking nails but other than that this desk is solid. i put a 23"" AIO on the low side and a 24"" smart tv for a second monitor on the the high shelf no problems. i highly recommend this item for small spaces and a small budget.\n', ""\n  For $25 this desk is AWESOME! I honestly don't understand the highly negative reviews. Maybe Furinno made some changes but mine came well packaged with all the hardware bits sealed up in a baggie. Nothing was damaged and all the pieces were labeled.Assembly takes some time but is not difficult to figure out if you have a bit of patience- I used the manual and the amazon video together and had no problem.Once assembled this desk is MUCH sturdier than I expected. Everything is stuck tightly together and seems strong enough to hold a printer/monitor/whatever you like. The only area I had some trouble with was the keyboard tray but I decided not to use it anyway.Overall if you're looking for a place to sit on your computer or to get some work done without taking up a ton of room this is your desk. I did a lot of research before choosing this and i'm glad I did.\n"", ""\n  Its sturdy and worth the money however This is nothing like the colour on the photo so if your buying it like I did toMatch your room furnishings then this is nothing like grey it's a brown oak colour nothing like grey\n"", ""\n  This desk is awesome.It took me a little while to put it together by myself but only because of the amount of pieces and the complexity. I found the instructions to be excellent, so relax!The boards and hardware were well defined, with stickers and not markers as other people have experienced in the past.The design is great, as I'm able to put my printer, books and even my bag nearby. The little cloth drawer is better than I thought. Beside the file cabinet they make a perfect pair.Pros:-Great design and size for my small place.-Reasonably easy to put together, with clear instructions.-Excellent price and value for the money.-Handsome piece! Looks clean and tidy.Cons:-The packaging was poor and flimsy. It's a miracle it came undamaged, especially because Canada Post left it out in the rain and no notification of its arrival :(-The keyboard tray could have been a couple of inches deeper.-It's sturdy enough for my needs. But as I said its good value for the money.All in all I am super happy with this desk. I'd buy it again.\n"", ""\n  Needed to get a smaller desk after moving, but didn't want to spend too much, and after a lot of trawling across the 'net,  this seemed to fit the bill.Seems OK after nearly 2 months, but still getting used to not having anywhere near the space I had with my old one.Would be handy if the shelf on the right hand side was adjustable, as I prefer my PC Base unit on the floor rather than up on the shelf as it has to be in this case.I measured everything carefully to ensure that everything I needed to fit on the desk would fit, and as you can see it does.The material appears to be MDF with a black indeterminate covering, but the covering is VERY thin so will become easily damaged - mine has a couple of scratches already.Each part of the desk is around 12mm thick, so NOT for heavy duty use. I would say ideal for a kid's bedroom (apart from the fact it damages easily) or a small room / office where space is at a premium, but if you have the space, there are better desks out there.**NOTE** The hutch my monitor is standing on in the pic was bought separately and wasn't part of this desk.\n"", ""\n  As the review states, the design of of this desk is excellent. The size is reasonably small, it has multiple layers, it has a place to put your keyboard and mouse under the desk, it has a compartment to put things in. It's pretty great.The concern is the quality of the wood itself, and the paint coming away from the wood so early into its life. There are several areas which have seen quite minor use which have paint pulling away from the wood. Although at this point in its life it is mostly just an aesthetic problem, I am fairly certain that in the not so distant future I am going to need to repaint the wood and possibly varnish it.I would also like to clarify that although it just looks like a surface, cleaning it only adds more white dots, and upon further inspection it is quite self-evident that this is whatever is underneath the paint coming through the top layer of paint.Tl:Dr - This is a well designed but cheap item, the actual quality of the item itself is very poor, however the design is excellent. I'd also add that it was easy to put together alone, although a little time consuming.\n"", ""\n  This was perfect for my sons needs to organise all of his gaming equipment. Don't bother! Instead spend an hour assembling it, feel chuffed with yourself and then for the finishing touches..peel off all the stickers. Only did 2 (and gently) as they also peeled the wood effect off to reveal the cheap ply beneath. Ruined.  Another hour to disassemble and pack up and now need to find the time to take it to the Post Office (it's a 2 person carry). Still they will refund up to £4.75 postage..will probably cost me £15 due to the weight! Son bought it out of his birthday money and is gutted.\n""]"
5,"['MOTPK L Shaped Gaming Desk 51"" L Shaped Desk, Computer Corner Desk, Gaming Desk Table with Large Monitor Riser Stand for Home Office, Sturdy Writing Workstation, Gaming Desk with Shelf, Black', 'MOTPK L Shaped Gaming Desk 51"" L Shaped Desk, Computer Corner Desk, Gaming Desk Table with Large Monitor Riser Stand for Home Office, Sturdy Writing Workstation, Gaming Desk with Shelf, Black', 'MOTPK L Shaped Gaming Desk 51"" L Shaped Desk, Computer Corner Desk, Gaming Desk Table with Large Monitor Riser Stand for Home Office, Sturdy Writing Workstation, Gaming Desk with Shelf, Black', 'MOTPK L Shaped Gaming Desk 51"" L Shaped Desk, Computer Corner Desk, Gaming Desk Table with Large Monitor Riser Stand for Home Office, Sturdy Writing Workstation, Gaming Desk with Shelf, Black', 'MOTPK L Shaped Gaming Desk 51"" L Shaped Desk, Computer Corner Desk, Gaming Desk Table with Large Monitor Riser Stand for Home Office, Sturdy Writing Workstation, Gaming Desk with Shelf, Black', 'MOTPK L Shaped Gaming Desk 51"" L Shaped Desk, Computer Corner Desk, Gaming Desk Table with Large Monitor Riser Stand for Home Office, Sturdy Writing Workstation, Gaming Desk with Shelf, Black', 'MOTPK L Shaped Gaming Desk 51"" L Shaped Desk, Computer Corner Desk, Gaming Desk Table with Large Monitor Riser Stand for Home Office, Sturdy Writing Workstation, Gaming Desk with Shelf, Black', 'MOTPK L Shaped Gaming Desk 51"" L Shaped Desk, Computer Corner Desk, Gaming Desk Table with Large Monitor Riser Stand for Home Office, Sturdy Writing Workstation, Gaming Desk with Shelf, Black']","[4, 5, 4, 3, 4, 4, 5, 3]","[7, 10, 8, 7, 3, 3, 2, 1]","[""\n  \xa0This is an excellent desk if you're a gamer, for work or even schooling. The L shaped design is great for small rooms; when you place it in the corner, it leaves you with a more open room layout but gives you a ton of working space. I can set up my computer on one side, then have the whole other side to work on projects.I was able to build this desk by myself. I would recommend reading the instructions over first, then start building. The instructions lay out the part placements, and it is very import to make sure you have them in the right spot before installing the bolts. Read twice, bolt in once! I did not do this, and had to undue and redo the panels. The Materials of the desk are very light weight; I had no problem flipping the desk over on my own. Even though the desk is light weight, it was very sturdy and lay nice and stable on the floor, no wobbling. You have side support panels and center supports, but they do not take up leg room. You Have plenty of space, even if you wanted to do two chairs.This is a very functional desk, at a very reasonable price. It keeps my office space open, while optimizing my work area as much as possible. The top of the desk is made of a nice smooth material. You also get a bonus of an additional shelf you can add onto the top of the desk. The design allows you to place this on either side, which ever you prefer. This addition is high enough up, that you still get the full use of the desk, and then added space at the top. I use a Laptop and monitor, and this is perfect to place the monitor above and my laptop below, and I can easily view both screens. I did have a bit of trouble lining out the bolts, since you put this piece on when it is upright. Make sure you don't over tighten your screws though, I stripped one, but luckily there was an extra included!\n"", '\n  Really impressed on how sturdy the desk feels, originally I had low expectations for this desk because of the price but turned into a great buy and well packaged, nothing came with any damage\n', ""\n  So this desk is exactly what i wanted and expected. Just got it today and got it put together in about an hour, easy to read and assemble. My only 2 complaints....The 2 accessories(headphone mount and cup holder) only fit a single side, if they were universal to fit either side it would be a bit more convenient. I also had a tiny chip on the shelf attachment. All in all I'm very pleased with my purchase and would recommend.\n"", '\n  I’d like to give it more of a review. However, the top piece came scratched really really bad. Super frustrating for what I paid & see no place to contact the company.\n', '\n  I did not expect much but I’m pretty happy with this desk considering the price was so low. Putting it together was pretty simple took about 30 minutes and came with extra screw and the tools to put it together. The cup holder and headphone holder are only able to be placed on a specific side of the desk so, it’s kind of inconvenient but other then that I’m very happy with it. The red you see on the legs is just a sticker and will probably not last long.\n', '\n  This is a very good gaming desk some of the painting was a little scratch but my son loves it he is all the time playing after school great overall\n', '\n  This desk is amazing, it’s nice and sleek and able to hold all of my things. I recommend this desk.\n', '\n  Nice desk but arrived scratched.\n']"
