,Title,Rating,Helpful,Text
4,"['HDMI 2.1 Cable 8K@60Hz 6FT,QGeeM 48Gbps Ultra High Speed HDMI Cord,Compatible with Apple TV,Roku,Samsung QLED,Sony LG,Nintendo Switch,Playstation,PS5,PS4,Xbox One Series X,HDMI 8k Ultra HD Cable', 'HDMI 2.1 Cable 8K@60Hz 6FT,QGeeM 48Gbps Ultra High Speed HDMI Cord,Compatible with Apple TV,Roku,Samsung QLED,Sony LG,Nintendo Switch,Playstation,PS5,PS4,Xbox One Series X,HDMI 8k Ultra HD Cable', 'HDMI 2.1 Cable 8K@60Hz 6FT,QGeeM 48Gbps Ultra High Speed HDMI Cord,Compatible with Apple TV,Roku,Samsung QLED,Sony LG,Nintendo Switch,Playstation,PS5,PS4,Xbox One Series X,HDMI 8k Ultra HD Cable', 'HDMI 2.1 Cable 8K@60Hz 6FT,QGeeM 48Gbps Ultra High Speed HDMI Cord,Compatible with Apple TV,Roku,Samsung QLED,Sony LG,Nintendo Switch,Playstation,PS5,PS4,Xbox One Series X,HDMI 8k Ultra HD Cable', 'HDMI 2.1 Cable 8K@60Hz 6FT,QGeeM 48Gbps Ultra High Speed HDMI Cord,Compatible with Apple TV,Roku,Samsung QLED,Sony LG,Nintendo Switch,Playstation,PS5,PS4,Xbox One Series X,HDMI 8k Ultra HD Cable', 'HDMI 2.1 Cable 8K@60Hz 6FT,QGeeM 48Gbps Ultra High Speed HDMI Cord,Compatible with Apple TV,Roku,Samsung QLED,Sony LG,Nintendo Switch,Playstation,PS5,PS4,Xbox One Series X,HDMI 8k Ultra HD Cable', 'HDMI 2.1 Cable 8K@60Hz 6FT,QGeeM 48Gbps Ultra High Speed HDMI Cord,Compatible with Apple TV,Roku,Samsung QLED,Sony LG,Nintendo Switch,Playstation,PS5,PS4,Xbox One Series X,HDMI 8k Ultra HD Cable', 'HDMI 2.1 Cable 8K@60Hz 6FT,QGeeM 48Gbps Ultra High Speed HDMI Cord,Compatible with Apple TV,Roku,Samsung QLED,Sony LG,Nintendo Switch,Playstation,PS5,PS4,Xbox One Series X,HDMI 8k Ultra HD Cable']","[5, 5, 5, 5, 5, 5, 5, 5]","[7, 9, 3, 2, 0, 1, 2, 0]","[""\n  I recently got a new Dolby Atmos 4K HRD TV and a 4K Apple TV. I was disappointed when my old HDMI cables wouldn't allow a stable setting past of 4K HDR10 at 30 FPS. I was disappointed since i had spring for a 120hz TV and wanted a smoother picture. I also didn't to buy a new set of cable that would have to just get replaced with the next upgrade. Switching to a HDMI 2.1 cable was a no brainer. Once i replaced the HDMI cable between the 4K Apple TV to the receiver and from the receiver to the TV with these HDMI 2.1 cables. Dolby Atmos 4k HDR at 4k 60 PFS immediately worked and has been flawless. They were also the best value on Amazon, had great packaging, protectors on the HDMI connector and came with telco cable ties. Highly recommended.\n"", ""\n  I got this for my upcoming Xbox series x to connect to my LGCX OLED TV. I'm testing on my Xbox one X that currently has HDMI2.1 output as well and on movies and games that support it the difference is stunning on my OLED compared to a 2.0. This is a well-built cable and is doing the data transfers I had hoped for.\n"", ""\n  Just added two of these HDMI cables for my new Hisense 4K H9G and Sony UHD 4K Blue Ray Player. Beautiful picture. These are rated for 8k TV's so I can't comment on that type signal.  The cable is not thick, but in the old days of HDMI cables that was more marketing hype than anything. I have no doubt these are properly shielded and are very flexible for coming out behind you Entertainment Center from your Cable Box to TV.  Can't beat the price.\n"", ""\n  I really enjoyed the simplicity of the packaging. There were no gimmicks or complications when opening the package. An HDMI cable is pretty straightforward; all you have to do is, in my case, connect the Apple TV box to the HDMI port on the TV through this HDMI cable and you get awesome imagine quality on the tv! I really enjoyed this item! It works just like expected! There wasn't anything damaged or mishandled when inspecting the item. There's nothing much to say about the details like displaying 8k or 120fps as I don't have an 8k tv nor am I using this cable to play video games so I can't tell you if they work for that. I'd suggest to get this cable just to future proof yourself for the next 10 years. Thanks for reading!\n"", ""\n  I was getting message on my DirecTV television that my TV no longer supported HDMI input that I had to change to component cables. After talking to a person at DirecTV I found out that the FCC was putting a stop to all 1.4 HDMI cables because of pirating. So I ordered this cable which is in the picture from this company and it was delivered very quickly. I installed it on my TV today, it's a 2.1 and it's unbelievable, the picture is even better than my previous 1.4 cable. The cable is exactly what the distributor said it would be and thanks to Amazon's great service it was here in 12 hours and I am now back using my large screen TV again. Great cable and great service and I would recommend this to anybody who wants to upgrade their 1.4 cable\n"", '\n  I have always thought hdmi cords especially expensive ones were a gimmick so I never bought anything fancy but my old cord went to crap on me so I needed a new one (obviously) so looked through a handful and than I found this one with a lot of great reviews and relatively cheap so I wasn’t expecting much, well I was surprised when i plugged it in an turned on the tv an PS4!!!!!! What a difference like night and day and I didn’t have to spend 100 bucks to achieve it either definitely recommend and I will be buying more for every tv in the house.\n', '\n  I bought two of these cables. I needed a 2.1 HDMI cable for my Apple TV 4K. I was using a normal high speed probably a 2.0, I have my settings on Dolby Vision 4K 60Hz, and the signal would cut out intermittently. Once I switch out the old cable with this one, the problem was solved. Shipping was fast for me too.\n', '\n  It’s hard for me to describe or assign value to something of this nature. There are no issues with the sound or picture quality. It does exactly what it’s supposed to do. It’s not so much that it stands out, but that it doesn’t stand out in any negative way. I’m confident that you will hear and see exactly what you are supposed to see and hear. Now as far as the price goes,; you could pay much more for a very fine HDMI cord. You won’t hear a difference. Maybe there is someone out there that can hear the minutiae of sounds the rest of us can’t, I don’t know. Free up the money you would over pay on an HDMI cord, and purchase one of these and use the extra money in Vinyl, or separate pre-amps or even upgraded speakers. You just don’t need to spend it here.\n']"
5,"['High-Speed HDMI Cable(3 Pack)-6ft with Gold Plated Connectors, Bonus Right Angle Adapter and Cable Tie, Support Ethernet, 3D,1080P', 'High-Speed HDMI Cable(3 Pack)-6ft with Gold Plated Connectors, Bonus Right Angle Adapter and Cable Tie, Support Ethernet, 3D,1080P', 'High-Speed HDMI Cable(3 Pack)-6ft with Gold Plated Connectors, Bonus Right Angle Adapter and Cable Tie, Support Ethernet, 3D,1080P', 'High-Speed HDMI Cable(3 Pack)-6ft with Gold Plated Connectors, Bonus Right Angle Adapter and Cable Tie, Support Ethernet, 3D,1080P', 'High-Speed HDMI Cable(3 Pack)-6ft with Gold Plated Connectors, Bonus Right Angle Adapter and Cable Tie, Support Ethernet, 3D,1080P', 'High-Speed HDMI Cable(3 Pack)-6ft with Gold Plated Connectors, Bonus Right Angle Adapter and Cable Tie, Support Ethernet, 3D,1080P', 'High-Speed HDMI Cable(3 Pack)-6ft with Gold Plated Connectors, Bonus Right Angle Adapter and Cable Tie, Support Ethernet, 3D,1080P', 'High-Speed HDMI Cable(3 Pack)-6ft with Gold Plated Connectors, Bonus Right Angle Adapter and Cable Tie, Support Ethernet, 3D,1080P', 'High-Speed HDMI Cable(3 Pack)-6ft with Gold Plated Connectors, Bonus Right Angle Adapter and Cable Tie, Support Ethernet, 3D,1080P', 'High-Speed HDMI Cable(3 Pack)-6ft with Gold Plated Connectors, Bonus Right Angle Adapter and Cable Tie, Support Ethernet, 3D,1080P', 'High-Speed HDMI Cable(3 Pack)-6ft with Gold Plated Connectors, Bonus Right Angle Adapter and Cable Tie, Support Ethernet, 3D,1080P', 'High-Speed HDMI Cable(3 Pack)-6ft with Gold Plated Connectors, Bonus Right Angle Adapter and Cable Tie, Support Ethernet, 3D,1080P', 'High-Speed HDMI Cable(3 Pack)-6ft with Gold Plated Connectors, Bonus Right Angle Adapter and Cable Tie, Support Ethernet, 3D,1080P']","[5, 2, 5, 5, 5, 5, 4, 1, 5, 1, 5, 4, 1]","[56, 32, 39, 44, 41, 38, 18, 20, 2, 1, 0, 2, 2]","[""\n  The cables do what HDMI cables are supposed to do, so no problem there.  But the angle connector adapter...is kind of useless.  It's upside down for every HDMI port on every device I've tried it on (TV, monitor, laptop, streaming box, DVD player) so it's unusable.  But the adapter was just a freebie, not a factor for the purchase decision - the price and the color marked cables were the deciding factors.  And those are completely acceptable.\n"", ""\n  Update: I bought these less than 2 years ago, and one by one I have thrown them out when dropouts occurred with a variety of different equipment.  I suspect these cables are just not up to spec.  They are so much thinner than other hdmi cables.  This has happened only a couple of times with a dozen or so different hdmi cables I have owned over many years so these are significantly worse than average.  I now buy bluerigger and have not had issues.Original review:I had occasional moments when the image would go to digital static then disappear, when I used one of these 6 foot cables to connect my Macbook Pro to an LG OLED 4k TV.  It worked most of the time, but the dropouts would happen after about 10-20 minutes on average.  I switched to another much thicker HDMI cable from another brand, and have not had the dropouts.I suspect that the small diameter of these cables is a sign that they aren't quite up to spec for high bandwidth 4k connections.  However I have had no problem using these cables for connecting my 4k Roku or 4k disc player, so most people probably won't run into the issue I did.\n"", ""\n  Well firstly they came extremely fast, and was packaged really well. The leads look great and the extras you get with them are such a bonus. The connectors are tight to my tv and box and I must say the picture in HD is awesome. However the leads are slightly thinner than the last one but dosnt mean it's lesser quality. I dont know how long they will last so I gave durability a 4, but for the price and what you get for that price why would anyone pay double for 1 lead let alone 3....great buy and would recommend and would use this seller again with out a doubt.\n"", ""\n  I am reluctant to give 5 star reviews too often, because usually something can be improved but these are hdmi cables so there is a level of expectation that comes with the purchase.First, these do work with 4k, so more or less there isn't anything you are likely to do these cables wouldn't be appropriate for.  Their price is very competitive while still being more or less the best you can hope for in terms of quality.  Will the cables break with wear and tear?  Most definitely but I have never heard of or seen a cable that didn't, so if the cables are all going to wear out then the thing you're looking for is reasonable quality at a reasonable price.  I would argue these cables more than accomplish that goal and even come with some extras that could help retain longevity of the cables.So for what they are and what you can expect I feel confident I can call these five star HDMI cables.\n"", '\n  The different colors made it perfect for following what system was what when connecting to the TV. My wife thinks it awesome so she can now check on the connections her self without my help...lol.\n', '\n  I found there is a difference between the old HDMI cables and the new HDMI cables. When I set up my new Yamaha TSR 7810 AV receiver with a new 2018 model Samsung LED TV the old cables that I had would not work the ARC feature. I replace the old cables with these cables it works perfectly. And there is a notable improvement in the sound quality. The cables are also thinner which helps in taming the rat nest of wires in the system. The color coding is fantastic.\n', ""\n  I thought all HDMI cables were essentially the same, but I just had a new Samsung 4K HD TV mounted the wall, and the TV installers said I should have bought 4K cables. Higher bandwidth = better quality image. Most broadcasting isn't in 4K yet, but why buy older technology? These cables are 1080p, which will work just fine, for now. I tried to return these, but Amazon wanted to charge me almost as much for return shipping as these cost to buy in the first place. If you don't have a new TV, these are a great buy.\n"", '\n  2 of the 3 cables had the metal HDMI connectors ripped off the cabling. This is a lack of quality control and/or just a garbage product. I needed these cables delivered this week for an event I am organizing. Guess I have to go to an actual store to buy what I need.\n', '\n  This cable package is a great value.The three different colour coded cables makes it easy to confirm what’s hooked to what.The right angle connector is a must when connection clearance is limited.The Velcro cable straps help keep cables tidy.The 6’ cable length is just right for most of my connections and they are not too thick which makes them easier to manage.They work well at 1080 60p.Very happy. I’ll order some more soon.\n', ""\n  Ne résiste même pas a ma télé HD ni mon lecteur Blu-ray, me fait perdre le signal de son et image a plusieurs reprise, J'ai investigué plusieurs jours avec mon distributeur (câble fibre), puis avec mes appareils, pour découvert que c'étais les câble HDMI de mauvaise Qualité.  En plus je ne peu les retournée pour remboursement. A vous d'en tirer les conclusions\n"", ""\n  Where I work, we have new PC's that have 2 outputs, one being a Display Port and the other an HDMI port, recently we HAD been using a DELL HDMI to VGA dongle, but these FAIL quickly and clients are left to deal with One Monitor the other is Blank and NO WAY to escape.... THESE cables at a FRACTION of the cost solves the HDMI output to HDMI input, I have only replaced 9 but already I can REST knowing that this WAS the Proper solution, they are rugged and do the JOB well. Soon as the other DONGLES fail, I will be ordering another 9, 18, or 27...it's a LARGE organization! The price is RIGHT.\n"", ""\n  I bought these to wire up my 4k blu ray player and receiver, as I wanted something colour-coded and budget friendly.The cords are thinner than I was expecting (about the same as a keyboard/usb cable), but understandable given the good price.They do support my 4k Sony X800, although I do notice a rare graphical glitch sometimes. It's not something I'm concerned about, but be aware that you may want to find higher quality and fully 4k compliant cables if that's your sole use. I have zero issue with 1080p connections.\n"", '\n  These hdmi cables are not good, signal very poor, what we used to call snowey in the old days when we had an antenna.Tiny white dots flashing all over. The cables are quite thin compared to most hdmi cables, red flag? ""Not eligible for return"", stuck with 3 useless cables.  Very disappointed.\n']"
6,"['4K HDMI Cable 6.6 ft, iVANKY High Speed 18Gbps HDMI 2.0 Cable, 4K HDR, 3D, 2160P, 1080P, Ethernet - Braided HDMI Cord 32AWG, Audio Return(ARC) Compatible UHD TV, Blu-ray, PC, Projector', '4K HDMI Cable 6.6 ft, iVANKY High Speed 18Gbps HDMI 2.0 Cable, 4K HDR, 3D, 2160P, 1080P, Ethernet - Braided HDMI Cord 32AWG, Audio Return(ARC) Compatible UHD TV, Blu-ray, PC, Projector', '4K HDMI Cable 6.6 ft, iVANKY High Speed 18Gbps HDMI 2.0 Cable, 4K HDR, 3D, 2160P, 1080P, Ethernet - Braided HDMI Cord 32AWG, Audio Return(ARC) Compatible UHD TV, Blu-ray, PC, Projector', '4K HDMI Cable 6.6 ft, iVANKY High Speed 18Gbps HDMI 2.0 Cable, 4K HDR, 3D, 2160P, 1080P, Ethernet - Braided HDMI Cord 32AWG, Audio Return(ARC) Compatible UHD TV, Blu-ray, PC, Projector', '4K HDMI Cable 6.6 ft, iVANKY High Speed 18Gbps HDMI 2.0 Cable, 4K HDR, 3D, 2160P, 1080P, Ethernet - Braided HDMI Cord 32AWG, Audio Return(ARC) Compatible UHD TV, Blu-ray, PC, Projector', '4K HDMI Cable 6.6 ft, iVANKY High Speed 18Gbps HDMI 2.0 Cable, 4K HDR, 3D, 2160P, 1080P, Ethernet - Braided HDMI Cord 32AWG, Audio Return(ARC) Compatible UHD TV, Blu-ray, PC, Projector', '4K HDMI Cable 6.6 ft, iVANKY High Speed 18Gbps HDMI 2.0 Cable, 4K HDR, 3D, 2160P, 1080P, Ethernet - Braided HDMI Cord 32AWG, Audio Return(ARC) Compatible UHD TV, Blu-ray, PC, Projector', '4K HDMI Cable 6.6 ft, iVANKY High Speed 18Gbps HDMI 2.0 Cable, 4K HDR, 3D, 2160P, 1080P, Ethernet - Braided HDMI Cord 32AWG, Audio Return(ARC) Compatible UHD TV, Blu-ray, PC, Projector', '4K HDMI Cable 6.6 ft, iVANKY High Speed 18Gbps HDMI 2.0 Cable, 4K HDR, 3D, 2160P, 1080P, Ethernet - Braided HDMI Cord 32AWG, Audio Return(ARC) Compatible UHD TV, Blu-ray, PC, Projector', '4K HDMI Cable 6.6 ft, iVANKY High Speed 18Gbps HDMI 2.0 Cable, 4K HDR, 3D, 2160P, 1080P, Ethernet - Braided HDMI Cord 32AWG, Audio Return(ARC) Compatible UHD TV, Blu-ray, PC, Projector', '4K HDMI Cable 6.6 ft, iVANKY High Speed 18Gbps HDMI 2.0 Cable, 4K HDR, 3D, 2160P, 1080P, Ethernet - Braided HDMI Cord 32AWG, Audio Return(ARC) Compatible UHD TV, Blu-ray, PC, Projector', '4K HDMI Cable 6.6 ft, iVANKY High Speed 18Gbps HDMI 2.0 Cable, 4K HDR, 3D, 2160P, 1080P, Ethernet - Braided HDMI Cord 32AWG, Audio Return(ARC) Compatible UHD TV, Blu-ray, PC, Projector', '4K HDMI Cable 6.6 ft, iVANKY High Speed 18Gbps HDMI 2.0 Cable, 4K HDR, 3D, 2160P, 1080P, Ethernet - Braided HDMI Cord 32AWG, Audio Return(ARC) Compatible UHD TV, Blu-ray, PC, Projector']","[5, 5, 5, 5, 5, 5, 5, 5, 5, 5, 5, 5, 5]","[182, 100, 91, 73, 65, 55, 106, 115, 13, 12, 12, 1, 1]","[""\n  This cable works exactly as advertised and passes everything I can throw at it.I have an Oppo UDP-203, ULTRA HD Blu-ray Disc Player that can up-convert the video signal from 4:2:2 to 4:4:4 in the player and increase the frame rate to 60 FPS and send that directly to my TV and this cable handles it with ease. Usually, UHD Blu-ray Disc Players send the video signal out at 24 FPS at 4:2:2 chroma subsampling and the TV does the rest but I wanted to test the cable and give it the most demanding signal I could. It Passed!As a side note, this cable is thinner than I expected and very pliable which made it easy to handle and get it through the tight spaces in my cabinet which I appreciated. If it's visible in your set-up, it looks good and appears to be very well constructed. Great quality for the price. Bought two, will buy some more!Art\n"", '\n  I bought 2 of the ""High Speed HDMI Cable, 4K HDMI Cable iVanky 6.6 ft HDMI 2.0 Cable 18Gbps, 4K HDR, 3D, 2160P, 1080P, Ethernet - Braided HDMI Cord 30AWG"".  What I use them for is to connect a Samsung 3-D Blu-ray player to a Denon rec./amp and another to go from the Denon rec./amp. to a Samsung UHD TV.  The sound and picture seem to be great.  I\'ve only had this set up a couple of weeks but everything seems to work perfect.  I have no idea how they work with computers or other items.  But this I do know: The company that I bought the Denon rec./amp. wanted to sell me 2 HDMI cables that were over $30.00 each.  I bought both of these from Amazon at $16.00- or less- for both cables.  iVANKY has written me and asked if I\'ve had any problems and has reminded me that their products come with a life time warranty.  That makes me very trusting of this company.  Legally, they\'ve given me in writing that I have a life time warranty.  That\'s putting your money and reputation where your mouth is.  You won\'t see many business\' doing that.\n', ""\n  Works perfect on my PC and PS4. Both get 4k HDR. PC passes 60HZ no problem. I've also got a 7.2 channel 4k receiver that passes through HDR 10 with ARC. These cables do it all. 12 bit Color, 4K, 60HZ, HDR 10, ARC, Ethernet. This is the cable you want if you are looking for every feature. I thought I had a bad TV, turns out it was my old cables that were just not capable enough. Do not believe online articles that claim all HDMI is the same. It is not in this day and age if you want every feature to work with every connected device.\n"", '\n  I\'ve done the research re: the necessity of a 4K HDMI cable vs standard .From Amazon to Netgear to Youtube ..seems everyone has a different opinion.My first discovery was that even all  ethernet cords are Not created equal.Don\'t expect your \'high speed"" internet to cruise on anything lower than a Cat 5 cord ! After upgrading from an HD Samsung bigscreen to an LG 4K HDR,I wanted the best A/V I could get.The iVanky 4k HDMI cables work Great ! I run one through a Sony 4K Bluray player and both audio and video R awesome ! In summary: You don\'t have to break the bank for quality cables !!!\n', ""\n  This is, without a doubt, the nicest HDMI cable that I've had the pleasure of using. It's got a very nice and durable feel to it.The cable itself is wrapped in Nylon, giving it an extra bit of strength. It's one of the most (if not the most) flexible HDMI cables, as well. I've used some that were trying so hard to be durable that they lost most of their flexibility, but this one succeeds in being both durable and flexible. The connectors at the end are high quality, feel good in the hand, and look quite nice, without being overly large. It has flawless image transmission, and though I don't have the means to test the bandwidth, I haven't had any complaints, either.My only downside would be that the grammar on the package could use some proof-reading. But seriously, that's it.\n"", ""\n  Very well packaged product, good old fashioned nylon braided cable, very durable.  Take it straight from the box and plug it in to your devices.  I attached it to my HD tv on one end and the other to my Roku and I didn't miss a beat.  I know because it made by these guys it will last quite some time.\n"", '\n  I had a plain unbranded HDMI cable that I used to extend the HDMI connector to my Oculus headset.  I was having trouble with the cable recently with it sometimes (albeit rarely) cutting out for a split second so I ended up looking for something better.  I came across this cable and decided to pick it up.After receiving it, I noticed it to be pretty stiff with really small connectors.  I quite enjoy this kind of look and am really surprised of how well it seems to be built.  So far, it seems to hold up well to my VR games and outputs sound just as well.Time will tell how long this cable lasts but my initial impressions seem to be that it will hold up quite a while and possibly even as long as until HDMI cables are phased out.\n', '\n  This is the best choice for me. To connect mi laptop to my tv and recibe a 4K quality image and sound and having on my travel backpack is not a problem because the cable is amazing durable. Has braided cable and plated connectors so this is for my just perfect hdmi cable. Ivanky cables again surpasses my expectation\n', '\n  these cables do what they say they will do.  Run Marantz 7012 and lg 73 inch OLED , passes 4k and 18 gig best value for the price. Works great.\n', '\n  good price, fast shipping. Works.\n', '\n  for audio out\n', '\n  Unfortunately, I am returning the cable, for this product has the highest review and that is why I bought it - but I could not get it to work.I am still using my 15-pin cable.I am not in a position to offer a comment on its quality.Suffice it to say that this is a great company, for they accepted the return with no question.  My computer port could have been defective - not their problem - yet there were no questions.I bought a 12V car heater, practically useless, and could not return it.Arrive at your own conclusions.\n', ""\n  I purchased this cable because I'd been having so many problems with video lagging when watching netflix or prime, figured the old cable might be the problem. What a difference this has made, lightning fast! Very pleased.\n""]"
