,Title,Rating,Helpful,Text
0,"['Upgrade 4K@60HZ HDMI Cable 6.6FT,WLEAD 18Gbps High Speed HDMI 2.0 Braided Cord-Supports (4K 60Hz HDR,Video 4K 2160p 1080p HDCP 2.2 ARC-Compatible with Ethernet Monitor PS4/3 UHD TV,Blu-ray,Netflix', 'Upgrade 4K@60HZ HDMI Cable 6.6FT,WLEAD 18Gbps High Speed HDMI 2.0 Braided Cord-Supports (4K 60Hz HDR,Video 4K 2160p 1080p HDCP 2.2 ARC-Compatible with Ethernet Monitor PS4/3 UHD TV,Blu-ray,Netflix', 'Upgrade 4K@60HZ HDMI Cable 6.6FT,WLEAD 18Gbps High Speed HDMI 2.0 Braided Cord-Supports (4K 60Hz HDR,Video 4K 2160p 1080p HDCP 2.2 ARC-Compatible with Ethernet Monitor PS4/3 UHD TV,Blu-ray,Netflix', 'Upgrade 4K@60HZ HDMI Cable 6.6FT,WLEAD 18Gbps High Speed HDMI 2.0 Braided Cord-Supports (4K 60Hz HDR,Video 4K 2160p 1080p HDCP 2.2 ARC-Compatible with Ethernet Monitor PS4/3 UHD TV,Blu-ray,Netflix', 'Upgrade 4K@60HZ HDMI Cable 6.6FT,WLEAD 18Gbps High Speed HDMI 2.0 Braided Cord-Supports (4K 60Hz HDR,Video 4K 2160p 1080p HDCP 2.2 ARC-Compatible with Ethernet Monitor PS4/3 UHD TV,Blu-ray,Netflix', 'Upgrade 4K@60HZ HDMI Cable 6.6FT,WLEAD 18Gbps High Speed HDMI 2.0 Braided Cord-Supports (4K 60Hz HDR,Video 4K 2160p 1080p HDCP 2.2 ARC-Compatible with Ethernet Monitor PS4/3 UHD TV,Blu-ray,Netflix', 'Upgrade 4K@60HZ HDMI Cable 6.6FT,WLEAD 18Gbps High Speed HDMI 2.0 Braided Cord-Supports (4K 60Hz HDR,Video 4K 2160p 1080p HDCP 2.2 ARC-Compatible with Ethernet Monitor PS4/3 UHD TV,Blu-ray,Netflix', 'Upgrade 4K@60HZ HDMI Cable 6.6FT,WLEAD 18Gbps High Speed HDMI 2.0 Braided Cord-Supports (4K 60Hz HDR,Video 4K 2160p 1080p HDCP 2.2 ARC-Compatible with Ethernet Monitor PS4/3 UHD TV,Blu-ray,Netflix']","[5, 5, 5, 5, 5, 5, 4, 5]","[4, 3, 2, 1, 0, 0, 0, 0]","['\n  Needed a high quality, non expensive option for our TV to sound bar and cable box to TV. Bought the 2 pack and they did the job.\n', '\n  I used this HDMI to hook up an Apple adapter to my TV. The length is perfect for what I’m using it for. The cable quality is excellent and the picture quality is fantastic. I’m very pleased with this cable.\n', '\n  Value for money - Its latest HDMI standard cable ( October 2020 ) - I would highly recommend it !\n', '\n  We bought 2 4K TVs and they have great images and sound, they work!!!\n', '\n  Where’s it at? Arrived, I tied my punching bag with it and now I can’t find this HDMI cable or the punching bag.\n', '\n  This is an excellent hdmi cable, well made, great quality, and a fantastic price.\n', '\n  It worked great\n', '\n  Material quality\n']"
1,"['HDMI 2.0 Cable 4K 6.6 ft, iVANKY High Speed 18Gbps HDMI Cable, TV,Supports 4K@60Hz,HDCP 2.2/1.4, 1080p,Ethernet,Dolby Audio,Audio Return Channel，3D Surround,for Gaming Monitor,PS4/PS3,PC', 'HDMI 2.0 Cable 4K 6.6 ft, iVANKY High Speed 18Gbps HDMI Cable, TV,Supports 4K@60Hz,HDCP 2.2/1.4, 1080p,Ethernet,Dolby Audio,Audio Return Channel，3D Surround,for Gaming Monitor,PS4/PS3,PC', 'HDMI 2.0 Cable 4K 6.6 ft, iVANKY High Speed 18Gbps HDMI Cable, TV,Supports 4K@60Hz,HDCP 2.2/1.4, 1080p,Ethernet,Dolby Audio,Audio Return Channel，3D Surround,for Gaming Monitor,PS4/PS3,PC', 'HDMI 2.0 Cable 4K 6.6 ft, iVANKY High Speed 18Gbps HDMI Cable, TV,Supports 4K@60Hz,HDCP 2.2/1.4, 1080p,Ethernet,Dolby Audio,Audio Return Channel，3D Surround,for Gaming Monitor,PS4/PS3,PC', 'HDMI 2.0 Cable 4K 6.6 ft, iVANKY High Speed 18Gbps HDMI Cable, TV,Supports 4K@60Hz,HDCP 2.2/1.4, 1080p,Ethernet,Dolby Audio,Audio Return Channel，3D Surround,for Gaming Monitor,PS4/PS3,PC', 'HDMI 2.0 Cable 4K 6.6 ft, iVANKY High Speed 18Gbps HDMI Cable, TV,Supports 4K@60Hz,HDCP 2.2/1.4, 1080p,Ethernet,Dolby Audio,Audio Return Channel，3D Surround,for Gaming Monitor,PS4/PS3,PC', 'HDMI 2.0 Cable 4K 6.6 ft, iVANKY High Speed 18Gbps HDMI Cable, TV,Supports 4K@60Hz,HDCP 2.2/1.4, 1080p,Ethernet,Dolby Audio,Audio Return Channel，3D Surround,for Gaming Monitor,PS4/PS3,PC', 'HDMI 2.0 Cable 4K 6.6 ft, iVANKY High Speed 18Gbps HDMI Cable, TV,Supports 4K@60Hz,HDCP 2.2/1.4, 1080p,Ethernet,Dolby Audio,Audio Return Channel，3D Surround,for Gaming Monitor,PS4/PS3,PC']","[5, 5, 5, 5, 5, 5, 5, 5]","[1, 0, 0, 0, 0, 0, 0, 1]","[""\n  I have this connecting my 3840 x 2160 (2160p/4K UHD) monitor with 30-bit color and it's been doing the job just fine. Cable is sturdy and stylish and fits in with my setup nicely. Would buy again!\n"", '\n  I used this to connect my Ivanky 7 in 1 Usb-C HUB from my Samsung Phone and Samsung tablet to my Smart TV. It works really good.  I like the speed and quality of the picture.  I was also able to register the cable, it was easy and fast.  The quality seems good as well!\n', '\n  Works great\n', '\n  Ian cable worked\n', '\n  It is as good as it gets.\n', '\n  The cable is excellent quality and easy, compact package.\n', '\n  Easy Registration\n', '\n  I was looking for a good and economical HDMI cable and I found it.  I’m using it with a Blue-Ray player and looks great. In terms on picture quality and data transfer I don’t know what else to say. Both tip ends come protected to avoid damage during shipping. The cable finish is smooth such as electrical tape and it seems of very good quality.  Simply, it does the job well like an HDMI cable should.\n']"
2,"['Amazon Basics High-Speed 4K HDMI Cable - 6 Feet', 'Amazon Basics High-Speed 4K HDMI Cable - 6 Feet', 'Amazon Basics High-Speed 4K HDMI Cable - 6 Feet', 'Amazon Basics High-Speed 4K HDMI Cable - 6 Feet', 'Amazon Basics High-Speed 4K HDMI Cable - 6 Feet', 'Amazon Basics High-Speed 4K HDMI Cable - 6 Feet', 'Amazon Basics High-Speed 4K HDMI Cable - 6 Feet', 'Amazon Basics High-Speed 4K HDMI Cable - 6 Feet', 'Amazon Basics High-Speed 4K HDMI Cable - 6 Feet', 'Amazon Basics High-Speed 4K HDMI Cable - 6 Feet', 'Amazon Basics High-Speed 4K HDMI Cable - 6 Feet', 'Amazon Basics High-Speed 4K HDMI Cable - 6 Feet']","[5, 1, 5, 1, 5, 3, 5, 5, 1, 1, 5, 4]","[613, 511, 1980, 209, 2599, 290, 149, 556, 401, 276, 168, 335]","['\n  I\'m constantly telling people/family to stop buying cables from the box stores as they\'re just too expensive, to stop wasting their money.  As a former sales person of stereo equipment we were always told to ""push new cables on new purchases"", and for good reason.  I think the markup on cables and such might surpass jewelry!!  It\'s just horrible.  So stop buying those overpriced cables and buy them here on Amazon, or at a couple of other online retailers, for much, MUCH less.  They work just as well as the name brand cables, just without the fancy colors, or the fancy labels.  But hey, if you\'ve got one of those unlimited budgets and money is no object, then go ahead and buy that $100+ per foot, 4 gauge speaker cable, or other severely overpriced interconnects.\n', ""\n  2017 SepOriginally I put 5 stars, because it worked fine after installation. However about 6 months, I started to observe issue that the video image blacked out intermittently. I was not able to find the root cause, because the issue was intermittent, but recently I completely lost the image, and I identified that root cause is this HDMI cable. After I replaced the cable with another one, the image was recovered and didn't show any intermittent issue.Because the cable failed in less than 1 year, I changed the ration to 1 star.2016 NovWorking fine without any issue.\n"", '\n  I am going to keep this review short and sweet. I saw many reviews referencing these cables not being able to handle 4K HDR or support 4:4:4 chroma at 60Hz. While I cannot speak for the configurations of other users, I can confirm the following:Using this cable on a Samsung KS8500, I can confirm that this cable supports:UHD 4K HDR Content4K 30Hz 4:4:44K 60Hz 4:4:4I am attaching a picture of the chroma test as well. The bottom two lines are perfectly visible using this cable.\n', '\n  We had bought a new TiVo and a new TV and for the lif of ours we could not pinpoint which one was malfunctioning when the sound would dip during different times of viewing.  Turns out these HDMI cables are the problem!!!! … You have no idea how much time I spent trying to troubleshoot the poor new devices.  For having put through what I have gone thru I would rate these as garbage!!! Grrrrr!!!\n', '\n  Please do not waste your hard earned money on overpriced HDMI cables in the name of picture or sound improvements. I currently am using these AmazonBasics High-Speed HDMI cables to connect our Yamaha v379 AV receiver to other HDMI enabled devices that link back to our 4K Samsung Smart TV and these have performed flawlessly.HDMI cables come in four types: Standard-speed --> Standard-speed with Ethernet --> High-speed --> High-speed with Ethernet. Since High-speed cables are so cheap (e.g these AmazonBasics cables), there really isn\'t any point of getting Standard-speed anymore. On the other hand, as most HDMI devices today can\'t receive Ethernet over HDMI, High-speed HDMI cables are really all you need.** Some numbers **Standard-speed HDMI cables are rated up to 1080i (""i"" stands for interlaced). In order for a HDMI cable to have a ""High-speed"" moniker, it must be capable of showing resolutions up to 4K --> 3840 x 2160 at 30fps (or 4,096 x 2160 at 24fps). And as the highest resolution any 4K TV currently on the market can produce is 3840 x 2160 at 30fps, even if you found a $100 cable at your local BestBuy that claims it can transmit much more than that, it doesn\'t matter as you are limited by your source (i.e your cable box, Xbox, PS4 e.t.c) and your TV\'s hardware capabilities.Also HDMI cables can either produce an image/sound or nothing at all. There is NO in between. Therefore, a HDMI cable will either work or won\'t work (it may show a flashing image but this means it\'s a bad cable). But a more expensive HDMI cable will NOT show darker blacks and sharper colors than a less expensive HDMI cable. You either get 100% of the signal or no signal at all. Now if you intend on running your HDMI cable for more than 50ft, then you might want to invest in a HDMI cable that has ""active"" chips that help maintain the signal quality over a longer distance (but does NOT make the image/sound any better than the source).** What about HDMI 1.4 or 2.0 or HDCP 2.2? **This is another common misconception due to manufacturer marketing. HDMI 1.4, 2.0 and HDCP 2.2 are all hardware changes that do NOT require a cable change! Although there is a difference between them (you can google that yourself), there is no such thing as a HDMI 1.4 or 2.0 or HDCP 2.2 cable! The version numbers refer to the devices that the HDMI cable connects into & NOT the cable itself. The cable simply is a pipeline linking the two. Hence, if you do happen to own a TV and another device that both have HDMI 2.0 ports, any AmazonBasics High-speed rated cable will work perfectly fine with it.** Conclusion **At this price point, there is very little reason to spend more money on more expensive HDMI cables over these AmazonBasics High-speed cables. If you have a 3D, 4K, HDCP 2.2 or HDMI-ARC compatible device, these High-speed cables will work perfectly fine for you.\n', ""\n  Updating my review, I bought this 3 pack and while the first cable worked fine on 4K 60fps signals, the second and third cables has major issues.I had bought these to replace my older AmazonBasics high speed cables (10.2Gbps), however after purchasing a XBOX One X, those cables would not allow the XBOX to work in 4K. I had a similar issue with my Roku Ultra which would not work with the 4K 60fps setting. I decided to try these as they are rated at 18Gbps. While the first cable I tried worked flawlessly (no artifacts, flickering or other issues), the other two did not work as well. I tried Twisted Veins HDMI cables as well and had similar issues. I finally picked up Monoprice cables and haven't had any problems. Most people have good luck with these cables in shorter lengths (6ft or less), however at 10ft or longer I recommend looking for something else if you are using these on a 4K display. The two issues I saw with these cables at 4K 60fps were sparkles or repeating signal loss.\n"", ""\n  Amazing cables at an affordable price. Tested with 4K HDR and Dolby Vision. Works with Apple TV too. I have this HDMI cable going from my Denon AV receiver to my LG OLED TV and all my devices hooked to my AV receiver using this HDMI cable as well. Everything works great. Don't listen to the reviews that said Dolby Vision doesn't work on the Apple TV. They probably didn't set up their AV receiver and TV settings properly. The TV and the AV receiver has a setting that is listed as HDMI Deep Color or HDMI Enhanced that you will need to enable for HDR and Dolby Vision. Also it is prefered to set up the match settings under the video settings for the Apple TV.\n"", '\n  Necesitaba un cable hdmi y no me quería gastar mucho dinero. Fui a varias tiendas como mediamarkt, worten... En todas estaban carisimos, hasta que decidí buscar aquí. Necesitaba un cable para mi ps4 y he de decir que no tenía muchas esperanzas, ya que es un cable relativamente barato, pero he de decir que cumple a la perfección y es un producto totalmente solvente. Los materiales no son lo mejor del mundo, pero es un plástico de alta calidad, a años luz de otros hdmi del chino que he tenido.Si te ha servido esta valoración, me ayudaría mucho que me la marcaseis como útil en el botón de abajo. Muchas gracias.\n', '\n  Acquistato a febbraio 2018 è vissuto dignitosamente fino a luglio 2018. Morto in giovane età. Eseguita degna sepoltura come si sovviene.\n', '\n  安さと、Amazonブランドということで購入トータルで20〜30本ほど使用。1年半で6割故障しました。仕事柄、10台ほどのTVとDVDプレーヤーなどをつないでいますが、１，段々と接触が悪くなってくる\u3000\u3000２．全く見れなくなる\u3000\u3000この２つの症状のどちらかが出て、違うケーブルに交換すると治ります。HDMIを使い始めてかなりの年月が経ちますが、HDMIで故障するのはAmazonのみでした。使い捨てで、１回きりしか使わないと言うことでしたらおすすめしますが、仕事で使うor自宅で使用頻度が高いという状況下に置いては、全くおすすめしません。\n', '\n  I bought this product back in 30 April, 2017 for mirroring my laptop screen onto my tv mainly to watch anime and movies. Overall the HDMI cable is very sturdy and the output picture & sound quality is excellent. So far of usage I haven’t faced any issues personally, everything works smooth till now. If you are looking for a well built and durable HDMI cable that would last for a long duration of time along with providing top notch output.. then this is definitely the right choice to go with :)\n', ""\n  Testé en 5m et 10m :Ce câble est de bonne facture, plutôt robuste, les connecteurs semblent solides. Il est également bien flexible.Pour ce qui est de l’image, elle est parfaite et très stable, je n’ai noté aucune perte de signal… tant qu’on ne lui en demande pas trop.En effet, tant que l’on se cantonne à un signal 4K (3840x2160) en 30Hz, il n’y a aucun problème, l’accès à la gamme de couleurs complète et donc au HDR est possible. Par contre, dès que l’on veut aller plus haut (50 ou 60 Hz), il devient impossible d’aller au delà d’un signal YCbCr 4:2:0, la bande passante du cable est trop faible. Ce qui en résulte est une perte de la plage dynamique y compris en 8 bits (limitée à 16-235 plutôt que 0-255) donc des couleurs ternes et une image peu précise. Pour profiter d’un signal YCbCr 4:2:2, 4:4:4 ou encore RGB, il faudra passer par un câble avec une meilleure bande passante.Pour résumer :1080p - 60Hz : YCbCr 4:2:0 OK / YCbCr 4:2:2 OK / YCbCr 4:4:4 OK / RGB OK1440p - 30Hz :  YCbCr 4:2:0 OK / YCbCr 4:2:2 OK / YCbCr 4:4:4 OK / RGB OK1440p - 60Hz :  YCbCr 4:2:0 OK / YCbCr 4:2:2 NOK / YCbCr 4:4:4 NOK / RGB NOK4K – 30Hz : YCbCr 4:2:0 OK / YCbCr 4:2:2 OK / YCbCr 4:4:4 OK / RGB OK4K – 60Hz : YCbCr 4:2:0 OK / YCbCr 4:2:2 NOK / YCbCr 4:4:4 NOK / RGB NOKCela dit, cela ne concerne qu’un signal au delà de 30Hz donc pour la majorité des utilisations, cela ne posera pas de soucis. Un film étant en 24 images par secondes, votre lecteur passe normalement sur du 24Hz, de plus, sur un film, ce genre de compression de l'image a peu d'impact. Dans ce cas précis, il est parfait. Pour du 1080p, il est également parfait, son rapport qualité prix est imbattable. Cela posera plus de problème pour un joueur comme moi qui voudrait connecter son PC à une TV 4K HDR et profiter des jeux à 60 fps.https://www.rtings.com/tv/learn/chroma-subsampling pour plus d'informations.\n""]"
3,"['Amazon Basics Nylon-Braided 4K, 18Gbps HDMI to HDMI Cable, 3 Foot', 'Amazon Basics Nylon-Braided 4K, 18Gbps HDMI to HDMI Cable, 3 Foot', 'Amazon Basics Nylon-Braided 4K, 18Gbps HDMI to HDMI Cable, 3 Foot', 'Amazon Basics Nylon-Braided 4K, 18Gbps HDMI to HDMI Cable, 3 Foot', 'Amazon Basics Nylon-Braided 4K, 18Gbps HDMI to HDMI Cable, 3 Foot', 'Amazon Basics Nylon-Braided 4K, 18Gbps HDMI to HDMI Cable, 3 Foot', 'Amazon Basics Nylon-Braided 4K, 18Gbps HDMI to HDMI Cable, 3 Foot', 'Amazon Basics Nylon-Braided 4K, 18Gbps HDMI to HDMI Cable, 3 Foot', 'Amazon Basics Nylon-Braided 4K, 18Gbps HDMI to HDMI Cable, 3 Foot', 'Amazon Basics Nylon-Braided 4K, 18Gbps HDMI to HDMI Cable, 3 Foot', 'Amazon Basics Nylon-Braided 4K, 18Gbps HDMI to HDMI Cable, 3 Foot', 'Amazon Basics Nylon-Braided 4K, 18Gbps HDMI to HDMI Cable, 3 Foot', 'Amazon Basics Nylon-Braided 4K, 18Gbps HDMI to HDMI Cable, 3 Foot']","[3, 1, 1, 1, 2, 4, 5, 5, 5, 5, 5, 5, 5]","[96, 98, 74, 49, 37, 28, 27, 22, 22, 2, 2, 15, 1]","['\n  Hard to tell in the default display photo, but this cable is VERY thick. I’d say about double or even triple the thickness of a standard HDMI cable.Not a negative review by any means, just a warning for other potential buyers who thought the braided cable would be thinner than a standard cable. It is very thick and heavy, definitely nice but not what I was expecting.\n', '\n  Perhaps i got a defective one, but this listing very clearly says its capable of doing 4k @ 60 and mine definitely was not able to. I messed around with the settings multiple times, used the windows settings and nvidia control panel, researched possible solutions online, but no matter what i did, every time i tried  changing it to 4k higher than 30 it would not show any picture. I tried another shorter amazon basics cable and it worked at 4k @ 60 no problem. Even after testing the shorter cable and plugging this one in after with the same settings, it would not show picture until i plugged in the shorter cable again, turned it back down to 30, and then plugged the longer one back in.If you dont need that exact setting, it worked fine. However, i would mention that the plastic around the connector is so large that it might make it difficult to solidly connect to a device that for some reason has its hdmi port recessed a little too much.I will try returning it for a replacement and update my review if the next one works.\n', ""\n  Worked Great but about two disconnects and reconnects, the computers I've used (I've used many) it stopped detecting the computer.  Plug in Plug out many times and finally it worked. Painful when a room full of folks are expecting a presentation.  High Quality it is not- I purchased a higher end brand (Not Monster) and I've had it working with hundreds of in/out disconnects.  Might be good for kids room, one time connection or two but conference rooms with alot of wear and tear: no good!\n"", ""\n  This cord is trash. It worked well when I first got it....then it started being kind of static-y now when plugged in it'll cut out and my output (projector) will say there's no source, but my computer shows it's hooked up (as if the connection cuts off before it reaches the projector) and it acts like one of those cheap chargers you have to move around and sit it a certain way without touching it for it to work. And trust me, I didn't bend this cord a lot or anything. It's passed the return period by 3 days....I wish I had returned it. I was holding out like the cord wasn't that bad and now it won't connect at all and I've only had it for a month\n"", '\n  Would work great, but it is too thick for my needs. I was looking for a cord thinner than a pencil, this one is as thick as my finger.In one place the weight is shown as 0.71 lb. Another place says 11.4 ounces, which could be the same. Another place says shipping weight is 1.9 pounds. HOWEVER, this must be the weight of the 3 foot size. This 25 foot cable felt more like a 5 lb sack of flour. Way too heavy for what I need.Amazon was great about accepting this as a return. The return should get five stars.\n', '\n  Have you ever thought to yourself, ""I\'d love to use an HDMI cable to tread a tank""? This might be for you.The outside casing is incredibly tough, which is both good and bad; it\'s rather stiff and resistant to bending, but that means that once you get it the way you want it, it\'ll stay there even if your cat happens to jump up and hang from it (trust me). Also, works perfectly well for transferring HDMI data.\n', ""\n  Originally I bought a 25' HDMI. The write up did not mention that the rubber was so thick and tough that it would not make turns easily.  I bought 2 of the 10' to do the job and the braided cable makes turns easily and so works with the laptop and receiver.  No problems with the audio or video so all is well.\n"", '\n  Exactly what I needed! I am a Fleet Trainer in a Cruise Ship and I needed a reliable HDMI cable to connect my PC to LCD TV/ Projector. I prefer the braided cable because it is so flexible to run them around my devices and the HDMI cable from Amazon Basics did just that! I am happy with my purchase and I rest my trust to Amazon Basics products.\n', '\n  Wir hatten 2 Kabel bestellt um unsere PCs mit unseren Bildschirmen zu verbinden. Der Hauptgrund für diese Kabel war das gute Preis- Leistungsverhältnis. Sie kamen gut verpackt bei uns an. Jedes Kabel ist in einer Pappverpackung verpackt (siehe Bild 1) auf der dann jeweils die Länge (hier ca 3,04m) vermerkt ist. Wenn man die Verpackung öffnet sieht man das aufgerollte und mit Draht in Form gehaltene HDMI Kabel (siehe Bild 2). Auf den HDMI Adaptern sitzen Schutzkappen damit diese nicht beschädigt werden können (siehe Bild 3). Auf dem vierten Bild zeige ich nochmal genauer wie das Muster der geflochtenen Schutzschicht aussieht. Die Bild- und Tonqualität der Kabel ist hervorragend und ich kann nur zum Kauf raten.Wenn ich helfen konnte würde ich mich über positive Bewertungen freuen.\n', '\n  Does what it says. You really have to pick to think of anything wrong with this (perhaps the plug casing design is a little dated, for example) but it feels like a decent quality, it looks decent and it just plain works.Many people don’t understand that HDMI is digital so it will work or not and if it works it will give the exact same picture and sound as any cable at any price. Based on that, I don’t think you can beat this.\n', '\n  Ok when I ordered this I didn’t realise how thick this would be.  It’s similar in thickness to a cable that comes with your iron. Must admit this is a serious lead and for the money amazing value. Currently connecting pc to 4K LG tv and no issues so far.\n', ""\n  As a system integrator and AV installer I've installed hundreds of HDMI cables and found out the hard way that paying more for cables doesn't always yield better results.These Amazon Basics cables are well made, heavier gauge HDMI cables with a throughput of 18gbps.  The specs say they will support 4K video at 60 Hz.  So far I've hooked up Samsung, Sony, Sharp and LG TVs without any issues.  I've used these cables with Shaw and Telus Set Top Boxes, Marantz and Yamaha AVR's, Apple TV, PS3&4, XBox One, and other various devices,  again so far so good.These cables are thick, but not too thick.  They are fairly flexible and generally fish easily through conduit or inside walls.  Some HDMI Cables have oversized connector heads on them which sometimes creates problems with overcrowding ... not so with these Amazon Cables.  The HDMI Plugs are a little larger than some 1080P cables I used but they are still small enough to fit into most receivers and TVs.Overall these Amazon Cables are a good value and work well if your cable run is 25 feet or less.  I still use more expensive HDMI cables sometimes for high end installations with large budgets or in cases where I need a cable length longer than 25 feet.  (I wish Amazon made these cables in a 35-40ft length).I highly recommend these cables and will continue to buy them when needed.  Simply put ... they just work!\n"", '\n  A good quality cable, we’ll built and supports the latest technology. Not really much more to say with regard for the quality as it’s a digital medium.The cable itself is quite flexible and has smallish connectors which is handy if you’re aiming for clean cable management.\n']"
