,Title,Rating,Helpful,Text
0,"['BGment Blackout Curtains for Bedroom - Grommet Thermal Insulated Room Darkening Curtains for Living Room, Set of 2 Panels (42 x 63 Inch, Navy Blue)', 'BGment Blackout Curtains for Bedroom - Grommet Thermal Insulated Room Darkening Curtains for Living Room, Set of 2 Panels (42 x 63 Inch, Navy Blue)', 'BGment Blackout Curtains for Bedroom - Grommet Thermal Insulated Room Darkening Curtains for Living Room, Set of 2 Panels (42 x 63 Inch, Navy Blue)', 'BGment Blackout Curtains for Bedroom - Grommet Thermal Insulated Room Darkening Curtains for Living Room, Set of 2 Panels (42 x 63 Inch, Navy Blue)', 'BGment Blackout Curtains for Bedroom - Grommet Thermal Insulated Room Darkening Curtains for Living Room, Set of 2 Panels (42 x 63 Inch, Navy Blue)', 'BGment Blackout Curtains for Bedroom - Grommet Thermal Insulated Room Darkening Curtains for Living Room, Set of 2 Panels (42 x 63 Inch, Navy Blue)', 'BGment Blackout Curtains for Bedroom - Grommet Thermal Insulated Room Darkening Curtains for Living Room, Set of 2 Panels (42 x 63 Inch, Navy Blue)', 'BGment Blackout Curtains for Bedroom - Grommet Thermal Insulated Room Darkening Curtains for Living Room, Set of 2 Panels (42 x 63 Inch, Navy Blue)', 'BGment Blackout Curtains for Bedroom - Grommet Thermal Insulated Room Darkening Curtains for Living Room, Set of 2 Panels (42 x 63 Inch, Navy Blue)', 'BGment Blackout Curtains for Bedroom - Grommet Thermal Insulated Room Darkening Curtains for Living Room, Set of 2 Panels (42 x 63 Inch, Navy Blue)', 'BGment Blackout Curtains for Bedroom - Grommet Thermal Insulated Room Darkening Curtains for Living Room, Set of 2 Panels (42 x 63 Inch, Navy Blue)', 'BGment Blackout Curtains for Bedroom - Grommet Thermal Insulated Room Darkening Curtains for Living Room, Set of 2 Panels (42 x 63 Inch, Navy Blue)', 'BGment Blackout Curtains for Bedroom - Grommet Thermal Insulated Room Darkening Curtains for Living Room, Set of 2 Panels (42 x 63 Inch, Navy Blue)']","[4, 5, 5, 5, 5, 5, 4, 5, 5, 5, 5, 1, 4]","[207, 192, 153, 81, 84, 48, 51, 50, 8, 0, 0, 0, 0]","['\n  I am pretty impressed with these curtains. Honestly I wasn’t expecting a lot for $27. The material is soft and hangs well. No funky odors or chemical smell. I chose the Jungle Green color and I think it’s a beautiful color and represented well by the color on screen. It does make the room quite a bit darker than the curtains I previously had, but I wouldn’t call them “black out” curtains. However, they offer the perfect amount of darkening for me. Our previous curtains kept the room too bright for our baby to settle down for nap and these work just right. Our windows are unshaded and south facing so they get blasted with light and you can see from my pictures that the curtains work really well to cut the brightness a lot.My only disappointment with these is that the backside of the curtain is the same color, meaning that all that sunlight is absorbed into the dark curtain fabric and they get HOT. It holds the heat a lot more than it would have if the backside had been a lighter color (say a cream or beige). So I wouldn’t necessarily call these thermal curtains. That said, I think that the daytime room temperature has actually gone down from when we had our other curtains and I haven’t noticed a night chill at all (my bed is directly underneath the windows) so I think they do offer a certain degree of insulation - much better than our old set of curtains. Also, I would have rather had fabric tie backs than these metallic tassel ones, but that’s just personal preference.Overall, I’m very impressed with them and plan on buying more sets for the rest of our home. I don’t think you can beat them for the price.\n', '\n  Nice quality.  Tumble dry to remove wrinkles quickly.  The yellow is very bright .... French’s Mustard yellow.  I was expecting a bit Less intense color but the color worked quite well.\n', '\n  We have been battling our neighbors motion light for years, I have tried all kinds curtains and blinds. I bought these a couple of weeks ago and these curtains are the best, we have had some major winds the past couple of weeks which usually means a light show all night long, with these curtains there was no light coming through, our bedroom was like a dark cave. I wish I had these curtains when I use to worked the midnight shifts. The price is great and they work as advertised.\n', ""\n  The curtains are lovely. Beautiful, soft, and good quality. I love the Orange Red color, exactly what I wanted for my living room. They did come with a few wrinkles, but that wasn't a problem for me. Also, for me, these block out the sun in my living room, which is funny, because I wasn't expecting complete block out from reading other reviews. As you see in the picture, the living room is dark using these curtains, and this was during the day where the sun was it's brightest. This I believe will also help me out temp wise, because the sun use to shine so full and bright in that window, it would warm up my living room quickly. I really love these curtains, and I'm very glad I brought these instead of the other brands I was considering. I will eventually purchase another pair for my bedroom. I would recommend these to others.\n"", ""\n  Second best purchase I have made for my house!! (The 1st was a hot tub) I get morning sun directly in my window, which is fantastic during the week to help me wake up, but on the weekends makes sleeping in completely impossible. I bought a double curtain rod, some sheers for the back and put these on the front. I got the light grey ones, so I expected them to do ok but not necessarily great. They completely block the light - the only reflected light I get is at the top and base of the curtains (since they don't touch the wall). Once the sun passes my window, it gets nearly as dark as night. Super Happy and would absolutely buy again!\n"", ""\n  (The product reviewed is on the left in the above image) These are soft, durable, and of quality material. First I used them in my common areas in the summer to block the cool A/C air from escaping my living room into my non-temperature controlled kitchen. It was successful in this way. Then, after my baby was born, we used them in our bedroom, where we all sleep, because he wouldn't take naps during the day (the 8 week old kid knows light means AWAKE). Amazingly, he'll nap now because these curtains give the illusion that it's night time!! God send. I thought the price was very fair. I paid $20 total, I think, for 2 panels. My only complaint is that I don't think these are emerald green; they are darker and much more of a forest green, which bums me out a bit. Regardless, they've been SO useful, so helpful. Totally recommended.\n"", ""\n  These are good light blockers.  NOT great.  Have used others from WalMart or Target that performed better.  However, I would say these look a lot better than the big box stores version.  The seams appear durable enough, and the grommets are adequately pressed.  There was one little flaw of what appeared to be a mild burned area (?), but it's hidden out of sight.They work well enough and we appreciate the color selection.  The photos are pretty close to the actual material color.\n"", ""\n  Beautiful, rich shade. I bought one set to install on rod between living and dining rooms. I only wish the header on the back side of the grommets was finished with the same fabric as the rest of the drape - the white on the back side of the grommeted header is visible from the dining room, so I had to purchase another set of the same drapes and install the four panels back-to-back on the rod between the two rooms. If the drapes were being hung on windows, the white grommeted backing material on the header would not be visible. Otherwise, the drapes are beautiful, look very expensive, and the dark red shade is very rich-looking. Overall, I'm very pleased with my purchase.\n"", '\n  Not as Dark as they say &  i wanted I could not return I lost the package got tosses with out me knowing so hear they sit... If i had the package they would have gone back\n', '\n  These drapes are great- definitely keeping the light and cold out. My husband works nights and he can sleep during the day with no problem....it’s really dark. I bought 2 pair for nice fullness. I haven’t steamed them yet as I was just anxious to get up and the holidays were upon us. However the wrinkles have fallen out by about 90%. I will still steam- nice and heavy yet satiny feel of this fabric. I got them at a sale price which was a bonus ( not huge sale- but nice) I researched black out drapes for at least 3 hours and chose these. I definitely recommend them. I can’t believe how they block out the sound as well- we live on the major street in our city!\n', ""\n  Ordered the burgundy curtains and they work perfectly. The picture is a little deceptive.. It almost looks as though there is light streaming in but I swear they block all the light (I think my camera just enhances the light). The curtains are made of a rich, thick, and soft material and block light VERY WELL. Little tip.. Order probably 15-20cm bigger than your window size (width) to help block the bleeding light from the sides of the curtains. I'm very sensitive to light when I sleep and now I sleep like a baby. SO HAPPY with the purchase!\n"", ""\n  Nice and thick and good quality curtains. Would recommend purchasimng and we'll be looking forward to the deals to repurchase again. Yes they block out light and these are light gray😍Note... check for hole in them, found out of 2 sets there was holes in 2 panel's and see tell hung in sunlight....Flash sale: Other 2 sets have got have pull marks in every panel and has asked for refund...\n"", ""\n  It does seem that over the months our sleep has improved, and our room is definitely warmer than another room that does not have these (yet). I say it's performing very well. It doesn't block out light 100%, but does well enough that you will still be pleased.\n""]"
1,"['DWCN Room Darkening Blackout Curtains Thermal Insulated Curtain for Bedroom Grommet Window Curtain Panel 42 x 63 Inch, Set of 2 Panels,Thick Light Grey Curtains', 'DWCN Room Darkening Blackout Curtains Thermal Insulated Curtain for Bedroom Grommet Window Curtain Panel 42 x 63 Inch, Set of 2 Panels,Thick Light Grey Curtains', 'DWCN Room Darkening Blackout Curtains Thermal Insulated Curtain for Bedroom Grommet Window Curtain Panel 42 x 63 Inch, Set of 2 Panels,Thick Light Grey Curtains', 'DWCN Room Darkening Blackout Curtains Thermal Insulated Curtain for Bedroom Grommet Window Curtain Panel 42 x 63 Inch, Set of 2 Panels,Thick Light Grey Curtains', 'DWCN Room Darkening Blackout Curtains Thermal Insulated Curtain for Bedroom Grommet Window Curtain Panel 42 x 63 Inch, Set of 2 Panels,Thick Light Grey Curtains', 'DWCN Room Darkening Blackout Curtains Thermal Insulated Curtain for Bedroom Grommet Window Curtain Panel 42 x 63 Inch, Set of 2 Panels,Thick Light Grey Curtains', 'DWCN Room Darkening Blackout Curtains Thermal Insulated Curtain for Bedroom Grommet Window Curtain Panel 42 x 63 Inch, Set of 2 Panels,Thick Light Grey Curtains', 'DWCN Room Darkening Blackout Curtains Thermal Insulated Curtain for Bedroom Grommet Window Curtain Panel 42 x 63 Inch, Set of 2 Panels,Thick Light Grey Curtains', 'DWCN Room Darkening Blackout Curtains Thermal Insulated Curtain for Bedroom Grommet Window Curtain Panel 42 x 63 Inch, Set of 2 Panels,Thick Light Grey Curtains', 'DWCN Room Darkening Blackout Curtains Thermal Insulated Curtain for Bedroom Grommet Window Curtain Panel 42 x 63 Inch, Set of 2 Panels,Thick Light Grey Curtains']","[5, 4, 5, 5, 3, 5, 5, 5, 5, 5]","[24, 19, 14, 13, 5, 15, 14, 10, 0, 0]","['\n  I’m pleasantly surprised by these curtains.Color:The color matched perfectly for what I needed. It is more of a mustard/marigold yellow vs true yellow or gold. Which is what I was hoping for. Pretty true to the picture on the site.Black Out:I’m not sure what people expect from “black out” curtains, but these definitely block out a lot of light. Enough for a baby to sleep and more than the picture depicts. If you’re looking to block out all light I’m not sure why you’d go with a grommet style curtain in the first place. And these are not lined on the back...they’re lined INSIDE. And I can tell you this because an iron fell and burned one lol. So there is a black plastic-like layer in between two yellow pieces. Be careful when ironing 😉Material:I had no issue with “snags” in any of the 4 panels/2 sets like some other reviews mentioned. I’ve had to purchase a 3rd, coming tomorrow, due to the ironing incident so if there is an issue I will update this review. I like the material. It doesn’t look cheap at all and feels nice. The grommets are also nice.*I hemmed these for safety in a nursery; you can see the length before and after. Likely with the longer length they would have blocked out even more length.\n', '\n  These work great to block out the direct sunlight coming through my window when the sun gets on that side if the house. Before, I was getting blinded while sitting at my desk. They do snag really easy, though. Be careful!\n', '\n  These curtains work like a champ!  We bought these for my daughters room because it must have poor insulation because its either always hot or always cold, depending on the season.  Once we put thise curtains up, we could already tell a difference in the temp in her room.  Since it is winter right now, we could already feel the curtains keeping the cold from the window out.  Very glad we bought these!\n', ""\n  I live in New England and have a sunroom at the back of my home which is surrounded on 3 sides by windows. I use the room as both an office and entertainment center.  I need curtains that 1) did not cost a fortune; 2) fit my windows; 3)  block the light when watching the television; 4) kept the heat in during the winter.  I bought 7 sets and I am very happy with them.  They were easy to put up, look great, and met all my expectations. Over Christmas, I received many compliments on the room and the curtains.  Couldn't be happier with purchase.\n"", ""\n  Just got my curtains thirty minutes ago. First, I saw the spot on the first curtain as I'm taking it out the package and then as I'm looking down I see where the seams are separating from the material. This is unacceptable!! I ordered another that's due to arrive later today. If it's like anything what I just got, get ready because I want a replacement or a refund.Update!I received the second set of curtains later that day. This set was much better than the first. No separated seams in the material; however, the they are very, very wrinkled. Hubby wants to keep both sets rather than send the other back. I really hate keeping merchandise that is flawed.\n"", '\n  These curtains really darken the room.  The fabric is nice, color was consistent.  I bought 6 and they were all consistent with color and length.\n', '\n  These are amazing! I bought white, so I feared that the light color would not block out the sun. They block out all light! They are a very good quality.\n', '\n  These are amazing. I put them up one night the next morning I walked past the room and I thought the door was closed at first glance because the room was that dark. Very thick and nice color to them.  Sooo happy with these and such a good deal!\n', '\n  Drapes are exactly as described and better than expected. Bought these to replace our blinds on our trailer and the first night was so wonderfully dark. Highly recommend and will buy again.\n', '\n  These curtains are exactly what I was looking for!\n']"
2,"['Rutterllow Blackout Curtains for Bedroom, Thermal Insulated Room Darkening Curtains 2 Panels for Living Room, Grommet Top (42x63 Inch, Black)', 'Rutterllow Blackout Curtains for Bedroom, Thermal Insulated Room Darkening Curtains 2 Panels for Living Room, Grommet Top (42x63 Inch, Black)', 'Rutterllow Blackout Curtains for Bedroom, Thermal Insulated Room Darkening Curtains 2 Panels for Living Room, Grommet Top (42x63 Inch, Black)', 'Rutterllow Blackout Curtains for Bedroom, Thermal Insulated Room Darkening Curtains 2 Panels for Living Room, Grommet Top (42x63 Inch, Black)', 'Rutterllow Blackout Curtains for Bedroom, Thermal Insulated Room Darkening Curtains 2 Panels for Living Room, Grommet Top (42x63 Inch, Black)', 'Rutterllow Blackout Curtains for Bedroom, Thermal Insulated Room Darkening Curtains 2 Panels for Living Room, Grommet Top (42x63 Inch, Black)', 'Rutterllow Blackout Curtains for Bedroom, Thermal Insulated Room Darkening Curtains 2 Panels for Living Room, Grommet Top (42x63 Inch, Black)', 'Rutterllow Blackout Curtains for Bedroom, Thermal Insulated Room Darkening Curtains 2 Panels for Living Room, Grommet Top (42x63 Inch, Black)']","[5, 5, 5, 4, 5, 5, 4, 4]","[16, 12, 57, 4, 4, 6, 5, 1]","[""\n  Considering the price point for these I was just hoping they would at least darken up the room but they truly do black out the room! They're also soft to touch and they are the perfect length for a standard window\n"", '\n  For the price I wasn’t expecting much. But I was super impressed when I received them. They are really nice curtains and you get both panels. It’s a real steal. I highly recommend them! They black out the room better than any of the other brands I have tried for a lot cheaper price. The material isn’t low quality. They are exactly what I had been wanting.\n', '\n  Love it\n', ""\n  Excellent price for the quality. The curtains are some of the thinnest 'blackout' curtains I've ever owned.  I use a pull-down shade in combination with the curtains, and I do not see much of a difference when I use them together. I hoped the curtains would help block the residual light coming from the sides of the shade, but I haven't noticed that. Also, I bought a lighter shade of curtain, so maybe that's part of the problem. I would suggest others go with darker colors to block out the light.\n"", '\n  These are the real deal.  The room faces afternoon sun and gets HOT!  You can’t tell day from night with these.  It is still warm in the room but I can absolutely fee a difference.  Literally no light gets in except the frame around them.  It’s more of a glow.  I am really impressed with these.  We got the dark gray.\n', '\n  Loved my curtains!! They were easy to hang and the color was spot on and there was no wrinkles. I sleep in a dark room just like I wanted!!\n', '\n  I used this curtain over a bedroom window in which the sun hits it for most of the day. It does block most of the sunlight and let’s say it does enough for a decent sleep in early morning hours. The material is good for the price and doesn’t feel cheap or anything that will deteriorate soon.\n', '\n  I like the depth these add to my room. They help it feel more lived-in and spacious, which is surprising because I actually moved things around so there is a bit less walk-space to make room for them. With the shutter blinds I already had in place they keep out most of the daylight, though if the shutters are open and these are closed I see more light than I want. My room did feel a bit more insulated against the cold last night (first night having them up), though not being able to use a space heater means I still have to layer my blankets wisely. They also feel smoother than I anticipated, which makes them more pleasurable to open and close. I am glad I got them. Definitely worth the price.\n']"
3,[],[],[],[]
